id,text,foot_notes
2192,"Қиямет күні; (Алла, кәпірлерге): “Өздеріңнің, Менің шеріктерім деп ойлағандарыңды шақырыңдар” дейді. Сонда оларды шақырады. Бірақ олар өздеріне жауап бермейді. Сондай-ақ олардың араларына бір кәтерлі орын жасаймыз. (С. 166-А.)",
2193,"Күнәкарлар; тозақ отын көріп, сонда өздерінің оған түсетіндіктерін сезеді. Бірақ, одан бұрылар жер таба алмайды.",
2194,"Расында осы Құранды Адам баласы үшін әр нәрсені ашық-ашық баян еттік. Ал Адам баласы, көп нәрселерде жанжалшыл.",
2195,"Қашан да Адам баласына тура жетекші келсе, оларды иман келтірулеріне және Раббыларынан жарылқау тілеулеріне кедергі болған нәрсе, бұрынғыларға келген апаттың ; өздеріне келуін немесе азаптың қарсы алдарына келуін тосулары.",
2196,"Негізінде елшілерді қуандыру, қорқыту үшін ғана жібердік. Кәпірлер, бос нәрселер арқылы шындықты төмендетуге жағаласады. Әрі апаттарымызды және ескерткен нәрселерімізді тәлкекке алады.",
2197,"Раббыларының аяттары арқылы үгіттеліп, одан бет бұрған және бұрынғы өз қолымен істегендерін ұмытқан кісілерден кім залымырақ? Расында олардың жүректеріне оны түсінбейтін қалтқы және де құлақтарына кереңдік пайда қылдық. (Мұхаммед Ғ.С. ) оларды туралыққа шақырсаң да әрине мүлде жолға келмейді.",
2198,"Раббың ; өте жарылқаушы, мәрхамет иесі. Егер оларды қылықтарының салдарынан қолға алатын болса, әрине оларға азапты тездетер еді. Дегенмен олар үшін белгілі бір мерзім бар. О заман олар, Алладан өзге паналайтын жер таба алмайды.",
2199,"Олар зұлымдық еткен заманда, сол кенттерді жоқ еттік. Солардың жоқ етілулері үшін де мерзім белгілеген едік. ( Мұса Ғ.С. Алланың Берген зор ғылымына ие құлы Хызыр Ғ.С. ға, екі теңіздің бірлескен жерінде кездесу үшін ; Юшақ ұлы Нұн екеуі жолға шығады. Б.Ж.М.Р.К.)",
2200,Сол уақытта Мұса (Ғ.С.) жігітіне: “Екі теңіздің қосылған жеріне дейін тоқтамаймын. Немесе жүріспен жылдар өткіземін” деді.,
2201,"Екеуі екі теңіздің құйғанына жеткен кезде, балықтарын ұмытты. Сонда балық , сырғып барып , теңізден жол алды.",
2202,"Екеуі ілгерілеп барған кезде, Мұса (Ғ.С.) жігітіне: “Азығымызды әкелші ; әрине осы сапарымызда шаршадық” деді.",
2203,"“Көрдің бе? Тасқа дем алғанда, балықты ұмытқан екмін. Маған оны айтуды шайтан-ақ ұмыттырды. Ол таңғажайып түрде теңізде жол алды” деді.",
2204,"(Мұса Ғ.С.): “Міне іздегеніміз осы” деп, екеуі ізінше қайта қайтты.",
2205,"Сонда екеуі; өз тарапымыздан игілік беріп, өз қасымыздан ғылым үйреткен құлдарымыздан бірін тапты.",
2206,"Мұса, (Ғ.С.) о кісіге: “Саған үйретілген даналықтан маған да үйретуің үшін саған ерейін бе?”,-деді.",
2207,“Расында сен менімен бірге болуға шыдая алмайсың” деді.,
2208,"“Ішкі сырын толық білмейтін нәрсеге қалай сабыр ете аласың ?”,-(деді.)",
2209,"(Мұса Ғ.С.). “Алла қаласа, мені сабырлы табарсың . Сондай-ақ саған ешбір істе қарсы келмеймін” деді.",
2210,"“Ал онда маған ілессең, саған айтпайынша, менен еш нәрсе сұрама” деді.",
2211,"Сөйтіп, екеуі жолға шықты да кемеге түсіп, оны тесе бастады. (Мұса Ғ.С.): “Кемедегілерді суға батыру үшін тестің бе? Рас орынсыз істедің” деі.",
2212,(О кісі): “Мен саған менімен бірге әсте сабыр ете алмайсың демедім бе?” деді.,
2213,(Мұса Ғ.С.): “Ұмытқан нәрсемді есепке алма. Маған ісімде қолайсыздық тудырма” деді.,
2214,"Екеуі тағы жолға шықты. Бір ұл бала кездесіп еді, (о кісі) оны өлтірді. (Мұса Ғ.С.): “Кісі өлтірмеген жазықсыз біреуді өлтірдің бе? Рас жаман іс істедің” деді.",
2215,"“Сен менімен бірге жүруге әсте шыдая алмайсың демедім бі?”, - деді.",
2216,"“Егер бұдан кейін бір нәрсе сұрасам, тіпті мені жолдас қылма. Рас менен саған сылтау табылды” деді.",
2217,"Сонда екеуі тағы жүріп, бір Кент халқына барып, тұрғындарынан тамақ сұрады. Олар, екеуін қонақ қылудан бас тартты. Сонда екеуі, ол жердегі жығылғалы тұрған тамды көріп; оны жөндеді. (Мұса Ғ.С.): “Егер қаласаң, бұған жалақы алар едің” деді.",
2218,"“Міне осы, мені мен сен екеуміздің арамыздың айрылуы. Ал енді саған сабыр ете алмаған нәрселеріңнің сырын айтайын” деді.",
2219,"“Кеме теңізде кәсіп істеген кембағалдардікі еді. Оны ақаулы еткім келді. Өйкені, ар жақтарында, әр (мықты) кемені тартып алатын патша бар еді”",
2220,"“Ал баланың мүмін әке-шешесі бар еді. Оның, әке-шешесін бас тарттыруға, қарсылыққа зорлауынан қорықтық”",
2221,"“Раббылары, оның орнына өздеріне одан тағы таза, тағы мәрхаметті бір бала беруін қаладық”",
2222,"“Ал енді там; бұл қаладағы екі жетім баланікі болып, оның астында ол екеуіне тән қазына бар еді. Сондай-ақ әке-шешелері түзу кісі болғандықтан Раббың, ол екеуі ержетіп, қазыналарын шығарып алуын қалады. Бұл Раббыңнан бір мәрхамет еді. Сондай-ақ бұны мен өздігімнен істемедім. Міне осы, сенің сабыр ете алмаған істерің”",
2223,"(Мұхаммед Ғ.С.) олар сенен Зұлқарнайынды сұрайды: “Сендерге оның жайын түсіндірейін” де. (Бұл Зұлқарнайын “екі мүйізді” деген ұғымда. Екі тұлымы немесе тажында екі мүйізі болғандықтан атанған. Аты, Ескендер, пайғамбар емес. Батыс, шығысты кезген; Рұм, фарсы делінген т.б. рауаяттар бар. Ж.Б.М.К.Р.)",
2224,Негізінде Зұлқарнайынды жер жүзінде күшке ие қылдық. Өзіне әр істе қолайлық бердік.,
2225,О да бір шара қолданды.,
2226,"Тіпті күн бататын жерге жеткен сәтте, оны қара балшықты бұлаққа батқан түрде көрді. Сондай-ақ сол маңнан бір ел тапты. “Әй Зұлқарнайын, не (ол елді) азаптарсың немесе оларға жақсылық істерсің” дедік.",
2227,"Оларға: “Енді кім зұлымдық қылса, оны жазаландырамыз. Сосын Раббына айдалып, Рабы оған қатты жаза береді” деді.",
2228,"“Ал енді кім иман келтіріп, түзу іс істесе, оған жақсы сыйлық бар. Сондай-ақ жеңіл іс бұйырамыз”",
2229,Бұдан кейін (шығысқа қарай) шара қолданды.,
2230,"Тіпті күн шығатын жерге жеткен кезде, оның бір елдің үстінде туғанын көрді. Ол елге күннен өзге перде жасамаған едік. (Баспаналары, киімдері жоқ еді.)",
2231,Осындай еді. Расында оның не істегенін толық білеміз.,
2232,Содан кейін тағы да бір шара қолданды.,
2233,"Тіпті екі таудың арасына жеткен кезде, сөзді түсіне алмайтын бір ел тапты.",
2234,"Олар: “Әй Зұлқарнайын! Яжұж, Мажұж бұл жерде бұзақылық істеуде. Саған салық төлесек, олар мен біздің арамызға бір бөгет жасайсың ба?” деді. (Бұл; Азербайжан таулары. Яжұж, Мажұж; Япас ұрпағынан болған бір бұзақы ел. Ж.Б.Р.К.М.Х.)",
2235,Зұлқарнайын: “Раббымның маған бергені бес артық. Сендер маған күш көмегін қылыңдар да сендер мен олардың арасына бір бөгет жасайын” деді.,
2236,"“Маған темір тақтайлар әкеліңдер” деді. Екі беттің арасы теңелген кезде: “Көріктеңдер” деді. Ол от болған сәтте: “Маған еріген мыс әкеліңдер, үстіне құяйын” деді.",
2237,"Сонда олар, оны аса алмады да тесе алмады…",
2238,"(Зұлқарнайын): “Бұл Раббымнан бір мәрхамет. Қашан Раббымның уәдесі (қиямет) келсе, оны жермен-жексен қылады. Сондай-ақ Раббымның уәдесі хақ” деді.",
2239,"Қиямет күні, оларды бір-біріне қосылған түрде қоямыз да Сұр үріліп, оларды тұтас жинаймыз.",
2240,Ол күні тозақты кәпірлерге ақын көрсетеміз.,
2241,Олар насихатымнан көздері перделі және құлақтары ести алмайтындар.,
2242,"Кәпірлер, Мені қойып құлдарымды ие етуді ойлай ма? Расында тозақты, кәпірлерге қонақ үй етіп, әзірледік.",
2243,"(Мұхаммед Ғ.С.): “Сендерге қылығы бойынша зиянға ұшыраушылардың хабарын берейін бе?”, - де.",
2244,Олар дүниедегі еңбектері зая кеткендер. Өздері болса: “Рас жақсы іс істедік” деп ойлайды.,
2245,"Міне олар, Раббыларының аяттарына әрі Раббыларына жолығуға қарсы келгендер. Сондықтан еңбектері еш болған. Сонда оларға қиямет күні еш мән бермейміз.",
2246,"Олар қарсы келіп, аяттарымызды, елшілерімізді тәлкекке алғандықтары себепті жазалары тозақ.",
2247,"Расында иман келтіріп, түзу іс істегендер үшін Пердәуіс жаннаты, қонақ үй болады.",
2248,Олар онда мәңгі қалады да өздері одан ауысуды қаламайды.,
2249,"(Мұхаммед Ғ.С.): “Егер Раббымның сөздері (жазылу) үшін теңіз сия болса, тағы бір сондайды көмекке әкелсек те, әлбетте Раббымның сөздері таусылудан бұрын теңіз таусылар еді” де.",
2250,"“Шынында мен де сендер сияқты адаммын. Маған Тәңірлерің бір-ақ Тәңір екендігі уәһи етілуде. Сондай-ақ кім Раббына жолығуды үміт етсе, сонда түзу іс істеп, Раббына істеген құлшылығында; Оған ешкімді ортақ етпесін” де.",
2251,Кәф. Һә. Йа. Аин. Сад.,
2252,(Мұхаммед Ғ.С.) Бұл Раббыңның құлы Зәкеря (Ғ.С.) ға мәрхаметінің естелігі.,
2253,"Ал бір заманда ол, Раббына қүпия дауыспен жалбарынған еді.",
2254,"""Раббым! Сүйегім қаусап, басым ағарған. Дегенмен саған қойған тілегім, босқа кетпеген еді"" деді.",
2255,"""Шынында мен өзімнен кейінгі жақындарымнан (мұрагер бола алмайды деп) қорқамын. Сондай-ақ жұбайым кемпір. Сонда да маған өз қасыңнан бір мұрагер бере көр.!""",
2256,"""Ол, маған да мұрагер болып, әрі Яғқұп ұрпағына да мұрагер болсын. Раббым оны ризалығыңа бөле!""",
2257,"(Алла): ""Әй Зәкеря! Расында сені бір ұл арқылы қуантамыз. Аты Яхя. Бұрын оған ешкімді аттас қылмаған едік.""",
2258,"(Зәкеря): ""Раббым! Менің ұлым қалайша болады! Жұбайым кемпір. Расында өзім де кәріліктен қурадым"" деді.",
2259,"""Міне солайша"" деді. Бірақ Раббың: ""Ол маған оңай. Өйткені, сені бұрын жаратқанымда дәнеңе емес едің"" деді.",
2260,"""Раббым маған бір белгі бер"" деді. (Алла): ""Сенің белгің: сап-сау бола тұра үш тәулік адамдармен сөйлесе алмайсың"" деді.",
2261,"Сонда (Зәкеря) михраптан шығып, қауымына: ""Ертелі-кеш Алланы дәріптеңдер"" деп нұсқады.",
2262,"""Әй Яхя! Кітапты мықты үста"" деп, сәбилігінде-ақ даналық берген едік.",
2263,"Әрі оған өз қасымыздан мұлайымдық, кінәдан тазалық бердік. Өзі де тақуа еді.",
2264,"Әрі әке-шешесіне де мейірімді еді. Зоракер, күнәкар емес еді.",
2265,"Оған туылған күні, өлетін күні және тірі тұрғызылатын күні амандық болсын.",
2266,"(Мұхаммед Ғ.С.) Құрандағы Мәрямды айтып бер. Сол уақытта ол, түрған үйінің шығыс жағындағы бір орынға жекеленіп барды.",
2267,"Сонда олардың бер жағынан шымылдық ұстап қойған еді. Сондай-ақ оған рүхымызды (Жебірейілді) жібердік те ол, оған толық адам бейнесінде көрінді.",
2268,"(Мәрям): ""Егер сен тақуа болсаң да сенен Аллаға сиынамын"" деді.",
2269,"(Рүх): ""Мен саған бір таза бала беруге жіберілген Раббыңның елшісімін"" деді.",
2270,"Мәрям: ""Маған бір адам жүғыспаса, маған қалайша бала болады? Сондай-ақ суық жолда болмасам"" деді.",
2271,"(Жебірейіл Ғ.С.): ""Ол, солайша"" деді. Өйткені, Раббың: ""Бұл Маған оңай. Мен тараптан адам баласына бір үлгі әрі бір мәрхамет. Бұл біткен бір іс еді"" деді.",
2272,"Мәрям; ол балаға жүкті болып, соныменен ұзақ бір жерге кетті.",
2273,"Сонда оны толғақ қысып, құрма ағашының түбіне барды да: ""Әттең-ай! Мен бұдан бұрын өліп қана мүлде ұмытылып кеткен болсам еді"" деді.",
2274,"(Періште) оның астынғы жағынан: ""Кейіме, Раббың астыңнан бір бұлақ жаратты"" деп дабыстады.",
2275,"""Құрманың бұтағын өзіңе қарай сілк. Саған жас құрма түседі"" (деген үн келді.)",
2276,"Ал енді же де іш. Көз айым бол.! Егер адамдардан біреу көрсең: ""Аса қамқор Алла үшін ораза атадым. Сондықтан бүгін еш адаммен сөйлеспеймін"" де.",
2277,"Сонда баланы кетеріп еліне келді. Олар: ""Әй Мәрям! Расында сен өрескел бір нәрсе келтірдің"" деді.",
2278,"""Әй һарұнның қарындасы! (Сонымен рулас қыз.) Әкең де жаман кісі емес, шешең де жаман жолда емес еді.""",
2279,"Мәрям баланы көрсетті. Олар: ""Бесіктегі бір бөбекпен қайтып сөйлесеміз?"",- деді.",
2280,"(Бала): ""Рас мен Алланың құлымын. Маған кітап беріп, пайғамбар кылды"" деді.",
2281,"""Сондай-ақ мені кайда болсам да құтты етті де, тіршілігім бойынша намазды, зекетті орындауға бұйырды.""",
2282,"""(Мені) шешеме мейірімді етіп, бір зоракер және қиқар қылмады.""",
2283,"""Маған туылған күнімде, өлер күнімде және тірілтіліп, тұрғызылатын күнім де амандық болады.""",
2284,Міне осы: Олар шүбәланған Мәрям ұлы Ғиса (Ғ.С) жайындағы Алланың хақ сөзі.,
2285,"Алланың баласы болуы мүмкін емес. Алла (Т.) одан мүлде пәк. Ол, бір істің болуын қаласа, тек қана оған ""бол"" дейді. Сонда ол, бола қалады.",
2286,"""Күдіксіз Алла, менің де Раббым әрі сендердің де Раббыларың. Онда Оған ғана құлшылық қылыңдар. Тура жол осы.""",
2287,"Алайда, (Яһуди, Христиан) топтары өзара таласты. Қарсы болғандарға, ұлы бір күннің келуінде нендей өкініш.",
2288,"Олар, алдымызға келген күні, нақ естиді де көреді. Бірақ залымдар, бүгін ашық түрде адасуда.",
2289,"(Мұхаммед Ғ.С.) ол сенбей селқостықта болғандарға, олар үшін іс бітіп кететін қасырет күнін ескерт.",
2290,Расында біз жерге де ондағыларға да мұрагер боламыз. Және олар біз жаққа қайтарылады.,
2291,(Мұхаммед Ғ.С.) Кітаптағы Ыбырайым (Ғ.С.) ды есіңе ал. Негізінде ол турашыл пайғамбар еді.,
2292,"Сол уақытта әкесіне: ""Әй әкетайым! Естімес, көрмес, сондай-ақ өзіңе бір пайдасы жоқ нәрсеге неге шоқынасың?"",- деді.",
2293,"""Әй әкетайым! Расында маған, саған келмеген білім келді. Сондықтан маған ілес. Сені тура жолға салайын.""",
2294,"""Әй әкетайым! Шайтанға шоқынба! Өйткені, шайтан, Аллаға қарсы болған.""",
2295,"Әй әкетайым! Сені Алла жағынан азап қолға алып, шайтанға дос болып, қалуыңнан қорқамын.",
2296,"Әкесі: ""Әй Ыбырайым! Сен тәңірлерімнен бет бұрасың ба? Егер, оны қоймасаң, әрине сені таспен атамын. Сондай-ақ өзің менен аулақ бол"" деді.",
2297,"(Ыбырайым Ғ.С.): ""Саған амандық болсын. Сені Раббымның жарылқауын тілеймін. Өйткені, Ол, өте мейірімді"" деді.",
2298,"Мен сендерден де Алладан өзге шоқынғандарыңнан да араны ашып, Раббыма жалбарынамын. Сондай-ақ Раббыма жалбарынсам, бос қалмауымнан үміткермін.""",
2299,"(Ыбырайым Ғ.С.) олардан; олардың Алладан өзге табынғандарынан да ажыраған кезде, оған Ысхақ пен Яғқұпты беріп, әрқайсысын пайғамбар қылдық.",
2300,"Оларға рахметімізден бағыш етіп, оларды әр тілде жоғары бағалаттық.",
2301,"(Мұхаммед Ғ.С.) Кітаптағы Мұса (Ғ.С.) ны есіңе ал. Рас ол, ықыласты әрі жіберілген пайғамбар еді.",
2302,"Оған Тұр тауының оң жағынан дабыстап, сөйлесу үшін өзімізге жақындаттық.",
2303,"Әрі мәрхаметімізбен туысы Һарұнды, өзіне пайғамбар етіп бердік.",
2304,"(Мұхаммед Ғ.С.) Құрандағы Ысмайыл (Ғ.С.) ды есіңе ал. Шынында ол, уәдесіне берік әрі жіберілген бір пайғамбар еді.",
2305,"Үй-ішіне, намазбен зекетті орындауды бұйыратын еді. Сондай-ақ Раббының қасында сүйікті еді.",
2306,"(Мұхаммед Ғ.С.) Кітаптағы Ыдырыс (Ғ.С.) ды ескер. Өйткені, ол шыншыл бір пайғамбар еді.",
2307,"Оны жоғары орынға көтердік. (Пайғамбарлық дәрежесіне, Аллаға жақындауға, жаннатқа және көкке шығаруға. Ж.Б.Р.К.Х.)",
2308,"Міне бұлар, Алла, өздерін нығметке бөлеген пайғамбарлар. Адам (Ғ.С.) ның және Нұх (Ғ.С.) пен бірге (кемеде) тасығандарымыздың ұрпағынан әрі Ыбырайым (Ғ.С.) және Исраилдың, ұрпағынан тура жол көрсетіп, таңдаған кісілерімізден. Оларға Алланың аяттары оқылған сәтте, жылаған бойда сәждеге жығылады (Сәжде аяты)",
2309,"Бұл пайғамбарлардан кейін орындарына, намазды қойып, нәпсілеріне ергендер келді. Олар жақында (қияметте) адасуларының сазайын тартады.",
2310,"Бірақ кім тәубе қылып, ииан келтірген түрде түзу іс істесе, міне солар ешбір әділетсіздікке ұшырамай жаннатқа кіреді.",
2311,"Ол, аса қамқор Алланың құпия түрде құлдарына уәде еткен (Ғадын) жаннаттары. Расында Оның уәдесі орындалады.",
2312,Олар жаннатта сәлемнен басқа бос сөз естімейді. Және оларға жаннатта ертелі-кеш несібе бар.,
