id,text,foot_notes
964,Расында сендерді жер жүзіне орналастырып өздеріңе онда күн көрістер жасадық. Нендей аз шүкір етесіңдер.,
965,Расында сендерді жаратып сонан кейін бейнеледік. Сонан соң періштелерге: «Адамға сәжде қылындар!» дедік. Барлығы сәжде етті. Бірақ Ібіліс сәжде етпеді де сәжде етушілерден де болмады.,
966,"(Алла Ібіліске): «Саған, Мен әмір еткенде сені сәжде етуден не тыйды?» деді. Ол: «Мен одан артықпын. Мені оттан жаратып, оны балшықтан жараттың» деді.",
967,"(Алла): «Онда ол жерден түс. Онда сенің менменсуіңе болмайды. Дереу шық, қор болушылардансың» деді",
968,(Ібіліс): «Қайта тірілетін күнге дейін мұрса бер» деді.,
969,(Алла): « Шынында мұрса берілгендерденсің» деді.,
970,"(Ібіліс): «Ендеше, мені қаңғыртқаның себепті әлбетте мен де оларға қарсы Сенің тура жолыңда отырып аламын» деді.",
971,"«Сонан соң оларға алды- артына, оң-солынан келемін де олардың көбін шүкір етушілерден тапапйсың» деді.",
972,"(Алла): «Қорланып қуылған түрде ол жерден шық. Әрине олардан кім саған ілессе, сендердің барлықтарыңмен тозақты толтырамын» деді.",
973,(Алла): «Әй Адам! Сен және жұбайың жаннатқа орналас. Екеуің қалағандарыңша жеңдер. Алайда осы ағашқа жоламаңдар. Сонда злымдардан боласыңдар»,
974,"Сонда шайтан, ол екеуінің ұятты жерлерінің ашылуы үшін азғырды да: «Раббыларың сендерді осы ағаштан, екеуің періште болып кетеді немесе мәңгі қалып қояды деп ғана тыйған» деді.",
975,"Және: «Шынында мен екеуіді үгіттеушілерденмін» деп, ант ішті.",
976,"Сөйтіп екеуін алдап түсірді. Сонда екеуі ағаштан татқан сәтте, ұятты жерлері ашылып кетті. Кеуі жаннат жапырақтарынан үстеріне жапсыра бастады. Раббылары екеуіне: «Екеулеріңді осы ағаштан тыймап па едім? Расында шайтан сендерге ашық дұшпан демеп пе едім?»,- деп дабыстады.",
977,"(Адам ата мен Хауа ана): «Раббымыз, біз өзімізге кесір істедік. Егер Сен бізді жарылқап, мәрхамет етпесең әлбетте зиян етушілерден боламыз» деді.",
978,(Алла): «(Жаннаттан) бір-біріңе дұшпан болып түсіңдер. Сендерге жер жүзінде бір мерзімге дейін тұрақ және пайдалану бар» деді.,
979,"«Ол жерде тіршілік етесіңдер де, ол жерде өлесіңдер. Және ол жерден қайта шығарыласыңдар» деді.",
980,Әй адам баласы! Ұятты жерлеріңді жабу үшін киім және сәндік- бұйым түсірдік. (Жараттық) Негізінде тақуалық киімі жақсы. Солар Алланың белгілері. Әрине түсінерсіңдер.,
981,"Әй адам баласы! Шайтан, ата-аналарыңның ұятты жерлерін көрсету үшін киімдерін шешіп, жаннаттан шығарған сияқты сендерге де сұмдық жасамасын. Өйткені, ол және оның сыбайластары, сендер оларды көрмеген жерден көреді. Шайтандарды иман келтірмейтіндерге дос қылдық.",
982,"Олар қашан бір арсыздық істесе: «Аталарымызды осы жолда таптық, мұны бізге Алла бұйырды» деді. (Мұхаммед Ғ.С.): «Шынында Алла арсыздыққа бұйырмайды. Аллаға білмеген нәрселеріңді айтасыңдар ма?»,- де.",
983,"(Мұхаммед Ғ.С.): «Раббым әділдікті бұйырды. Әрбір құлшылық орнында бет алыстарыңды туралап, діндеріңді Аллаға арнап отырып, Одан тілеңдер. Сендер бастапқы жаратқанындай және Оған қайтасыңдар» де.",
984,"(Алла, адам баласы ның) бір тобын тура жолға салды. Және бір тобы да адасуға тиісті болды.Өйткені олар, Алладан өзге шайтандарды дос тұтты да олар өздерін тура жолдамыз деп есптеді.",
985,"(Жаһилиет дәуірінде, араптар, Кағбаны жалаңаш айналып, және ет, май жемеген.) Әй адам балалары! Әрбір құлшылық орнында зейнеттеріңді алыңдар. (Киініңдер) Және жеңдер, ішіңдер де ысырап етпеңдер. Күдіксіз Алла ысырап етушілерді сүймейді.",
986,(Мұхаммед Ғ.С.): «Алланың құлдарына көркем етіп шығарған нәрсесін (киімін) және берген жақсы несібелерін кім арам етті» де. «Бұл несібе дүние тіршілігінде иман келтіргендер үшін. (Алайда кәпірлер де ортақ) Қиямет күні мүміндерге ғана» де. Білген елге аяттарды өстіп түсіндіреміз.,
987,"«Күдіксіз Раббым, арсыздықтарды, Оның көрнеу, көмесін, күнәны, орынсыз озбырлықты, оған байланысты ешбір дәлел түсірілмеген нәрсені Аллаға серік қосуларыңды және білмейтін нәрселеріңді Аллаға қарсы сөйлеулеріңді арам қылды» де (Мұхаммед Ғ.С.).",
988,"Әр әлеуметтің белгілі бір мерзімі бар. Олар, сол мерзімі келген сәтте, бір дем кешікпейді де ілгерлемейді.",
989,"Әй адам балалары! Егер сендерге іштеріңнен өздеріңе аяттарымды түсіндіретін елшілер келсе, сонда біреу сақсынып, өзін түзелтсе, оларға бір қорқу да жоқ әрі олар қайғырмайды.",
990,"Сондай аяттарымызды өтірік дегендер, өздерін одан зор санағандар, солар, тозақтық. Олар онда ұдайы қалушылар.",
991,"Алланы өтірік қаралаған немесе Оның аяттарын жасынға шығарған біреуден кім залымырақ? Олар Кітаптағы тиесілеріне қауышады. Ақыр елшілеріміз олардың жандарын алуға келіп: «Алладан өзге сиынатындарың қайда?»,- дегенде: «Олар бізден ғайып болды» деп, өздерінің қарсы болғандықтарына өздері айғақ болды.",
992,"(Алла қияметте оларға): «Сендерден бұрыңғы өткен, тозақтағы жын және адамдар тобының ішіне кіріңдер» дейді. Әр топ тозаққа кірген сәтте, өз туысын (алдыңғы жолдасын) қарғайды. Барлығы онда жиналғанда, артқылары, алдындағыларына: «Раббымыз! Осылар бізді адастырған. Сондықтан оларға тозақ отынан екі есе азап бер» дейді. (Алла): «Әркімге екі есе азап бар. Бірақ сендер білмейсіңдер» дейді.",
993,"Және олардың алдынғылары, артқыларына: «Сендердің бізге бір артықшыларың жоқ. Ендеше істегендеріңнің азабын татыңдар» дейді.",
994,"Күдіксіз аяттарымызды жасынға айналдырып, одан өздерін жоғары көргендерге көктің есіктері ашылмайды.. Және олар түйе иненің көзінен өткенге дейін ұжмаққа кірмейді. Күнәкарларды өстіп жазаландырамыз.",
995,Оларға жаһаннамда төсек және үстерінде жамылғылар бар. Залымдарға осылайша жаза береміз.,
996,"Және иман келтіріп, ізгі іс істегендер, негізінде біреуге шамасы келетінді ғана жүктейміз. Солар жаннаттық. Олар онда мәңгі қалушы.",
997,"Олардың көңілдерінен кірбеңдікті шығарамыз, астарынан өзендер ағады. Олар: «Барлық мақтау бізді осы тура жолға салған Аллаға тән. Егер Алла бізді тура жолға салмаса еді, тура жолды таба алмайтын едік. Расында Раббымыздың елшілері, шындықты келтірген еді » дейді. Және оларға: «Міне ғамалдарың себепті мұрагері болған ұжмақтарың осы» делінген түрде дабысталады.",
998,"Ұжмақтағылар, тозақтағыларға: «Раббымыздың бізге уәде еткенін тура таптық. Сендер де Раббыларыңның уәде еткенін тура таптыңдар ма?»,- деп айғайлайды. (Олар): «Әрине» дейді. Сонда олардың араларында бір айғайшы: «Алланың қарғысы залымдарға» деп айғайлайды.",
999,"Олар, Алланың жолынан тосып, онда бір қисықтық іздейді. Және олар ахиретке де қарсы болушылар.",
1000,"(Ұжмақтағылар мен тозақтағылардың) арасында далда бар. Және «Ағраф» делінген жоғары орында екі жақтағыларды да әлпеттерінен таныйтын біреулер бар. Бұлар: «Сендерге сәлем» деп жаннаттағыларға айғайлайды. Бұлар әлі жаннатқа кірмеген, үміт ететіңдер.",
1001,"Қашан олардың көздері тозақтыктар жаққа бұрылса: «Раббымыз! Бізді залым елмен бірге қыла көрме!»,- дейді",
1002,"Ағрафтағылар тозақтағы әлпеттерінен танығандарға: «Сендерге көптіктерің және менмендіктерің пайда бермеді ме?»,- деп айғайлайды.",
1003,"(Оларға ұжмақтағыларды көрсетіп:) “Бұларға Алланың рахметі тимейді деп, ант ішкен адамдарың емес пе? Ұжмаққа кіріңдер. Сендерге қорқыныш жоқ әрі сендер қайғырмайсыңдар” (делінеді)",
1004,"Тозақтағылар, ұжмақтағыларға: “бізге суларыңнан немесе Алланың сендерге берген несібесінен төгіп жіберіңдер” деп айғайлайды. Олар: “Расында Алла, ол екеуінде кәпірлерге арам еткен” дейді.",
1005,"Олар, діндерін оын- сауыққа айналдырып, дүние тіршілігі алдағандар. Олар осы күнге жолығуларын ұмытып және аяттарымызға қарсы келгендей бүгін. Біз оларды ұмытамыз.",
1006,"Расында Біз оларға, иман келтірген қауым үшін тура жол мәрхамет түрінде бір Кітап түсіріп, оны білім жолымен айырып түсіндірдік.",
1007,"Олар оның нәтижесін (бастарына келетінін) ғана күтеді. Оның нәтижесі келген күні, оны ұмытып жүргендер: “Раббымыздың елшілері шындықты әкелген еді. Енді бізді қолдаушы бар ма? Немесе дүниеге қайтарыламыз ба? Сонда бұрыңғы істегенімізден басқаны істер едік” дейді. Расында олар өздеріне кесір істеді. Сондай-ақ олардың жасанды тәңірлері адасып жоқ болды.",
1008,"Күдіксіз Раббыларың сондай Алла, көктер мен жерді алты күнде жаратқан. Сонан кейін ғаршыны көтерілді. Бірін- бірі қуалап, күндізді бүркеген түнді және күн мен айды, жұлдыздарды да әміріне бағындырған. Сақ болыңдар! Жарату және бұйрық беру Оған тән. Өте жоғары Алла, бүкіл әлемнің Раббы.",
1009,"Раббыларыңа жалбарынып, жасырын түрде тілеңдер. Күдіксіз Ол, шектен шығушыларды жақсы көрмейді.",
1010,Жер жүзі түзетілгеннен кейін бүліншілік қылмаңдар. Және Аллаға хауіп әрі үмітпен жалбарыныңдар. Расында Алланың рахмті жақын.,
1011,"Ол сондай Алла рахметінің (жаңбырдың) алдын ала желдерді қуантушы етіп жібереді. Ауыр бұлттарды көтерген бойда, өлі (қағыр) бір мемлекетке жіберіп, сонда ол арқылы жаңбыр жаудырып, сонымен әр түрлі жемістерді шығарамыз. Осылайша өліктерді де тірілтеміз. Әрине үгіттенерсіңдер.",
1012,Жақсы жердің өсімдігі Раббының қалауы бойынша шығады. Сондай құнарсыз жерге аз нәрсе ғана шығады. ( Бұл ықылас пен ықылассыздың мысалы) Осылайша аяттарымызды шүкірлік қылатын елге айырып баян етеміз.,
1013,"Расында Нұх (Ғ.С.) ты еліне пайғамбар етіп жібердік. Сонда ол: “Әй елім! Аллаға құлшылық қылыңдар, сендердің Одан басқа тәңірлерің жоқ. Шәксіз мен сендерге келетін ұлы күннің азабынан қорқамын” деді.",
1014,Елінің бастықтары: “Әрине біз сені ашық адасуда көреміз” деді.,
1015,“Әй елім! Мен де ешбір адасқандық жоқ. Бірак мен әлемдердің Раббы тарапынан бір елшімін” деді.,
1016,"“Сендерге Раббымның жібергендерін жалғастырып, сендерді үгіттеймін. Және Алладан сендер білмегенді білемін”",
1017,"Сақсынып, мәрхаметке бөленулерің үшін Раббыларың тарапынан, өздеріңнен сендерге ескертетін бір кісіге насихат келуіне таңырқайсыңдар ма?",
1018,"Сонда олар оны жасынға шығарды. Сондықтан оны және онымен бірге кемеде болғандарды құтқарып, аяттарымызды өтірік дегендерді суға батырдық.Өйткені олар анық көзсіз ел ді.",
1019,"Және Ғад еліне туыстары Һұд (Ғ.С.) ты жібердік: “Әй елім! Аллаға құлшылық қылыңдар! Сендердің одан басқа тәңірлерің жоқ. Қорықпайсыңдар ма?”,- деді.",
1020,Елінің қарсы болған тобы: “Әрине біз сені есуас көреміз. Және сені анық өтірікшілерден деп ойлаймыз” деді.,
1021,“Әй елім! Мен бір ақымақ емеспін. Бірақ әлемдердің Раббы тарапынан бір елшімін” деді.,
1022,“Сендерге Раббымның жібергендерін жалғастырамын. Әрі сендерге сенімді бір үгітшімін…”,
1023,"Раббыларың тарапынан өздеріңнен, сендерге ескерту үшін бір кісіге насихат елуіне таңырқайсыңдар ма? Ойлаңдар! Сол уақытта Алла сендерді Нұх қауымынан кейін орынбасар қылып, әрі тұлға жаратылысында да артык қылды. Ендеше Алланың нығметтерін еске алыңдар, әрине құтыласыңдар.”",
1024,"Олар: “Сен бізге жалғыз ғана Аллаға құлшылық қылуымыз және ата- бабаларымыздың табынатындарын тастауымыз үшін келдің бе? Егер рас айтушылардан болсаң, бізді құқайлаған азабынды әкел” деді.",
1025,"(Һұд Ғ.С.): “Раббыларың тарапынан азап және ашу тиісті болды. Алла оған ешбір дәлел түсірмеген, аттарын, өздерің және аталарың қойған тәңірлерің жайында менімен талсасыңдар ма? Енді нәтижені күтіңдер, мен де сендермен бірге күтушілерденмін” деді.",
1026,"Сонда Һұд (Ғ.С.) ты, онымен бірге болғандары мәрхаметімізбен құтқардық та аяттарымызды жасынға шығарғандардың және сенбегендердің артын үздік.",
1027,"Және Сәмүд еліне туыстары Салих (Ғ.С.) ды жібердік: “Әй қауымым! Аллаға құлшылық қылыңдар, сендердің Одан басқа тәңірлерің жоқ. Сендерге Раббыларыңнан ашық мұғжиза келді. Міне Алланың іңгені сендерге бір мұғжиза. Оны еркіне қойыңдар, Алланың жерінде оттасын. Оған бір сұмдық істемеңдер. Әйтпесе, сендерді жан түршігерлік азап қолға алады” деді.",
1028,"(Еске алыңдар! Сол уақытта Ғаддан кейін сендерді олардың орынбасары қылып, жер жүзіне орналастырды. Ойпаттарынан сарайлар жасап алып, тауларды үңгіп үйлер жасайтын едіңдер. Сондықтан Алланың нығметтерін еске алыңдар да жер жүзінде бүліншілік қылып жүрмеңдер.",
1029,"Елінің дандайсыған тобы, араларындағы иман келтіргендерді қор көріп: «Салихтың, Раббы тарапынан анық елші екенін білесіңдер ме?»,- деді. Олар: «Күдіксіз біз ол арқылы жіберілген нәрселерге сенеміз» деді.",
1030,Дандайсығандар: «Күдіксіз біз сендер сенген нәрселерге қарсымыз» деді.,
1031,"Сондай олар іңгенді өлтіріп, Раббыларының әмірінен шықты да: «Әй Салих! Егер сен елшілерден болсаң, бізге бопсалағаныңды келтір» деді.",
1032,Сонда оларды бір сілкініс қолға алды да үйлерінде етпеттеген бойдарында қалды.,
1033,Сонда Салих олардан жүз бұрып: «Әй елім! Расында мен сендерге Раббымның бұйрығын жалғастырдым. Бірақ сендер үгіттеушілерді жақсы көрмедіңдер» деді.,
1034,Лұт (Ғ.С.) сол уақытта еліне: «Сендерден бұрын әлемнен ешкімнің істемеген арсыздығын істейсіңдер ме?» деді.,
1035,«Сендер әйелдерді қойып еркектерге қызығып келесіңдер ме? Әрине сендер шектен шыққан елсіңдер»,
1036,"Елінің жауабы: «Оларды кенттеріңнен шығарыңдар. Өйткені, олар өте тазасынған адамдар» деу ғана болады.",
1037,Сонда Лұт (Ғ.С.) ты және семьясын құтқардық. Бірақ қатыны ғана апатқа ұшырағандардан болды.,
1038,Оларға бір жаңбыр жаудырдық. Күнәкарлардың сонының қалай болғанын көр!,
1039,"Мәдян еліне туыстары Шұғайып (Ғ.С.) ты жібердік: «Әй елім! Аллаға құлшылық қылыңдар. Сендердің Одан басқа тәңірлерің жоқ. Сендерге Раббыларыңнан ашық бір дәлел келді. Енді өлшеуді, тартуды толық орындаңдар. Адамдардың нәрселерін кемітпеңдер. Түзетілгеннен кейін жер жүзінде бүліншілік қылмаңдар. Егер иман кетірген болсаңдар, сендерге осы істерің жақсы» деді.",
1040,"«Иман келтіргендерді Алланың жолынан тосып, бопсалап, қыңырлық іздеу үшін әрбір жол үстінде отырмаңдар. Және ойлаңдар, сендер аз едіңдер, Алла көбейтті. Және де бұзақылардың соңы қалай болды, қараңдар! »",
1041,"«Және сендерден бір топ, мен арқылы жіберілгенге сеніп, бір топ сенбесе, Сонда арамызға Алла үкім бергенге дейін сабыр етіңдер. Ол, үкім берушілердің жақсысы»",
1042,"Елінің дандайсыған бастықтары: «Әй шұғайып! Әрине сені де сенімен бірге иман келтіргендерді де кентімізден шығарамыз, немесе дінімізге қайтасыңдар» деді. Шұғайып(Ғ.С.): «Жақтырмасақ та ма?»,- деді.",
1043,"«Алла бізді діндеріңнен құтқарғаннан кейін қайталасақ, расында Аллаға өтірік жала қойған боламыз. Бірақ Раббымыз қаласа, оған қайтуымызға болады. Раббымыздың білімі әр нәрсні сыйдырды. Аллаға тәуекел қылдық. Раббымыз! Біз бенен еліміздің аарсына туралықпен Сен үкім ет. соНдай-ақ Сен билік аутушылардың ең жақсысың» (деді. Шұғайып Ғ.С.)",
1044,"Елінің ішінен қарсы болған бастықтары: «Егер Шұғайыпқа ілессеңдер, сол уақытта анык зиян етушілерден боласыңдар» деді.",
1045,Сонда оларды бір сілкіңіс қолға алып жұрттарында етпеттеген бойларында қалды.,
