id,text,foot_notes
3908,Мұса және ћартн (Ғ.С.) ға сәлем.,
3909,Рас ізгі іс істегендерді өстіп сыйлыққа бөлейміз.,
3910,"Өйткені, екеуі де сенген құлдарымыздан еді.",
3911,Әрине Іляс (Ғ.С.) елшілерімізден еді.,
3912,"Сол уақытта еліне: ""Алладан қорықпайсыңдар ма?"",- деді.",
3913,"""Ерекше жаратушыны қойып, ""Бағыл"" атты бұтқа жалбарынасыңдар ма?""",
3914,"""Алла, сендердің де бұрынгы аталарыңның да Раббы!""",
3915,"Сонда елі оны жасынға шығарды. Рас олар, жазаға келтіріледі.",
3916,Бірақ Алланың ықыласты құлдары басқа.,
3917,Кейінгі нәсілдерге оған (жақсы даңқ) қалдырдық:,
3918,"""Іляс (Ғ.С.) қа сәлем.""",
3919,"Рас Біз, ізгі іс істегендерді осылайша сыйлыққа бөлейміз.",
3920,"Өйткені, ол сенімді құлдарымыздан еді.",
3921,Күдіксіз Лұт (Ғ.С.) елшілерден еді.,
3922,Сол уақытта оны да семьясын да түгел құтқардық:,
3923,Бірақ қалғандардың ішіндегі бір кемпірден басқа.,
3924,Сосын өзгелерін жоқ еттік.,
3925,"Әрине тәңертең, олардан өтіп жүресіңдер.",
3926,Әрі түнде де. Сонда да түсінбейсіңдер ме?,
3927,Күдіксіз Юныс (Ғ.С.) елшілерден еді.,
3928,"Күдіксіз Юныс (Ғ.С.) елшілерден еді. ( Сол уақытта ол, толы кемеге қашқан еді. (Еліне кейіп, кемеге барып түскенде; кеме ауырлап, жүре алмай, шар салғанда соған шығады. Б.Ж.М.)",
3929,"Шар салғанда ол, жеңіліске ұшырады. (Қарғып теңізге түсті.)",
3930,"Сонда оны балық жұтты. Ол, айыпталған еді.",
3931,"Егер ол, Алланы рас дәріптеушілерден болмаса еді:",
3932,Әрине қайта тірілетін күнге дейін балықтың қарнында қалған болар еді.,
3933,"Сонда оны қырға шығарып, тастадық. Ол науқас еді.",
3934,Оның үстіне жапырақты бір ағаш өсірдік.,
3935,Оны жүз мың не тағы артығырақ елге жіберген едік.,
3936,Сонда олар иман келтірді де бір мерзімге дейін пайдаландырдық.,
3937,"Енді олардан сұра: ""Қыздар Раббыларынікі де, ұлдар олардікі ме?",
3938,Немесе періштелерді ұрғашы жаратқанымызға олар куә ме?,
3939,Сақ болыңдар! Олар жалғандарын айта береді:,
3940,"""Алланың баласы бар"" деп, олар мүлде өтірік айтады.",
3941,Алла ұлдардан көрі қыздарды артық көре ме?,
3942,Сендерге не болды? Қалай шешім етесіңдер?,
3943,Түсінбейсіқдер ме?,
3944,Немесе сендердің ашық бір дәлелдерің бар ма?,
3945,Шыншыл болсаңдар кітаптарыңды әкеліңдер.,
3946,Олар Алла мен періштелер (Б.Ж.М.К.Р.) арасында ұрпақтық байланыс ұйғарды. Расында періштелер; олардың Алланың алдына келтірілетінін біледі. (Немесе Алла мен жын арасында жег-жаттық ұйгарды.),
3947,Алла (Т.) олардың сипаттауларынан пәк.,
3948,Бірақ Алланың нағыз құлдары өйтіп сипаттамайды.,
3949,"Сонда сендер де табынған нәрселерің де, (бірлесіп;)",
3950,Сендер Аллаға қарсы бұзақылық шығара алмайсыңдар.,
3951,"Бірақ кім тозаққа түсетін болса, ол басқа.",
3952,"""Бізден орны белгіленбеген ешкім жоқ.""",
3953,"""Шын мәнінде біздер қатарланып тұрушыларданбыз.""",
3954,"""Әрине Алланы дәріптеушілерденбіз.""",
3955,Олар былай дейтін еді:,
3956,"""Егер бізде бұрынғыларға түсірілген үгіт болса еді,""",
3957,"""Әлбетте Алланың ықыласты құлдарынан болар едік.""",
3958,"Сонда олар, келген Кітапқа дереу қарсы шықты. Жақында (нәтижені) біледі.",
3959,Расында елші құлдарымызға сөзіміз бұрын бекіген болатын:,
3960,"""Сөз жоқ, оларға жәрдем болады.""",
3961,"""Сөзсіз жеңіске ие болатын біздің әскер.""",
3962,(Мұхаммед Ғ.С.) сонда олардан бір мезгілге дейін бет бұра тұр.,
3963,"Оларды көре тұр, олар да жақында көреді.",
3964,Олар азабымыздың жедел келуін қалай ма?,
3965,"Қораларына (азап) түскен кезде, ескерту берілгендердің таңы нендей жаман.",
3966,Сонда олардан бір уаққа дейін аулақ бол.,
3967,Тағы оларды байқай тұр. Жақында олар көреді.,
3968,Қастерлі Раббың олардың сипаттағандарынан пәк.,
3969,Елшілерге сәлем!,
3970,"Барлық мақтау бұкіл әлемнің Раббы, Алла (Т.) ға лайық.",
3971,Сад. Үгіт толы Құранға серт.,
3972,"Әрине қарсы болғандар, дандайсып, тартысуда.",
3973,Олардан бұрын қаншалаған нәсілді жоқ еттік. Сонда олар ойбайлады да; бірақ құтылар заман емес еді.,
3974,"Олар өздерінен бір ескертуші келгеніне таңырқады да қарсы болғандар: ""Бұл бір сиқыршы, барып тұрған суайт"" деді.",
3975,"""Тәңірлерді бір-ақ тәңір қыла ма? Әрине бұл тым таңғажайып нәрсе.""",
3976,"Олардың бастықтары келіп: ""Жүріңдер, өз тәңірлеріңде сабыр ете тұрыңдар. Сөз жоқ, бұл бір мақсатты нәрсе.""",
3977,"""Тіпті бұны біз өзге дінде естіген емеспіз. Бұл мүлде бір жасанды жол.""",
3978,"""Арамыздан осыға ғана үгіт түсірілді ме?,- (десті) Олай емес, олар Менің үгітімнен күдіктенуде. Әрине олар азабымды татқан жоқ.",
3979,"(Мұхаммед Ғ.С.) немесе өте үстем, аса жомарт Раббыңньің мәрхаметінің қазынасы олардың қасында ма?",
3980,"Не көктер мен жердің әрі арасындағылардың иелігі олардікі ме? Ендеше, ыңғайын тауып, көтеріліп көрсін.",
3981,(Олар) мұнда соққы жеген рулардан бір қол.,
3982,"Олардан бұрын Нүх, Ғад елі және салтанат иесі Перғауын да жасынға шығарған еді.",
3983,"Сондай-ақ Сәмұд, Лұт және Әйке халқы да. Міне осы топтар:",
3984,"Барлығы да елшілерді жасынға шығарғандықтарынан, азап лайық болды.",
3985,Ал енді бұлар да тоқтаусыз бір ғана ащы дауысты күтеді.,
3986,"Олар: ""Раббымыз, есеп күнінен бұрын көресімізді тез көрсет"" десті.",
3987,"(Мұхаммед Ғ.С.) олардың айтқандарына сабыр ет. Мықты құлымыз Дәуіт (Ғ.С.) ті есіңе ал! Өйткені ол, өте бой ұсынушы.",
3988,Рас оған тауларды бағындырдық. Олар онымен бірге іңірде әрі сәскеде Алланы дәріптейтін еді. (С. 79-А.),
3989,Оған құсты тобымен бағындырдық. Барлығы Алланы дәріптуші еді.,
3990,"Оның патшалығын күшейтіп, оған даналық, сондай-ақ дауға билік айту қабілетін бердік.",
3991,Саған даушының хабары келді ме? Сол уақытта дуардан асып бөлмеге кіріп келген еді.,
3992,"Олар Дәуіт (Ғ.С) ке кірген сәтте, сонда олардан абыржып қалды. Олар: ""Қорықпа, бір-біріне өктемдік еткен екі даушымыз. Арамызға туралықпен билік қыл. Шатаспа да бізді тура жолға сал"" деді.",
3993,"""Рас мына туысымның тоқсан тоғыз саулығы бар еді де менің бір саулығым бар еді. Сонда да ол, ""Оны маған тапсыр"" деп, сөз бойынша өзіме өктемдік істеді.""",
3994,"Дәуіт (Ғ.С.): ""Шынында сенің саулығыңды өз саулықтарыңның үстіне сұраумен саған зұлымдық еткен екен. Расында қарым-қатынаста болғандардың көбі, әрине бір-біріне қаралық істейді. Бірақ иман келтіріп, турашылдық істегендер басқа. Олар азғантай"" деді. Дәуіт (Ғ.С.) шын мәнінде өзін сынағанымызды сезді. Сондықтан Раббынан жарылқау тілеп, сәждеге жығылып, бой ұсынды.",
3995,"Сонда оны жарылқадық. Шәксіз оның Біздің қасымызда әлбетте жақындыгы, көркем келешегі бар. (Бұл дауа мәселесі, мысал үшін келтірілген. Б.М.К.Х.)",
3996,"Әй Дәуіт! Сені жер жүзінде меңгеруші қылдық. Сондықтан адамдардың арасына хақиқатпен ткім ет, ойға ерме. Онда сені Алланың жолынан адастырады. Шәксіз Алланың жолынан адасқандар, есеп күнін ұмытулары себепті оларға қатты азап бар.",
3997,Көк пен жерді әрі екі арасындағыларды босқа жартпадық. Ол қарсы келгендердің ойы. Сондықтан оттан азап болатын қарсы келгендерге не өкініш!,
3998,"Немесе иман келтіріп, ізгі іс істегендерді, жер жүзіндегі бұзақылардай қыламыз ба?",
3999,(Мұхаммед Ғ.С.) саған бір мүбарак Кітап түсірдік; аяттарын түсінсін әрі ақыл иелері үгіт алсын.,
4000,Дәуіт (Ғ.С.) ке Сүлеймен (Ғ.С.) ді бердік. Ол не деген жақсы құл еді. Рас ол өте бағынышты.,
4001,Сол уақытта бір кеште Сүлеймен (Ғ.С.) ге сәйгүлік жүйріктер келтірілді.,
4002,"""Сөз жоқ, мен Раббымды еске алу үшін атты өте жақсы көремін"" деді. Ақыр тұлпарлар көзден ғайып болған сәтте:",
4003,"""Оны маған қайтарып әкеліңдер"" (деп,) сонда аяқтарын, мойындарын сипай бастады. (Құран Кәрим түрікше ұғымы, Диянат істері Түркия Құран ұгымы. Т-Қ.Пакістан.)",
4004,"Расында Сүлеймен (Ғ.С.) ді сынап тағының үстіне бір дене қойдық. (Б.Ж.М.А.) Сосын ол, тәубе қылды.",
4005,"""Раббым! Мені жарылқа. Маған, менен кейін ешкімге нәсіп болмайтын патшалық бер. Әрине Сен өте жомартсың"" деді.",
4006,"Сондықтан қалаған жерге жетуге, бұйрығымен оңай жүретін желді бағындырдық.",
4007,Әр түрлі құрылыс жасаушы және сүңгігіш шайтандарды бағындырдық. (С. 82-А.),
4008,Ал басқа біреулері шынжырларда матаулы еді.,
4009,"""Бұл Біздің бергеніміз. Ал енді қалағаныңа бер. Немесе бермей ұстап тұр, есеп емес. (Ерк өзіңде.)"",-(дедік.)",
4010,Күдіксіз ол үшін қасымызда жақындық әрі көркеи келешегі бар.,
4011,"(Мұхаммед Ғ.С.) құлымыз Әйүп (Ғ.С.) гі есіңе ал. сол уақьітта Раббына: ""Рас мені шайтан бейнет және қинауға ұшыратты"" деп жалбарынды.",
4012,"Оған: ""Аяғыңмен жерді теп. Міне саған шомылатын әрі ішетін суық су"" (дедік.)",
4013,"(Әйүп Ғ.С. қолынан бала-шага, мал-мүлкі кетіп, құрт ауруға ұшыраса да қабақ шытпай сабырмен құлшылық қыла бергендіктөн, Алланың мәрхаметімен сақайып бұрынғыдан да артық халге келеді. Б.М.К.Р.) Бізден бір мәрхамет сондай-ақ ақыл иелеріне бір үгіт түрінде оған семьясын; олармен бірге бір есе артығымен бердік. (Әйтп Ғ.С. әйеліне кейіп, жазылсам, жүз дүре соғамын деп ант етеді. Б.Ж.М.Р.)",
4014,"""Қолыңа бір топ ши алып, сонымен бір ұр. Сертіңнен қайтпа!"" Шынында оны сабырлы көрдік. Ол недеген жақсы құл. Өйткені ол, өте бойсұнушы.",
4015,"(Мұхаммед Г.С.) құлымыз Ыбырайым, Ысхақ және Яғқүп (Ғ.С.) ты есіңе ал. Олар мықты да қырағы еді.",
4016,Расында Біз оларды нағыз ахиретті еске алуға арнадық.,
4017,"Сөз жоқ, олар, қасымызда таңдаулы игі-жақсылардан.",
4018,"(Мұхаммед Р.С.) Ысмайыл, Іляс және Зүлкәфіл (Ғ.С.) ді де есіңе ал. Барлығы жақсылардан еді.",
4019,Бұл бір насихат. Күдіксіз тақуалар үшін тым көркем келешек бар.,
4020,Олар үшін есіктері ашық Ғадын жаннаттары бар.,
4021,"Олар онда жастанып отырады. Ол жерде мол жемістер, сусындар тілейді.",
4022,Олардың қасында телмірген жасыт қор қыздары бар.,
4023,Есеп күні үшін сендерге уәде етілгендер осы.,
4024,"Сөзсіз, таусылмас берген несібеміз осы;",
4025,"Я, осы! Ал расында азғындар үшін жаман орын бар:",
4026,Олардың кірер жерлері тозақ. Сонда нендей жаман орын;,
4027,"Я, осы! Енді олар, қайнар су, ірің татсын!",
4028,Тағы басқа осы сияқтылардың неше түрлісі бар.,
4029,"(Қылмыстылардың бастықтарына): ""Мына топ, сендермен бірге тозаққа кірушілер"" (делінеді. Олар): ""Оларға жақсылық жоқ. Олар тозаққа кіреді"" (дейді.)",
4030,"Олар: ""Олай емес, сендерге жақсылық болмасын! Бұны бізге сендер келтірдіңдер. Нендей жаман орын"" (дер.)",
4031,"Олар: ""Раббымыз! Бізге бұны кім келтірген болса, оның тозақтағы азабын неше есе арттыра түс!"",- дейді.",
4032,"Олар: ""Бізге не болды? Өздерін жамандардан санаған адамдарды көрмейміз ғой"" деседі.",
4033,"""Оларды сықаққа алушы едік. Немесе олар көздерімізге түспей ме?""",
4034,"Күдіксіз, міне осы; тозақтықтардың тартысулары бір шындық.",
4035,"(Мұхаммед Ғ.С.) оларға: ""Шын мәнінде мен бір ескертуші ғанамын. Өте өктем бір Алладан басқа ешбір тәңір жоқ"" де.",
4036,"""Ол, көктер мен жердің әрі екі арасындағылардың Раббы. Тым үстем, аса жарылқаушы...""",
4037,"""Бұл бір ірі хабар"" де:",
4038,"""Сендер Одан бет бұрсаңдар.""",
4039,"""Жоғары әлемдегілердің тартыспаларынан мәліметім жоқ еді.""",
4040,"""Шын мәнінде ашық бір ескертуші болғандығынан ғана маған уахи етілуде"" (де.)",
4041,"Сол уақытта Раббың, періштелерге: ""Мен балшықтан бір адам жаратамын"" деген.",
4042,"""Қашан оны жасап, оған рұхымнан үрлеген сәтте, оған сәждеге жығылыңдар"" (делінді.)",
4043,Сонда періштелердің бәрі түгел сәжде қылды.,
4044,"Бірақ Ібіліс сәжде етпей тәкаппарланып, қарсылардан болды.",
4045,"(Алла Т.): ""Әй Ібіліс! Екі қолыммен жаратқаныма сәжде етуден сені не тосты? Тәкаппарландың ба?"",- деді.",
4046,"Ол: ""Мен одан артықпын. Өйткені, мені оттан жараттың да оны топырақтан жараттың"" деді.",
4047,"(Алла Т.): ""Дереу ол жерден шық. Шын мәнінде сен рахметімнен қуылдың"" деді.",
4048,"""Шынында қиямет күніне дейін лағынетім саған болсын.""",
4049,"Ол: ""Раббым, онда қайта тірілетін күнге дейін маған мұрса бер"" деді.",
4050,"(Алла Т.): ""Рас сен мұрса берілгендерденсің!""",
4051,"""Белгілі бір күнге дейін.""",
4052,"Ол: ""Үстемдігіңе серт! Әлбетте олардың барлығын аздырамын"" деді.",
4053,"""Бірақ олардан ықыласты құлдарың ғана қалады.""",
4054,"(Алла Т.): ""Хақиқат осы. Мен хақиқатты айтамын.""",
4055,"""Әлбетте тозақты сеніменен және саған ілескендермен, солардың барлығымен толтырамын.""",
4056,"(Мұхаммед Ғ.С.) оларға: ""Сендерден оған ақы сұрамаймын. Өз ойымнан шығарушылардан емеспін"" де.",
4057,"""Бұл Құран бүкіл әлем үшін бір насихат!""",
4058,"""Әлбетте оның хабарын бір заманнан кейін түсінесіңдер.""",
4059,"Бұл Қітаптың түсірілуі, тым үстем, аса дана Алла (Т.) дан.",
4060,"(Мұхаммед Ғ.С.) расында саған бұл Кітапты бір шындықпен түсірдік. Сонда Аллаға дінді нағыз арнап, құлшылық қыл.",
4061,"Көңіл бөліңдер! Дін нағыз Аллаға тән. Сондай Алладан өзгені дос тұтқандар: ""Біз бұларға, Аллаға жақындастырсын деп қана табынамыз"" (дейді.) Күдіксіз олардың араларындағы таласқан нәрселеріне Алла (Т.) үкім береді. Расында Алла, кім өтірікші, өте қарсы болса, оны тура жолға салмайды.",
4062,"Егер Алла бала иемденуді қаласа еді, жаратқаньгаан тілегенін таңдар еді. Ол одан пәк. Ол Алла жалғыз, өте үстем.",
4063,"Көктерді, жерді шындық бойынша жаратты. Түнді күндізге айналдырады, күндізді түнге айналдырады және күн мен айды меңгереді. Әрбірі белгілі бір мерзімге дейін жүріп тұрады. Абайлаңдар! Ол тым үстем, аса жарылқаушы.",
4064,"Алла (Т.) сендерді бір кісіден жаратты. Сосын одан жұбайын жаратты. Тағы сендер үшін малдардан (түйе, сиыр, қой, ешкі.б-С. А.) сегіз түр пайда қылды. Және сендерді аналарыңның ішіндегі (құрсақ, жатыр, қағанақ) үш қараңғылықта бір жаратылыстан кейін бір жаратылыспен жаратты. (22-С. 5-А. 23-С. 14-А.) Міне осы Раббыларың Алла (Т.) Патшалық Оған тән. Одан басқа еш тәңір жоқ. Қайтып бұрылып барасыңдар?",
4065,"Егер қарсы келсеңдер, сонда Алла сендерден мұңсыз. Құлдарының қарсылығын ұнатпайды. Егер шүкірлік етсеңдер, сендерге разы болады. Ешбір Күнәкар, басқаның Күнәсын көтермейді. Сосын қайтар жерлері Раббылары жақ. Сонда сендерге істеген істеріңді түсіндіреді. Өйткені, Алла көкіректегілерді толық біледі.",
4066,"Қашан адам баласына бір таршылық келсе, Раббына жалбарып, Оған бейім ынта байқатады. Сосын қашан Алла оған бір игілік берсе, бұрынғы Оған жалбарғанын ұмытады да жолынан адастыру үшін Аллаға теңдес жасайды. (Мұхаммед Г.С.) оларға: ""Қарсылығыңмен біраз мәз бола түр. Сөз жоқ сен тозақтықсың"" де.",
4067,"(Ал осылар,) бой ұсынып, түн ішінде сәжде етіп, тіке тұрып, сондай-ақ ақиреттен қорқып Алланың рахметінен үміт еткен кісі сияқты ма? (Мұхаммед Г.С.) оларға: ""Білгендер мен білмегендер тең бола ма?"",- де. Шын мәнінде ақыл иелері ғана үгіт ала алады.",
4068,"(Мұхаммед Ғ.С.): ""Әй иман келтірген құлдарым! Раббыларыңнан қорқыңдар! Бұл дүниеде жақсылық істегендерге жақсылық бар. Алланың жері кең. Шын мәнінде сабыр етушілерге сыйлықтары есепсіз орындалады"" деп айт.",
4069,"(Мұхаммед Ғ.С.): ""Шәксіз мен дінді нағыз Аллаға арнап, құлшылық қылуға бұйрылдым."" де.",
4070,"""Сондай-ақ бой ұсынушылардың алды болуға бұйрылдым""",
4071,"""Шынында мен Раббыма қарсы келсем, ұлы күннің азабынан қорқамын"" де.",
4072,"""Дінімді нағыз Аллаға арнап құлшылық қыламын"" де.",
4073,"""Сендер Алладан өзге қалағандарыңа табыныңдар. Расында, зиянға ұшырағандар, қиямет күні өздерін де үй-іштерін де зиянға ұшыратқандар болады. Сақ болыңдар! Міне осы анық зиянға ұшырағандык"" де.",
