id,text,foot_notes
3890,"Коли він досягнув віку, щоб разом із ним докладати зусиль, той сказав: «Сину мій! Я бачив уві сні, що приношу тебе в жертву. Що ти думаєш про це?» Син відповів: «Батьку мій! Роби те, що тобі наказано. Якщо побажає Аллаг, ти побачиш, що я буду одним із терплячих!",
3891,"Коли вони обидва підкорилися, й він поклав його на бік",
3892,Ми звернулися до нього: «О Ібрагіме,
3893,"Ти вже підтвердив сон!» Воістину, так Ми винагороджуємо праведників",
3894,"Воістину, це — справжнє випробування",
3895,Ми викупили його великою жертвою,
3896,А наступним поколінням Ми залишили [добру згадку] про нього,
3897,Мир Ібрагіму,
3898,Так Ми винагороджуємо праведників,
3899,"Воістину, він — один із Наших віруючих рабів",
3900,Ми дарували йому добру звістку про Ісхака — пророка з праведників,
3901,"Ми благословили його та Ісхака. Є серед їхніх нащадків праведники, а є й ті, які справді несправедливі до себе",
3902,Ми дарували Свою милість Мусі та Гаруну,
3903,Ми врятували їх обох та їхній народ від великої печалі,
3904,Ми допомогли їм і вони стали переможцями,
3905,Ми дарували їм ясне Писанн,
3906,й повели їх прямим шляхом,
3907,А наступним поколінням Ми залишили [добру згадку] про них,
3908,Мир Мусі й Гаруну,
3909,Так Ми винагороджуємо праведників,
3910,"Воістину, вони — одні із Наших віруючих рабів",
3911,"Воістину, Ільяс був одним із посланців",
3912,Ось він сказав своєму народу: «Невже ви не боїтесь,
3913,Кличете Баала та відмовляєтесь від найпрекраснішого з творці,
3914,"— Аллага, вашого Господа й Господа ваших прабатьків?»",
3915,Але вони вважали його брехуном. Їх зберуть [у пеклі],
3916,крім обраних рабів Аллага,
3917,А наступним поколінням Ми залишили [добру згадку] про нього,
3918,Мир Іль Ясіну!,
3919,Так Ми винагороджуємо праведників,
3920,"Воістину, він — один із Наших віруючих рабів",
3921,"Воістину, Лют був одним із посланців",
3922,Ми врятували його разом із родиною — всіх,
3923,"окрім старої дружини, яка була однією з тих, хто залишився",
3924,А потім Ми знищили всіх інших,
3925,Ви проходите повз них уранц,
3926,та вночі. Невже ви не розумієте?,
3927,"Воістину, Юнус був одним із посланців",
3928,Ось він утік на переповнений корабель,
3929,"Він кинув жереб і опинився серед тих, хто програв",
3930,Його проковтнула риба. Він гідний докору,
3931,"Якби він не був одним із тих, хто прославляє Аллага",
3932,"то був би в череві риби аж до того дня, коли всі воскреснуть",
3933,"Ми викинули його на берег, і він був слабкий",
3934,Ми зростили над ним рослину — гарбуз,
3935,Ми відіслали його до ста тисяч або навіть більше,
3936,"Вони увірували, й Ми дарували їм можливість насолоджуватися благами до певного часу",
3937,"Запитай у них, чому це в твого Господа — доньки, а в них самих – сини?",
3938,"Невже Ми створили ангелів жінками, а вони були свідками цього",
3939,"Воістину, через свою брехливість вони говорять",
3940,«Аллаг народив!» Вони брешуть,
3941,Невже Він віддав перевагу донькам над синами,
3942,Що з вами? Як ви судите,
3943,Невже ви не замислитесь,
3944,Невже ви маєте ясний доказ,
3945,"Принесіть ваше Писання, якщо ви говорите правду",
3946,"Вони вважають, що між Ним і джинами є родинний зв’язок. Але джини знають, що вони будуть зібрані [в пеклі]!",
3947,"Пречистий Аллаг від того, що Йому додають у поклонінні",
3948,Цього не роблять тільки обрані раби Аллага,
3949,"Ви, та те, чому ви поклоняєтесь",
3950,не зможе відвернути від Нього нікого,
3951,"крім тих, кого буде кинуто в пекло",
3952,"[Ангели говорять]: «Немає серед нас такого, хто не мав би визначеного місця",
3953,"Воістину, ми шикуємося у лави",
3954,"Воістину, ми прославляємо Аллага!",
3955,[Багатобожники] говорять,
3956,«Якби в нас було нагадування від давніх поколінь,
3957,ми неодмінно були б обраними рабами Аллага!,
3958,Але ж вони не увірували в нього! Скоро вони дізнаються,
3959,"Наше слово вже було сказане Нашим рабам, яких Ми відсилали",
3960,"Воістину, вони отримають допомогу",
3961,"Воістину, Наше військо переможе",
3962,Відвернися від них до певного часу,
3963,"Поглянь на них, скоро вони побачать",
3964,Невже вони намагаються прискорити Нашу кару,
3965,"Коли вона зійде на їхні домівки, той ранок буде лихом для тих, кого застерігали",
3966,Відвернися від них до певного часу,
3967,"Подивись, скоро вони побачать",
3968,"Аллаг, Господь могутності, пречистий від того, що Йому приписують",
3969,Мир посланцям,
3970,"Хвала Аллагу, Господу світів",
3971,"Сад. Клянусь Кораном, у якому нагадування",
3972,"Але ж ті, які не вірують, гордують і опираються",
3973,"Скільки поколінь Ми знищили раніше за них! Вони волали про допомогу, але було запізно, щоб утекти",
3974,"Вони дивуються, що прийшов до них застерігач із них самих. І говорять невіруючі: «Це — брехливий чаклун",
3975,"Невже він перетворив богів на Єдиного Бога? Воістину, це — дивовижна річ!",
3976,"Їхня старшина пішла зі словами: «Йдіть і тримайтеся ваших богів! Воістину, це якийсь задум проти нас!",
3977,"Ми не чули такого навіть у найновішій релігії! Воістину, це лише вигадка",
3978,Невже тільки йому серед нас зіслано нагадування?» Та ж ні! Вони сумніваються в Моєму нагадуванні! Та ж ні! Вони ще не скуштували кари,
3979,"Невже вони мають скарбниці милості Господа твого, Всемогутнього, Дарителя",
3980,"Невже вони мають владу над небесами, землею й тим, що між ними? Тож нехай піднімуться туди шляхами",
3981,"Це військо, як і попередні загони спільників, буде розбито",
3982,"Ще раніше за них посланців вважали брехунами народ Нуха, адити й Фіраун, володар кілків,",
3983,"а також самудити, народ Люта й жителі Айкі — усі вони спільники",
3984,Усі вони вважали посланців брехунами. Заслуженою була кара,
3985,"Вони можуть чекати тільки на один крик, який не повториться",
3986,Вони говорять: «Господи наш! Наблизь нашу частку — раніше за День Відплати!»,
3987,"Терпи те, що вони говорять, і згадай Нашого сильного раба Дауда. Воістину, він звертався до Нас",
3988,"Ми підкорили гори, тож вони разом із ним славили нас увечері й зранку",
3989,"А також птахів, зібраних разом. Усі вони зверталися до Нього",
3990,"Ми посилили його владу, дарували Йому мудрість і вирішальне слово",
3991,"Чи дійшла до тебе звістка про тих, які судилися й перелізли через стіну молельні",
3992,"Ось вони ввійшли до Дауда, й він злякався їх. Вони сказали: «Не бійся! Ми судимося між собою, адже один із нас скривдив іншого. Розсуди між нами справедливо, не порушуй меж і вкажи нам правильний шлях",
3993,"Це — мій брат. Він має дев’яносто дев’ять овець, а я маю лише одну. Він сказав: «Довір її мені!» — і переконав мене на словах»",
3994,"[Дауд] відповів: «Він учинив з тобою несправедливо, попросивши додати твою вівцю до своїх. Багато спільників кривдять одне одного, крім тих, які увірували й роблять добро. Але таких мало». Дауд зрозумів, що Ми випробовуємо його, попросив прощення в Господа свого, упав ниць і покаявся",
3995,"Ми простили йому це. Воістину, він наближений до Нас і його чекає прекрасний притулок",
3996,"«О Дауде! Воістину, Ми призначили тебе намісником на землі. Суди між людьми справедливо та не йди за пристрастю, яка може збити тебе зі шляху Аллага!» Воістину, на тих, які збиваються зі шляху Аллага, чекає сувора кара за те, що вони забули про День Відплати",
3997,"Ми не створювали небо, землю й те, що між ними, даремно. Так думають ті, які не увірували. Горе ж тим, які не увірували, від вогню",
3998,"Невже Ми зрівняємо тих, які увірували й творили добро, і тих, які ширять нечестя на землі? Невже будуть рівні перед Нами богобоязливі й нечестивці",
3999,"Це — благословенне Писання, яке Ми зіслали тобі, щоб вони міркували над Його знаменнями й щоб замислилися наділені розумом",
4000,"Ми дарували Дауду Сулєймана. Яким прекрасним був цей раб! Воістину, він завжди звертався до Нас",
4001,"Якось увечері йому показали коней, легкохідних, швидких",
4002,"Він сказав: «Я захопився любов’ю до благ сильніше, ніж згадуванням Господа мого! Так було, доки [сонце] не сховалося за завісу",
4003,Поверніть їх до мене!» — і почав рубати їхні ноги та шиї.,
4004,"Ми випробовували Сулєймана та кинули на його престол тіло, після чого він покаявся!",
4005,"І сказав: «Господи! Прости мене й даруй мені владу, якої не матиме ніхто після мене! Воістину, Ти — Даритель!",
4006,"Ми підкорили йому вітер, який за його наказом ніжно дув, куди той бажав",
4007,"А також шайтанів: будівельників, нирці",
4008,"та інших, закутих у кайдани",
4009,«Це — Наш дар. Витрачай щедро або тримай при собі — розраховуватися не доведеться!,
4010,"Воістину, він наближений до Нас і його чекає прекрасний притулок",
4011,Згадай Нашого раба Айюба. Ось він закликав до Господа свого: «Шайтан торкнувся мене лихом і болем!,
4012,«Удар ногою! Ось прохолодна вода для омовіння й питво!,
4013,Ми дарували йому родину його і ще стільки ж — як милість від Нас і нагадування для обдарованих розумом,
4014,"«Візьми у свою руку жмут, удар ним і не порушуй клятви!» Воістину, Ми знайшли його терплячим. Яким прекрасним був цей раб! Воістину, він завжди звертався до Нас",
4015,"Згадай Наших рабів Ібрагіма, Ісхака та Якуба, наділених силою та проникливістю",
4016,"Воістину, Ми обрали їх за їхнє щире згадування наступного життя",
4017,"Вони біля Нас — серед обраних, найкращих",
4018,"Згадай Ісмаїля, аль-Яса та Зуль-Кіфля. Усі вони — одні з найкращих",
4019,"Це — нагадування! Воістину, богобоязливих чекає прекрасний притулок",
4020,"сади Едену, врата якого розкриються перед ними",
4021,"Там вони лежатимуть на ложах, проситимуть багато фруктів і напоїв",
4022,"Поряд із ними будуть ті, чий погляд смиренний, однолітки",
4023,"Це — те, що вам обіцяно до Дня Відплати",
4024,"Воістину, це — Наш наділ, який не вичерпається",
4025,"Так! Воістину, на порушників чекає найгірше місце",
4026,"геєна, де вони будуть палати. Мерзенний цей притулок",
4027,Так! Нехай скуштують — окріп і гній,
4028,"а ще інші кари, схожі на ці",
4029,"«Цей натовп порине у вогонь разом із вами. Немає для них привітання; воістину, вони палатимуть у вогні!»",
4030,"А ті скажуть: «Та ж ні, це ви! Для вас немає привітання! Адже ви принесли нам це. Яке мерзотне це місце!»",
4031,"І скажуть: «Господи наш! Збільш двократно покарання у вогні тому, хто нам це приніс!",
4032,"І скажуть: «Що з нами? Чому ми не бачимо людей, яких ми вважали за найгірши",
4033,та з яких глузували? Чи наші погляди їх не досягають?,
4034,"Воістину, ця суперечка жителів пекла — правда",
4035,"Скажи: «Воістину, я тільки застерігач. Немає бога, крім Аллага, Єдиного, Всепереможного",
4036,"Господа небес, землі й того, що між ними, Всемогутнього, Прощаючого!",
4037,Скажи: «Це — велика звістка,
4038,а ви від неї відвертаєтесь,
4039,"Я не маю знання про те, як сперечалися в найвищому зібранні",
4040,"Мені відкрито тільки те, що я — лише ясний застерігач!",
4041,Ось твій Господь сказав ангелам: «Я створю людину з глини,
4042,"Коли Я розмірю її та вдихну в неї зі Свого Духу, то впадіть перед нею ниць»",
4043,І вклонилися всі ангели,
4044,"крім Ібліса, який вивищився й став одним із невіруючих",
4045,"Аллаг сказав: «О Іблісе! Що завадило тобі вклонитися тому, що Я створив Своїми руками? Тебе охопила гордість чи ти належиш до тих, які вивищуються?",
4046,"Той сказав: «Я кращий за нього! Ти створив мене з вогню, а його Ти створив із глини!",
4047,Аллаг сказав: «Вийди звідси! Будеш ти каменований!,
4048,Моє прокляття буде над тобою аж до Судного Дня»,
4049,"Той сказав: «Даруй мені відстрочку до того дня, коли вони воскреснуть!",
4050,"Аллаг сказав: «Воістину, ти — один із тих, кому дана відстрочк",
4051,"до того Дня, строк якого визначено!",
4052,"Той відповів: «Клянуся Твоєю могутністю, що я спокушу їх усіх",
4053,окрім Твоїх обраних рабів!,
4054,Аллаг сказав: «Істина! Я говорю істину,
4055,Я неодмінно наповню геєну тобою та твоїми послідовниками – всіма!,
4056,Скажи: «Я не прошу у вас винагороди за це й не обтяжую себе вигадками,
4057,"Воістину, це лише нагадування для світів",
4058,І за певний час ви неодмінно пізнаєте його істинність!»,
4059,"Писання, зіслане від Аллага, Всемогутнього, Мудрого",
4060,"Воістину, Ми зіслали тобі Писання з істиною. Поклоняйся Аллагу, щиро сповідуючи Його релігію",
4061,"Чи не Аллагу належить щира релігія? А ті, які беруть собі помічників замість Нього, [говорять]: «Ми поклоняємося їм лише для того, щоб вони наблизили нас до Аллага!» Воістину, Аллаг розсудить між ними в тому, про що вони сперечалися! Воістину, Аллаг не веде прямим шляхом тих, які брешуть, які не вірують!",
4062,"Якби Аллаг хотів узяти Собі дитину, то обрав би з тих, яких створив, кого побажав. Пречистий Він! Він — Аллаг, Єдиний, Всепереможний",
4063,"Він створив небеса й землю в істині. Він огортає день ніччю та огортає ніч днем. Він підкорив сонце й місяць. Усі вони плинуть до визначеного строку. Так! Він — Всемогутній, Прощаючий",
4064,"Він створив вас із єдиної душі, а потім зробив для вас дружин із вас самих. Він зіслав для вас вісім пар худоби. Він створює вас в утробах матерів ваших: одне творіння після іншого, в трьох темрявах. Такий Аллаг, ваш Господь! Йому належить влада. Немає бога, крім Нього. Як же ви заблукали",
4065,"Якщо ви не увіруєте, то, воістину, Аллаг не потребує вас. Але Він не схвалює невір’я Своїх рабів. Тож якщо ви будете дякувати, Він схвалить це для вас. Ніхто не понесе тягар іншого; а потім ви всі повернетесь до вашого Господа й Він сповістить вас про те, що ви робили! Воістину, Він знає те, що в серцях",
4066,"Коли людини торкається лихо, вона кличе свого Господа й звертається тільки до Нього. А коли Він дарує їй милість від Себе, то вона забуває те, про що раніше просила, й додає Аллагу рівних — для того, щоб збити інших із Його шляху! Скажи: «Недовго ж тобі насолоджуватись своїм невір’ям! Воістину, ти — один із жителів вогню!»",
4067,"Невже той, хто смиренно проводить ніч, падаючи ниць і підводячись, хто боїться наступного життя й сподівається на милість свого Господа, рівний [тому, хто цього не робить?] Скажи: «Невже рівні ті, які знають, і ті, які не знають?» Воістину, замисляться лише обдаровані розумом!",
4068,"Скажи: «О раби, які увірували! Бійтесь Господа вашого! На тих, які робили добро в земному житті, чекає добро! Земля Аллага широка! Воістину, терплячих винагородять сповна, без відплати!",
4069,"Скажи: «Мені наказано поклонятись Аллагу, щиро сповідуючи Його релігію",
4070,І ще мені наказано бути першим із відданих Йому!»,
4071,"Скажи: «Я боюся, що в разі непослуху Господу моєму, мене буде покарано у Великий День!",
4072,"Скажи: «Я поклоняюсь Аллагу, щиро сповідуючи перед Ним свою релігію",
4073,"А ви поклоняйтесь замість Нього тому, кому побажаєте!» І скажи: «Воістину, зазнають утрат ті, які в День Воскресіння втратять і самих себе, і свої родини!» Так, це — явні втрати",
4074,"Над ними будуть завіси з вогню й під ними будуть завіси. Так Аллаг залякує Своїх рабів. О раби Мої, бійтеся Мене",
4075,"А для тих, які уникали тагута, не поклонялися йому й зверталися до Аллага, є добра новина. Сповісти ж цю добру новину рабам",
