id,text,foot_notes
2287,"Сперечаються між собою різні групи. Горе невіруючим від того, в чому вони пересвідчаться у Великий День",
2288,"Як же ясно вони будуть чути й бачити того Дня, коли постануть перед Нами! Але ж сьогодні нечестивці справді блукають у явній омані",
2289,"Тож попередь їх про День Втрат, бо рішення про них уже прийнято, але вони не зважають на це та не вірують",
2290,"Воістину, Ми успадкуємо землю й тих, хто на ній, і вони повернуться до Нас",
2291,"І згадай у Писанні Ібрагіма. Воістину, він був праведником, пророком",
2292,"Коли він сказав своєму батькові: «Батьку мій! Чому ти поклоняєшся тому, що не чує й не бачить і не порятує тебе ні від чого",
2293,"Батьку мій! До мене прийшло знання, яке не було відкрито тобі. Іди за мною, я поведу тебе прямим шляхом",
2294,"Батьку мій! Не поклоняйся шайтану, бо шайтан не послухався Милостивого",
2295,"Батьку мій! Воістину, я боюся, що впаде на тебе кара від Милостивого й ти станеш приятелем шайтана!",
2296,"Той відповів: «Невже ти відступишся від моїх богів, Ібрагіме? Якщо ти не вгамуєшся, то я справді поб’ю тебе камінням! Залиш мене надовго!",
2297,"Сказав [Ібрагім]: «Мир тобі! Я проситиму прощення для тебе в Господа, воістину, Він — поблажливий до мене",
2298,"Але я зрікаюся вас і тих, до кого ви молитесь замість Аллага. І я звертаюсь до Господа мого. Можливо, Він не відмовить мені в цьому, і я не буду нещасним»",
2299,"Коли полишив він їх і тих, кому вони поклонялися замість Аллага, Ми дарували йому Ісхака та Якуба й зробили їх пророками",
2300,"Наділили Ми їх милістю Нашою й лишили про них високе, правдиве слово",
2301,"Згадай у Писанні Мусу — він був щирим, був посланцем і пророком",
2302,"Покликали Ми його з правого боку гори, наблизивши до Себе, й розмовляли з ним потаємно",
2303,"І дарували Ми йому з Нашої милості брата його Гаруна, пророка",
2304,"І згадай у Писанні Ісмаїля — воістину, він був правдивим в обіцянках, був посланцем і пророком",
2305,І наказав він своїм людям молитися й давати закят; і його Господь був задоволений ним,
2306,"І згадай у Писанні Ідріса — воістину, він був праведником, пророком",
2307,Ми піднесли його на високе місце,
2308,"Це — ті, кого наділив Аллаг благами, вони — пророки, нащадки Адама й тих, кого порятували Ми разом із Нухом; нащадки Ібрагіма та Ісраїля, одні з тих, кого Ми повели прямим шляхом і обрали. Коли читали їм знамення Милостивого, вони низько вклонялися й плакали",
2309,"Змінили їх нащадки, які перестали молитися й пішли за своїми ницими бажаннями. Вони прийдуть до загибелі",
2310,"Окрім тих, які покаялися, увірували й робили добро — вони ввійдуть до раю й не будуть там нічим ображені",
2311,"В сади Едену, які Милостивий пообіцяв Своїм рабам. Воістину, обіцянка Його буде виконана",
2312,"Не почують вони там марних розмов, а лише слова: «Мир!»; їм — наділ їхній вранці та ввечері",
2313,"Таким є рай. Успадкують його ті з Наших рабів, які богобоязливі",
2314,"[Сказали ангели]: «Ми сходимо тільки за наказом Господа твого, належить Йому те, що попереду нас, і те, що позаду нас. І Господь твій не забуває нічого!",
2315,"Господь небес, землі й того, що поміж ними! Поклоняйся Йому та будь твердим у цьому! Чи знаєш ти рівного Йому",
2316,"І запитує людина: «Коли я помру, невже повернуть мене до життя?",
2317,"Хіба людина не пам’ятає, як колись Ми створили її, хоч вона була раніше нічим",
2318,"І клянуся Господом твоїм, Ми зберемо і їх, і шайтанів, поставивши потім навколо геєни на коліна",
2319,"Потім зберемо з кожної групи тих, хто найвпертіше не слухався Милостивого",
2320,"Нам краще знати, хто з них заслуговує місця у вогні",
2321,"І, воістину, нема серед вас таких, хто не пройде над геєною! Це вирішено Господом твоїм остаточно.",
2322,"Потім Ми врятуємо тих, які богобоязливі, а несправедливих залишимо там на колінах",
2323,"І коли читають їм Наші знамення, невіруючі говорять тим, які увірували: «Яка з двох груп вища й краща за місцем?",
2324,"О, скільки ж поколінь до них Ми знищили! А вони переважали їх і багатством, і зовнішнім виглядом",
2325,"Скажи: «Тим, хто заблукав, хай подовжить Милостивий життя, доки не побачать вони обіцяне їм — чи покарання, чи прихід Часу. Тоді вони знатимуть, чиє місце гірше та чиє військо слабше»",
2326,"І зміцнює Аллаг на прямому шляху тих, хто встав на нього; нетлінні добрі вчинки кращі перед Господом твоїм за винагородою і відплатою",
2327,"Чи бачив ти того, хто не увірував у Наші знамення й сказав: «Я неодмінно стану наділеним багатством і дітьми»",
2328,"Чи знає він потаємне, чи, може, уклав завіт із Милостивим",
2329,Та ж ні! Ми запишемо сказане ним і збільшимо йому покарання,
2330,"І дійде до Нас сказане ним, і він постане перед Нами одинаком",
2331,"Вони поклоняються, крім Аллага, іншим богам, щоб отримати від них могутність",
2332,Але ж ні! Вони відкинуть їхнє поклоніння й стануть їм ворогами,
2333,"Хіба ти не знаєш, що Ми відіслали до невіруючих шайтанів, щоб вони підбурювали їх",
2334,Тож не поспішай з ними! Ми рахуємо число [вчинків] їхніх,
2335,Одного дня Ми покличемо богобоязливих до Милостивого почесним почотом,
2336,а грішників поженемо в геєну — спраглими,
2337,"Ніхто не отримає заступництва, крім тих, хто має завіт із Аллагом",
2338,І ще кажуть: «Милостивий узяв сина»,
2339,"Справді, ви стверджуєте жахливу річ",
2340,"Від цього здатні розколотися небо, розсипатися земля й зруйнуватися гори",
2341,"Від того, що вони приписали Милостивому сина",
2342,Не годиться Милостивому мати сина,
2343,"Воістину, кожен із тих, хто на небесах і на землі, постане перед Аллагом лише як раб",
2344,Він знає їхнє число й перелічив їх,
2345,І кожен із них постане перед Ним у День Воскресіння одинаком,
2346,"Воістину, тих, які увірували й робили добрі справи, Милостивий наділив любов’ю",
2347,"І полегшили Ми [Коран] твоєю мовою, щоб ти сповістив його богобоязливим та застеріг ним людей, які сперечаються",
2348,"А скільки поколінь перед ними Ми знищили! Чи ти знайдеш хоч одного з них, чи почуєш їхній шепіт",
2349,Та. Га,
2350,"Ми зіслали тобі Коран не для того, щоб завдати тобі страждань",
2351,"а тільки як згадку для тих, хто боїться",
2352,"Зіслав його Той, Хто створив землю й високі небеса",
2353,Милостивий утвердився на троні,
2354,"Йому належить те, що на небесах і на землі, й те, що між ними, а також те, що під землею",
2355,"Чи промовлятимеш уголос, [чи ні] — воістину, Він знає таємне й найбільш приховане",
2356,"Аллаг! Немає бога, крім Нього, Йому належать найпрекрасніші імена",
2357,Чи дійшла до тебе розповідь про Мусу,
2358,"Коли Він побачив вогонь і сказав своїм людям: «Зачекайте, я помітив вогонь! Можливо, я принесу вам від нього головню чи знайду за вогнем правильний шлях!",
2359,"І коли він підійшов туди, то покликали його: «О Мусо",
2360,"Воістину, Я — Господь твій! Зніми взуття своє, воістину, ти опинився у священній долині Тува",
2361,"І Я обрав тебе. Слухай те, що відкривається тобі",
2362,"Воістину, Я — Бог і немає бога, крім Мене! Тож поклоняйся Мені й звершуй молитву, щоб пам’ятати про Мене",
2363,"Воістину, Час настане! Але Я приховаю строк приходу його, щоб відплатити кожній душі за те, в чому вона поспішала",
2364,"Нехай не відвертає тебе від Часу той, хто не увірував у нього та йшов за своїми пристрастями. Інакше ти загинеш",
2365,"А що це в твоїй правій руці, Мусо?",
2366,"Той відповів: «Це — моя палиця. Я спираюся на неї, збиваю листя для своїх овець і для іншого вона годиться»",
2367,"Аллаг сказав: «Кинь її, Мусо!",
2368,Він кинув її і палиця обернулася на змію та швидко поповзла,
2369,"Аллаг сказав: «Візьми її та не бійся! Вона стане тим, чим була",
2370,"Поклади свою руку за пазуху й знайдеш її чистою, без жодних плям. Ось тобі ще одне знамення",
2371,щоб Ми показали тобі Наші великі знамення,
2372,"Іди до Фірауна, бо, воістину, він несправедливий!",
2373,Муса сказав: «Господи! Розкрий серце мо,
2374,і полегши справу мою,
2375,І розв’яжи вузол на вустах моїх,
2376,щоб розуміли вони слова мої,
2377,І дай мені помічника з родини моєї,
2378,"Гаруна, брата мого",
2379,і додай мені сил через нього,
2380,та зроби спільником у справі моїй,
2381,щоб ми славили тебе часто,
2382,й згадували тебе часто,
2383,Ти ж бачиш нас!,
2384,"Аллаг сказав: «Уже дано тобі те, що ти просиш, Мусо",
2385,"Справді, Ми й перед тим були ласкаві до тебе",
2386,"коли Ми відкрили твоїй матері те, що відкрили",
2387,"«Поклади його в скриню та пусти річкою. Річка винесе його на берег, де його підбере Мій ворог і його ворог». Я простер на тебе Свою любов, щоб ти ріс на Моїх очах",
2388,"Приходить сестра твоя й говорить: «Може, вказати вам на того, хто про нього піклуватиметься?» Так Ми повернули тебе твоїй матері, щоб були радісні очі її, і щоб вона не журилася. Потім ти вбив одну людину, та Ми врятували тебе від смутку й випробовували тебе. Ти пробув довгі роки серед жителів Мад’яну, а тепер прийшов вказаний час, о Мусо",
2389,І Я вибрав тебе для Себе,
2390,"Рушайте ж, ти і брат твій, із Моїми знаменнями та не забувайте згадувати Мене",
2391,"Ідіть до Фірауна, бо, воістину, він несправедливий",
2392,"Говоріть із ним лагідно — можливо, він схаменеться або налякається!",
2393,"Вони відповіли: «Господи наш! Воістину, Ми боїмося, що він одразу скарає нас чи вчинить несправедливо із нами!",
2394,"Аллаг відповів: «Не бійтеся! Я з вами, чую та бачу",
2395,"Ідіть до нього та скажіть: «Ми — посланці Господа твого! Відпусти разом із нами інших синів Ісраїля й не знущайся з них. Ми прийшли до тебе зі знаменням від Господа нашого! Мир тому, хто йде прямим шляхом",
2396,"Воістину, відкрито нам, що скарають того, хто заперечував і відвертався!",
2397,"Фіраун спитав: «Хто ваш Господь, Мусо?",
2398,"Той відповів: «Господь наш — Той, Хто дав кожній речі природу її, а потім повів прямим шляхом!",
2399,Фіраун сказав «А що з давніми народами?,
2400,"Муса відповів: «Знання про це — тільки в мого Господа, в Писанні. Не помиляється Господь мій, нічого не забуває!",
2401,"Він — Той, Хто створив для вас землю ложем і зробив на ній шляхи для вас. Він пролив із неба воду! І Ми виростили завдяки їй пари різних рослин",
2402,"Споживайте самі й випасайте на них свою худобу! Воістину, в цьому знамення для тих, хто має розум",
2403,Ми створили вас із землі й у землю вас повернемо. А потім іще раз виведемо вас звідти,
2404,"Ми показали йому всі Наші знамення, але він відкинув їх, не визна",
2405,"і сказав: «Невже ти прийшов, щоб вигнати нас із землі нашої своїми чарами, Мусо",
2406,"Справді, ми покажемо тобі таке саме чаклунство. Тож признач належне місце й час — щоб не порушили його ні ми, ні ти!",
2407,Сказав Муса: «Визначеним часом для вас нехай буде День прикрас. А люди нехай зберуться зранку»,
2408,"Фіраун пішов, зібрав усіх своїх чаклунів і повернувся",
2409,"Муса сказав їм: «Горе вам! Не зводьте на Аллага наклеп, а то Він вразить карою вас! Нещасний той, хто зводить наклеп!",
2410,"Ті почали сперечатися між собою, що робити, але говорили вони потайки",
2411,й сказали: «Ці двоє — чаклуни. За допомогою своїх чарів вони прагнуть вигнати вас із вашої землі та звести вас із вашого найкращого шляху,
2412,"Тож приготуйте всі свої хитрощі й вийдіть єдиною лавою! Сьогодні успіху досягне той, хто переможе!",
2413,"Вони запитали: «О Мусо! Чи будеш кидати [палицю] першим чи, може, будемо перші ми?",
2414,"Той відповів: «Ні, нехай уже ви будете перші!» І через чари їхні здалося йому, що мотузки й палиці їхні почали рухатися",
2415,І відчув Муса страх у душі своїй,
2416,"Ми сказали: «Не бійся! Воістину, ти подолаєш їх",
2417,"Кинь те, що в твоїй правій руці, і воно негайно проковтне те, що зробили вони, бо то тільки хитрощі чаклуна! Не переможе чаклун, де б він не був!»",
2418,І тоді впали чаклуни в земному поклоні й сказали: «Ми увірували в Господа Муси й Гаруна!,
2419,"[Фіраун] сказав: «Невже ви повірили йому без мого дозволу?! Воістину, він — ваш наставник, той, хто навчив вас чар! Я накажу відрубати вам руки й ноги навхрест і розіпнути вас на пальмових стовбурах! Тоді ви дізнаєтесь, чия кара сильніша й довговічніша!",
2420,"Вони відповіли: «Ми не віддамо тобі переваги перед тим, що прийшло до нас із ясних доказів, і перед Творцем нашим. Кажи свій вирок! Але ж він чинний тільки в цьому житті",
2421,"Воістину, Ми увірували в Господа нашого, щоб простив Він гріхи наші й чаклунство, до якого ти силував нас. А Аллаг — Кращий та Вічний!",
2422,"Хто постане перед Господом своїм грішником, той опиниться в геєні, де він не помре й не буде жити",
2423,"А ті, які постануть перед Ним віруючими, які робили добрі вчинки, ті опиняться на найвищих ступенях",
2424,"у садах Едену, де течуть ріки. І будуть вони там вічно! Це — винагорода для тих, хто очистився",
2425,"Справді, Ми відкрили Мусі: «Вийди вночі разом із Моїми рабами й проклади для них суху дорогу в морі! Не бійся, що тебе наздоженуть, і не лякайся!",
2426,"Фіраун вирушив їм навздогін разом зі своїм військом, але море накрило його",
2427,Так Фіраун ввів свій народ в оману й не повів правильним шляхом,
2428,О сини Ісраїля! Ми врятували вас від ворога! Та Ми ще раніше обіцяли вам це на правому схилі гори. Також Ми дарували вам манну й перепелів,
2429,"Їжте блага, якими Ми наділили вас, але не порушуйте дозволеного, інакше впаде на вас Мій гнів. Той, на кого впав гнів Мій, гине",
2430,"Воістину, Я прощаю тим, які покаялися, увірували, робили добро та йшли далі прямим шляхом",
2431,"Чому ти так швидко залишив свій народ, о Мусо",
2432,"Той відповів: «Вони йдуть слідом за мною! Я ж поспішав до Тебе, Господи, щоб Ти був задоволений мною!",
2433,"Аллаг сказав: «Ми випробовували народ твій після того, як ти пішов! Їх збив із прямого шляху самарянин!",
2434,"Тож Муса повернувся до народу свого розгніваним і засмученим. Він вигукнув: «О народе мій! Хіба Господь ваш не дав вам прекрасної обіцянки? Чи надто тривалим видався вам цей строк, чи, може, ви хочете, щоб упав на вас гнів Господа вашого, і тому ви порушили те, що обіцяли мені?",
2435,"Вони відповіли: «Ми не порушували обіцянки, даної тобі. Але ж ми несли важкий тягар — прикраси того народу. Ми жбурнули їх [у вогонь] – так само зробив і самарянин»",
2436,"Він виплавив їм подобу тільця, яка ще й ревла та сказав: «Оце — ваш Господь і Господь Муси, але він забув Його».",
2437,"Невже вони не бачили, що він не говорить із ними й не може ні завдати їм шкоди, ні принести користі",
2438,"Справді, Гарун уже говорив їм: «Народе мій! Вас лише спокушають цим! Воістину, ваш Господь — це Милостивий! Ідіть за мною та слухайтесь наказів моїх!",
2439,"Вони відповіли: «Ми не перестанемо поклонятися йому, поки не повернеться до нас Муса»",
2440,"А той сказав: «О Гаруне! Що завадило тобі, коли ти побачив оману їхню",
2441,йти за мною? Чому ти не послухався мого наказу?,
2442,"Той відповів: «О сину моєї матері! Не тримай мене за бороду й за голову! Я боявся, що ти скажеш: «Ти посіяв розбрат між синами Ісраїля та не послухався слова мого!",
2443,Муса сказав: «О самарянине! А ти чого хотів?,
2444,"Той відповів: «Я бачив те, чого не бачили вони. Я взяв жменю піску зі слідів посланця й кинув її [у вогонь], бо саме так я захотів зробити!",
