id,text,foot_notes
984,"Частину з вас Він повів прямим шляхом, а частину справедливо змусив блукати. Замість Аллага вони взяли собі за покровителів шайтанів, і ще думали про себе, що йдуть прямим шляхом",
985,"О сини Адама! Вбирайтеся в одяг свій, де б ви не здійснювали поклоніння. Їжте й пийте, але не понад міру. Воістину, Він не любить тих, які порушують міру",
986,"Запитай: «Хто заборонив прикраси, які Аллаг дав Своїм рабам, а також блага з наділу Його?» Скажи: «Вони — для тих, які ще в земному житті щиро увірували в День Воскресіння!» Так Ми пояснюємо знамення для людей, які знають",
987,"Скажи: «Воістину, мій Господь заборонив огидні вчинки, відкриті й приховані, інші гріхи й свавілля, додавання Аллагу рівних, про яких Він не зіслав жодного доказу, а ще — коли говорите ви про Аллага те, чого не знаєте!",
988,"Для кожної громади — свій строк. І коли приходить цей строк, то не можуть вони ні відтягнути його, ні наблизити — навіть на годину",
989,"О сини Адама! Якщо прийдуть до вас посланці з вас самих, які читатимуть вам Мої знамення, то ті, які будуть богобоязливі й робитимуть добро, не матимуть страху й не будуть вони засмучені",
990,"А ті, які вважають Наші знамення за брехню й через гордість свою нехтують ними, вони — жителі вогню! І будуть вони там довіку",
991,"Хто ж несправедливіший за того, хто зводить наклеп на Аллага й заперечує знамення Його? Такі отримають частку, визначену їм Писанням. Коли посланці Наші прийдуть за душами їхніми, то запитають: «Де ті, яких ви закликали замість Аллага?» Ті скажуть: «Вони залишили нас!» — і цим засвідчать, що були невіруючими",
992,"Скажуть їм: «Увійдіть у вогонь разом із громадами з людей і джинів, які жили до вас!» Завжди, коли входить туди один народ, він проклинає подібних собі! Коли всі вони зберуться там, то останні з них скажуть про перших: «Господи наш! Саме вони збили нас зі шляху! Тож відплати їм подвійною вогняною карою!» Він скаже: «Кожному відплатять подвійно, але ви цього не знаєте!",
993,"Перші з них скажуть останнім: «Немає у вас переваги над нами, тож скуштуйте кари за те, що робили ви!",
994,"Воістину, для тих, які заперечували Наші знамення й через гордість свою нехтували ними, не відкриються брами небесні, й не ввійдуть вони до раю, доки не пройде верблюд крізь вушко голки. Так Ми винагороджуємо грішників",
995,"У пеклі на них чекатимуть ложа, а над ними — покривала. Так Ми винагороджуємо нечестивців!",
996,"А ті, які увірували й робили добро — а Ми не вимагаємо від людини понад її можливості — вони є жителями раю й будуть вони там довіку",
997,"Ми очистимо їхні серця від ненависті, а під ними тектимуть річки. Вони скажуть: «Хвала Аллагу, який привів нас сюди. Ми б не йшли прямим шляхом, якби Аллаг не повів нас ним! Посланці Господа нашого приходили з істиною!» Їм буде сказано: «Оце рай. Ви успадкували його за те, що робили!",
998,"Жителі раю звернуться до жителів вогню: «Ми переконалися, що обіцяне нам Господом нашим — істина! Чи переконалися й ви, що обіцяне Господом вашим — істина?» Ті скажуть: «Так!» І глашатай проголосить усім: «Нехай же буде прокляття Аллага над нечестивцями",
999,"які збивають інших зі шляху Аллага, прагнуть викривити його й не вірують у наступне життя!",
1000,"Між обома групами буде перепона; а на загорожі — чоловіки, які впізнають тих за їхніми ознаками. І звернуться вони до жителів раю: «Мир вам!» Але вони поки не ввійдуть туди, хоч і бажатимуть цього",
1001,"А коли їхні погляди зупиняться на людях пекла, то скажуть вони: «Господи наш! Не вміщай нас туди разом із нечестивими людьми!",
1002,"Мужі на загорожах звернуться до людей, яких вони впізнають за їхніми ознаками: «Не допомогло вам ні зібране вами, ні зверхність ваша",
1003,"Хіба ж це не ті, про яких ви клялися, що вони ніколи не матимуть милості від Аллага?» Скажуть їм: «Увійдіть до раю! Не матимете ви страху й не будете засмучені!",
1004,"І звернуться жителі вогню до жителів раю: «Пролийте на нас воду або те, чим наділив вас Аллаг!» Ті скажуть: «Воістину, Аллаг заборонив це для невіруючих",
1005,"які сприйняли свою релігію як гру й забаву та яких звабило мирське життя!» Сьогодні Ми забудемо їх так само, як вони забули про зустріч із Нами в цей День і як відкинули Наші знамення",
1006,"Ми дарували їм Писання, пояснивши його зі знанням, дарували як прямий шлях і милість для віруючих людей",
1007,"Невже вони, замість виконання обіцяного, чекають чогось іншого? Того Дня, коли це здійсниться, скажуть ті, які раніше забули про [Писання]: «Посланці Господа нашого приходили з істиною. Чи маємо заступників, які б заступилися за нас? Чи повернуть нас назад, щоб ми робили не те, що робили раніше?» Вони втратили самих себе. Залишили їх ті, кого вигадували вони",
1008,"Воістину, ваш Господь — Аллаг, Який створив небеса й землю зашість днів, а потім утвердився на троні. Він покриває ніччю день, який швидко наздоганяє її. Сонце, місяць і зорі покірні Йому. Хіба не Йому належить творити й вирішувати? Благословенний Аллаг, Господь світів",
1009,"Кличте Господа свого покірно й потаємно. Воістину, Він не любить тих, які порушують межі",
1010,"І не поширюйте безчестя на землі після того, як вона стала кращою. Кличте Його зі страхом і надією. Воістину, милість Аллага близька до тих, які роблять добро",
1011,"Він — Той, Хто посилає вітри добрими вісниками Своєї милості! І коли вони приносять важкі хмари, Ми приводимо їх до мертвої землі, проливаємо туди воду й пророщуємо там усілякі плоди. Так Ми воскрешаємо й померлих — можливо, ви замислитесь",
1012,"На добрій землі рослини сходять [рясно] з дозволу Господа її, а на поганій ростуть зле. Так Ми пояснюємо знамення для вдячних людей",
1013,"Ми послали Нуха до його народу. Він сказав: «О люди! Поклоняйтеся Аллагу! У вас немає бога, крім Нього! Я боюся, що впаде на вас кара у Великий День!",
1014,"Старшина його народу сказала: «Ми бачимо, що ти справді опинився в омані!",
1015,"Той відповів: «О люди! Я не опинився в омані. Навпаки, я — посланець від Господа світів",
1016,"Я передаю вам послання від Господа мого й раджу добро. Від Аллага я знаю те, чого ви не знаєте",
1017,"Невже ви дивуєтеся тому, що нагадування від Господа вашого прийшло до вас через чоловіка з вас самих, щоб він застерігав вас, і щоб ви були богобоязливі? Тоді, можливо, помилували б вас!",
1018,"Та вони сприйняли його за брехуна. Ми врятували його й тих, хто був із ним у ковчегу, а тих, які вважали за брехню Наші знамення, втопили! Воістину, вони були сліпими людьми",
1019,"І до адитів Ми послали їхнього брата Гуда. Він сказав: «О люди! Поклоняйтеся Аллагу! У вас немає бога, крім Нього! Невже не матимете страху перед Ним?»",
1020,"Старшина його народу, яка не увірувала, сказала: «Ми бачимо твою дурість і думаємо, що ти — брехун!",
1021,"Той відповів: «Я не дурний. Навпаки, я — посланець від Господа світів",
1022,Я переказую вам послання від Господа свого і я для вас — добрий порадник,
1023,"Невже ви дивуєтесь тому, що нагадування від Господа вашого прийшло вам через людину з-посеред вас для застереження? Згадайте, як Він зробив вас нащадками народу Нуха та ще й додав вам сили та зросту. Тож згадайте милості Господа вашого — можливо, матимете успіх!",
1024,"Ті сказали: «Невже ти прийшов із тим, щоб ми поклонялися єдиному Богу й зреклися того, чому поклонялися наші батьки? Покажи нам те, чим ти погрожуєш нам, якщо ти говориш правду!",
1025,"Він відповів: «Уже впала на вас кара й гнів Господа вашого! Невже ви будете сперечатися зі мною про імена, вигадані вами й вашими батьками? Аллаг не посилав щодо них жодного доказу. Тож чекайте і я почекаю разом із вами!»",
1026,"З Нашої ласки Ми врятували його й тих, хто був із ним, і вигубили до останнього тих, які вважали Наші знамення за брехню й були невіруючими",
1027,"А до самудитів [відіслали] їхнього брата Саліха. Він сказав: «Люди! Поклоняйтеся Аллагу! У вас немає бога, крім Нього! Прийшло до вас ясне знамення від Господа вашого. Ось ця верблюдиця Аллага — знамення для вас. Дозвольте ж їй пастися на землі Аллага й не завдавайте їй шкоди, інакше впаде на вас болісна кара!»",
1028,"Згадайте, як Він зробив вас нащадками адитів і розселив на землі, на рівнинах якої ви зводите фортеці й вирубаєте в скелях будинки. Згадайте милості Аллага й не чиніть зла на землі, поширюючи безчестя!",
1029,"Зверхня старшина його народу сказала віруючим, які були слабкі: «Чи ви знаєте, що Саліх посланий Господом його?» Ті відповіли: «Воістину, ми віруємо в те, з чим його послано!",
1030,"Горді сказали: «Воістину, ми не віруємо в те, у що віруєте ви!",
1031,"І вони закололи верблюдицю, не послухавши наказу Господа їхнього, й сказали: «О Саліху! Покажи те, чим ти погрожуєш нам, якщо ти справді з посланців!",
1032,І вразив їх землетрус. Лишилися вони мертві в будинках своїх,
1033,[Саліх] відвернувся від них й сказав: «О народе мій! Я передав вам послання від Господа мого й радив вам добро. Але не любите ви добрих порадників!,
1034,"[Відіслали] й Люта. Він сказав народу своєму: «Невже ви будете чинити таку мерзоту, якої не чинив перед вами ніхто з жителів світів",
1035,"Воістину, в пристрасті ви берете чоловіків замість жінок. Так, ви люди, які порушують межі»",
1036,"Та його народ тільки сказав: «Виженіть їх із селища вашого. Вони – люди, які вважають себе пречистими!",
1037,"Але Ми врятували Люта разом із його родиною, крім дружини, яка була однією з тих, хто залишився",
1038,"І Ми пролили дощ [із каміння]. Поглянь же, яким був кінець грішників",
1039,"А до мад’янітів [Ми послали] їхнього брата Шуейба. Він сказав: «О люди! Поклоняйтеся Аллагу! У вас немає бога, крім Нього! Прийшло до вас ясне знамення від Господа вашого. Наповнюйте ж міру й вагу, не обманюйте людей у майнових справах і не поширюйте безчестя на землі після того, як вона стала кращою. Так буде краще для вас, якщо ви віруючі!",
1040,"Не чатуйте на кожній дорозі, погрожуючи й збиваючи зі шляху Аллага тих, хто увірував у Нього та намагаючись викривити цей шлях. Згадайте, як вас було мало, а Ми примножили вас. Погляньте, яким був кінець нечестивців",
1041,"І якщо частина з вас увірувала в те, з чим мене послано, а друга частина не увірувала, то чекайте, поки Аллаг не розсудить між нами! А Він — найкращий із суддів!",
1042,"І сказала зверхня старшина його народу: «Ми неодмінно виженемо тебе з нашого селища, Шуейбе, і тих, які увірували разом із тобою. Або ж ти повернешся до релігії нашої!» Той відповів: «А якщо ми ненавидимо її",
1043,"Ми зведемо наклеп на Аллага, якщо повернемося до вашої релігії після того, як Аллаг врятував нас від неї. Не годиться нам повертатися до неї, хіба що цього побажає Аллаг, Господь наш. Наш Господь осягає знанням кожну річ, і на Аллага ми сподіваємося! Господи наш! Розсуди між нами та народом нашим по правді, адже Ти — найкращий із тих, хто вирішує!",
1044,"Старшина його народу, яка не увірувала, сказала: «Якщо ви підете за Шуейбом, то неодмінно зазнаєте втрат!",
1045,Але їх уразив землетрус. Лишилися вони мертві в будинках своїх,
1046,"Ті, які вважали Шуейба за брехуна, наче ніколи й не жили там. Ті, які вважали Шуейба за брехуна, зазнали втрат",
1047,[Шуейб] відвернувся від них і сказав: «Я передав вам послання від Господа мого й радив добро. То як мені сумувати за невіруючими людьми?,
1048,"У яке б селище Ми не посилали пророка, Ми завжди вражали його жителів злигоднями й лихом — можливо, стануть смиренними вони",
1049,"Потім Ми заміняли зло благом, щоб вони зазнали добра. Вони говорили: «Батьки наші так само зазнавали прикрощів і радощів!» Але Ми скарали їх так несподівано, що вони цього й не чекали",
1050,"Якби жителі цих селищ увірували й були богобоязливими, Ми б відкрили їм благословення небес і землі. Але вони вважали це за брехню, тож Ми скарали їх за те, що вони собі здобували",
1051,"Невже жителі селищ вважали, що Наше покарання не прийде до них уночі, коли вони сплять",
1052,"Невже жителі селищ вважали, що Наше покарання не прийде до них зранку, коли вони віддаються забавам?",
1053,"Невже вони не мали страху перед хитрістю Аллага? Не мають страху перед хитрістю Аллага люди, які зазнають втрат",
1054,"Хіба не пояснено тим, які отримали землю в спадок від її колишніх жителів, що, коли Ми побажаємо, скараємо їх за їхні гріхи? Ми запечатали їхні серця, тож не слухають вони",
1055,"Ми розповідаємо тобі звістки про ці селища. Їхні посланці приходили до них із ясними знаменнями, але вони не вірили в те, що вже раніше сприйняли як брехню. Так Аллаг накладає печать на серця невіруючих",
1056,Ми не знайшли більшості з них відданими завіту. Але Ми знайшли більшість із них нечестивцями,
1057,"Після них Ми послали Мусу з Нашими знаменнями до Фірауна й наближених його. Але вони вчинили з ними несправедливо. Поглянь же, який був кінець нечестивців",
1058,Муса сказав: «О Фірауне! Я — посланець від Господа світів,
1059,Я повинен говорити про Аллага лише істину. Я приніс вам ясне знамення від Господа вашого. Тож відпусти зі мною синів Ісраїля!,
1060,"Той відповів: «Якщо ти прийшов зі знаменням, то покажи його, коли ти один із правдивих!",
1061,"Він кинув свою палицю, й стала вона справжнім змієм",
1062,"Він простяг свою руку, тож усі побачили, що вона стала здоровою",
1063,"Старшина народу Фірауна сказала: «Воістину, він — вправний чаклун",
1064,Він прагне вигнати вас із вашої землі! Що ж ви порадите?,
1065,"Інші відповіли: «Дай час йому та брату його, а по містах розішли вісників",
1066,які приведуть до тебе всіх вправних чаклунів!,
1067,"Чаклуни прийшли до Фірауна й сказали: «Ми маємо отримати винагороду, якщо будемо переможцями!",
1068,"Той відповів: «Так, і ви будете одними з наближених!",
1069,"Вони сказали: «О Мусо, або кидай спершу ти, або кинемо ми!",
1070,"Той відповів: «Кидайте ви!» І коли вони кинули, то зачарували погляд людей, налякали їх і показали великі чари",
1071,"А Ми відкрили Мусі: «Кидай свою палицю!» І ось стала вона поглинати те, що створили вони",
1072,"Постала істина й стало марним те, що робили вони",
1073,Вони зазнали поразки й повернулися приниженими,
1074,Чаклуни впали в земному поклон,
1075,й сказали: «Ми увірували в Господа світів,
1076,Господа Муси та Гаруна!,
1077,"Фіраун сказав: «Як, ви увірували в Нього без мого дозволу?! Це ваші хитрощі. Ви задумали їх у місті, щоб вигнати звідти його жителів. Але скоро ви дізнаєтеся",
1078,"Я накажу відтяти вам руки й ноги навхрест, а потім розіпнути вас усіх!",
1079,"Ті сказали: «Воістину, ми повертаємося до Господа нашого",
1080,"Ти мстишся нам за те, що ми увірували в знамення Господа нашого, коли вони прийшли до нас. Господи наш! Даруй нам терпіння й забери нас відданими Тобі!",
1081,Старшина народу Фірауна сказала: «Невже ти дозволиш Мусі та його народу поширювати безчестя на землі й зректися тебе й твоїх богів?» Той відповів: «Ми будемо вбивати синів їхніх і залишати в живих жінок їхніх. Ми маємо владу над ними!,
