id,text,foot_notes
1,"Ім’ям Аллага Милостивого, Милосердного",
2,"Хвала Аллагу, Господу світів",
3,"Милостивому, Милосердному",
4,Царю Судного Дня,
5,Лише Тобі ми поклоняємося і лише в Тебе просимо допомоги,
6,веди нас шляхом прямим,
7,"шляхом тих, кого Ти наділив благами, а не тих, хто під гнівом Твоїм, і не тих, хто заблукав!",
8,Аліф. Лям. Мім.,
9,"Це — Писання, в якому немає сумніву, — прямий шлях для богобоязливих",
10,"які вірують у потаємне, звершують молитву та жертвують із того, чим наділили Ми їх",
11,"які вірять у те, що зіслано тобі та в те, що зіслано перед тобою, і впевнені в існуванні наступного життя",
12,"Вони на шляху Господа їхнього, вони матимуть успіх",
13,"Воістину, тим, які не вірують, байдуже, застерігатимеш ти їх чи ні — вони не увірують",
14,"Аллаг запечатав їхні серця та слух, а на очах їхніх завіса. Чекає на них кара велика",
15,"Є серед людей такі, хто говорить: «Ми увірували в Аллага та в Останній День», — але ж насправді не вірують вони",
16,"Вони намагаються обманути Аллага й тих, які увірували, але ж насправді вони обманюють лише самих себе. Та не розуміють цього вони",
17,"Їхні серця хворі і посилить Аллаг цю хворобу! Чекає на них болісна кара — за те, що вони говорили неправду!",
18,"Коли говорять їм: «Не чиніть безчестя на землі», — вони відповідають: «Та ми ж тільки робимо краще!",
19,"Та ж ні! Воістину, вони — нечестивці, хоча самі цього й не відчувають",
20,"І коли говорять їм: «Увіруйте — так, як вже увірували люди», — то відповідають вони: «Невже ми увіруємо так, як увірували ці невігласи?» Та ж ні! Воістину, це вони — невігласи, але самі цього не знають",
21,"І коли вони зустрічають тих, які увірували, то говорять: «Ми увірували!» А коли залишаються наодинці зі своїми шайтанами, то говорять: «Ми — з вами і ми лише насміхалися!",
22,Аллаг сам поглузує з них та й залишить їх блукати в непослуху,
23,"Вони — ті, які купили оману за прямий шлях! Але немає прибутку в цій справі і не йдуть вони прямим шляхом",
24,"Вони — як ті, хто розпалив вогонь, а коли він освітив усе навколо, Аллаг забрав це світло, залишивши їх у пітьмі, і нічого не бачать вони",
25,"Глухі, німі та сліпі! Вони не повернуться [на прямий шлях]",
26,"Або й на тих, що потрапили під зливу із хмари на небі, а там — темрява, грім, блискавка! Вони бояться смерті й затуляють пальцями вуха, коли вдаряє блискавка. Аллаг оточує невіруючих",
27,"Блискавка мало не осліплює їх. Коли спалах освітлює їх, вони йдуть, а коли огортає темрява, зупиняються. Якби Аллаг побажав, то забрав би їхній слух та зір. Воістину, Аллаг спроможний на кожну річ",
28,"О ви, люди! Поклоняйтеся Господу вашому, Який створив і вас, і тих, що жили перед вами. Можливо, ви будете богобоязливими",
29,"Тому, Хто створив для вас землю ложем, а небо — стелею, Хто зіслав із неба воду й проростив нею плоди для вашого прожитку. Тож не додавайте Аллагу рівних, адже ви знаєте",
30,"Якщо ви сумніваєтесь у тому, що зіслали Ми рабу Нашому, то принесіть суру, подібну до цієї! І покличте своїх свідків, окрім Аллага, якщо ви правдиві",
31,"А якщо ви не зробите цього — а ви ніколи не зробите цього! — то бійтеся вогню, в якому палають люди та каміння. Чекає він на невіруючих",
32,"Сповісти ж радісну звістку тим, які увірували й творили добро. Чекають на них сади, де течуть ріки. Коли наділяють їх плодами звідти, то вони говорять: «Це те, чим наділяли нас раніше», — але ж насправді схожі вони лише ззовні. Матимуть вони там пречистих дружин. І будуть вони там довіку",
33,"Воістину, Аллаг не посоромиться навести як приклад комара або й щось понад нього. Тож ті, які увірували, знають, що така притча — істина від Господа їхнього, а ті, які не увірували, говорять: «Що хотів сказати Аллаг цією притчею?» Багатьох Він збиває нею зі шляху, а багатьох веде шляхом прямим. А зі шляху Він збиває лише нечестивців",
34,"тих, які порушують завіт Аллага після прийняття його, розривають те, що Аллаг наказав з’єднати, та й чинять безчестя на землі! Саме вони втратять усе",
35,"Як, ви не віруєте в Аллага? Ви були мертвими, а Він дав вам життя. Потім Він знову вмертвить вас і знову подарує вам життя, і до Нього повернетесь ви!",
36,"Він — Той, Хто створив для вас усе, що на землі, а потім повернувся до неба та й впорядкував сім небес. Він знає про кожну річ",
37,"І коли сказав Господь твій ангелам: «Я поставлю намісника на землі!» — то вони запитали: «Ти хочеш поставити там того, хто чинитиме безчестя та проливатиме кров, тоді як Ми прославляємо Тебе хвалою та славимо святість Твою?» Він відповів: «Я знаю те, чого не знаєте ви!",
38,"І Він навчив Адама всіх імен, а потім сказав ангелам: «Назвіть Мені ці імена, якщо ви правдиві!",
39,"Ті відповіли: «Преславний Ти! Ми знаємо лише те, чому Ти навчив нас. Воістину, Ти — Всезнаючий, Мудрий!",
40,"Тоді Він сказав: «О Адаме! Назви їм ці імена!» А коли той назвав їм ці імена, Він мовив: «Чи ж не говорив Я вам, що знаю потаємне небес і землі, і знаю те, що відкриваєте ви та що приховуєте?",
41,"І коли Ми сказали ангелам: «Низько вклоніться Адаму!» — то вклонилися усі, крім Ібліса, який відмовився, вивищився та став невіруючим",
42,"І сказали Ми: «О Адаме! Живи разом зі своєю дружиною у раю. Їжте досхочу, коли б ви не побажали. Але не наближайтесь до цього дерева, бо станете одними з нечестивців!",
43,"Проте шайтан змусив їх перечепитись об нього. Тож вони залишили те, що було там, і сказали Ми: «Вийдіть! І одні з вас будуть ворогами для інших! Земля стане для вас притулком і ви матимете там прожиток — до певного часу!",
44,"І прийняв Адам слова Господа свого й покаявся перед Ним. Воістину, Він — Приймаючий каяття, Милосердний",
45,"І сказали Ми: «Вийдіть звідти всі!» А якщо прийде від Мене до вас прямий шлях, то ті, хто йтиме прямим шляхом Моїм, не матимуть страху й не будуть засмучені",
46,"А ті, які не вірували та й вважали Наші знамення брехнею, вони — жителі пекла. Будуть вони там довіку",
47,"О сини Ісраїля! Згадайте блага Мої, якими Я наділив вас! Тримайтеся завіту зі Мною і Я триматимуся завіту із вами! І бійтесь лише Мене",
48,"І увіруйте в те, що Я зіслав як підтвердження даного вам, та й не будьте першими, хто не повірить у це. Не продавайте знамень Моїх за низьку ціну і бійтеся лише Мене",
49,"Не вбирайте істину в неправду та не приховуйте істини, адже ви її знаєте",
50,"Звершуйте молитву, давайте закят та схиляйте коліна разом із тими, хто вже робить це.",
51,Невже ви закликаєте людей до праведності й забуваєте про себе? Адже ви читаєте Писання! Хіба ви не розумієте,
52,"Шукайте допомоги в терпінні й молитві. Це важко для всіх, окрім смиренних",
53,"які впевнені, що зустрінуть Господа свого й повернуться до Нього",
54,"О сини Ісраїля! Згадайте блага Мої, якими Я наділив вас! Я вивищив вас над усіма іншими жителями світів",
55,"І бійтеся того Дня, коли жодна душа не дістане кари за іншу, і не приймуть від неї заступництва, і не візьмуть від неї відкупу. І ніхто не матиме помічників",
56,"І ось Ми врятували вас від роду Фірауна, який чинив над вами жорстоку розправу, вбиваючи синів ваших і залишаючи живими ваших жінок. І у цьому для вас від Господа вашого велике випробування",
57,"І ось розітнули Ми море для вас та й врятували вас, і втопили там рід Фірауна. І ви бачили це",
58,І ось Ми покликали Мусу на сорок ночей. Але після цього ви почали [поклонятись] тільцю! Нечестивці ж ви,
59,"Та потім Ми простили вас — можливо, ви будете вдячними",
60,"І ось Ми дарували Мусі Писання та Розрізнення — можливо, підете ви прямим шляхом",
61,"І ось сказав Муса народу своєму: «О народе мій! Узявши [для поклоніння] тільця, ви були несправедливі самі до себе. Покайтесь же перед Творцем своїм і вбийте [нечестивих] із вас — так буде краще для вас перед Творцем вашим! І прийме Він каяття ваше, воістину, Він — Приймаючий каяття, Милосердний!",
62,"І ось сказали ви: «О Мусо! Ми не повіримо тобі, поки не побачимо Аллага на власні очі!» І вразила вас блискавка, коли ви дивилися",
63,"А потім Ми воскресили вас, після вашої смерті — можливо, ви будете вдячні",
64,"І Ми затінили вас хмарою й зіслали вам манну та перепелів:«Їжте блага, якими Ми наділили вас!» Вони були несправедливі не до Нас, а до самих себе",
65,"І Ми сказали: «Увійдіть у це селище! Їжте досхочу, коли схочете й де схочете!» Увійдіть до брами, низько вклоніться й скажіть: «Прости нас!» — щоб простили Ми гріхи ваші та примножили [винагороду] праведникам",
66,"Ті, хто чинить несправедливо, замінили сказані для них слова на інші. Тож Ми зіслали на тих, хто чинить несправедливість, кару небесну — за те, що вони творили безчестя",
67,"І коли попросив Муса води для народу свого, то сказали Ми: «Удар своєю палицею в скелю!» І потекли звідти дванадцять джерел. І кожне плем’я знало, звідки йому пити. «Їжте й пийте з того, чим наділив вас Аллаг! І не сійте на землі зла!",
68,"І ось ви сказали: «О Мусо! Важко нам їсти одне й те ж саме. Попроси свого Господа, щоб Він зростив для нас те, що росте на землі: зелень, огірки, часник, сочевицю та цибулю!» Відповів Муса: «Невже ви просите замінити те, що краще, на щось низьке? Ідіть же в будь-яке селище! Там буде вам те, чого ви просите!» Спіткали їх приниження й бідність, та й накликали вони на себе гнів Аллага! Це їм за те, що вони не вірували у знамення Аллага, що вбивали пророків без права на те, що чинили непослух та були порушниками",
69,"Воістину, тим, хто увірував, і юдеям, і тим, які є християнами, і сабеям — усім, хто увірував в Аллага, в Останній День і хто творив добро — винагорода у Господа їхнього. Не матимуть вони страху й не будуть засмучені вони!",
70,"І коли Ми уклали із вами завіт та піднесли над вами гору [Сінай]: «Міцно тримайтеся того, що Ми дарували вам",
71,"Але після цього ви відвернулися! Та якби не ласка Аллага до вас та не милість Його, ви б неодмінно зазнали втрат",
72,"Ви знали тих серед вас, хто порушував суботу. Тому Ми сказали їм: «Будьте мавпами мерзенними!",
73,"Ми зробили це [покарання] прикладом для сучасників та наступників, повчанням для богобоязливих",
74,"І коли сказав Муса народу своєму: «Воістину, Аллаг наказує вам забити корову!» Вони запитали: «Ти що глузуєш із нас?» Той відповів: «Шукаю захисту в Аллага, щоб не бути невігласом!",
75,"Вони сказали: «Попроси свого Господа, щоб Він пояснив нам, якою вона повинна бути». Муса відповів: «Він говорить: корова повинна бути і не старою, і не телицею, а чимось середнім між цим. Тож робіть, що наказано вам!",
76,"Вони сказали: «Попроси свого Господа, щоб Він пояснив нам, якої вона повинна бути масті!» Муса відповів: «Він говорить: корова повинна бути рудою, світлого відтінку. Колір її тішить того, хто погляне на неї!",
77,"Вони сказали: «Попроси свого Господа, щоб Він пояснив нам, якою повинна вона бути, бо всі корови для нас однакові. Тоді, якщо побажає Аллаг, ми неодмінно підемо правильним шляхом!",
78,"Муса відповів: «Він говорить, що це корова, яка не оре та не ходить перед колесом для зрошування, вільна від будь-яких вад чи плям». Вони відповіли: «Тепер ти прийшов до нас з істиною!» І вони забили її, хоч думали вже цього не робити",
79,"І коли ви вбили живу душу й сперечалися про це, Аллаг розкрив те, що приховували ви",
80,"Ми сказали: «Вдарте [померлого] якоюсь частиною корови! Так Аллаг оживляє мертвих і показує вам знамення Свої — можливо, ви зрозумієте!",
81,"Потім серця ваші зробилися жорстокими й стали як камінь або й твердіше! Але є скелі, з яких течуть струмки. А ще такі, що розколюються й виходить із них вода. А є й такі, що падають від страху перед Аллагом! І Аллаг не забуває того, що робите ви",
82,"Невже ви сподіваєтесь, що вони повірять вам? Дехто з них чув слова Аллага, а потім, зрозумівши, спотворював їх. І вони знали це",
83,"І коли зустрічали вони тих, які увірували, то говорили: «Увірували ми!» А залишаючись наодинці, говорили: «Навіщо ви розповідаєте їм те, що Аллаг відкрив вам? Невже для того, щоб вони користувалися цим як доказом проти вас перед Господом вашим? Невже ви не розумієте?",
84,"Хіба вони не знають, що Аллаг відає те, що вони приховують, і те, що вони відкривають",
85,"Є серед них неписьменні, які не знають Писання, а тільки марно сподіваються. Але це — їхні вигадки",
86,"Горе тим, хто пише Писання власноруч, а потім говорить: «Це — від Аллага!» — щоб продати це за мізерну ціну! Горе їм за те, що написали вони, і горе їм за те, що вони собі здобули",
87,"Вони говорять: «Вогонь не торкнеться нас, хіба на лічені дні!» Скажи: «Невже ви уклали завіт із Аллагом? Тоді Аллаг ніколи не змінить обіцянки Своєї! Або ж ви говорите про Аллага те, чого й самі не знаєте»",
88,"Та ж ні! Ті, хто вчинив зло, кого оплутав власний гріх, вони — жителі вогню. Будуть вони там довіку!",
89,"А ті, хто увірував і творив добро, вони — жителі раю. Будуть вони там довіку",
90,"Ось Ми уклали завіт із синами Ісраїля: «Не поклоняйтесь нікому, окрім Аллага, ставтесь якнайкраще до батьків, інших родичів, сиріт та нужденних. Кажіть людям добре слово, звершуйте молитву, давайте закят». Але згодом ви відвернулися, окрім небагатьох, і відступили",
91,Уклали Ми завіт із вами: «Не проливайте крові одне одного і не женіть одне одного з помешкань ваших». Ви визнали це й свідчили про це,
92,"Але потім ви почали вбивати одне одного і вигнали частину з вас із ваших помешкань. Потурали ви одне одному в гріху й ворожнечі! А коли тих приводять до вас полоненими, ви даєте за них викуп. Але ж було заборонено вам [виганяти] їх! Невже ви вірите в одну частину Писання, заперечуючи іншу? То яка винагорода може бути тим, хто робить це, як не ганьба у земному житті? У День Воскресіння скарають вас ще лютішою карою! Аллаг не омине того, що робите ви",
93,"Вони — ті, хто купив земне життя за життя майбутнє. Не буде полегшено їм кари і не буде їм допомоги",
94,"Ми дарували Мусі Писання й слідом за ним направили посланців. Ми дарували Іcі, сину Мар’ям, ясні знамення та підтримали його Духом Святим. Щоразу, коли приходив до вас посланець із тим, що було вам не до душі, ви гордували! Одних ви вважали за брехунів, інших — убивали!",
95,"Вони говорять: «Серця наші закриті!» Та ж ні, нехай Аллаг прокляне їх за невір’я їхнє! Мало віруючих серед них",
96,"І ось прийшло до них Писання від Аллага, яке підтверджує те, що вже є у них. Раніше вони просили перемоги над тими, хто не вірує, а коли прийшло до них відоме їм, то вони самі не увірували. Нехай же буде прокляття Аллага над невіруючими",
97,"Недобре те, що придбали вони в обмін на свої душі, не увірувавши в те, що послав Аллаг, заздрячи тому, що Аллаг наділяє з ласки Своєї того з рабів Своїх, кого побажає. І накликали вони на себе подвійний гнів. На невіруючих чекає принизлива кара",
