id,text,foot_notes
2194,Walaqad sarrafna fee hathaalqur-ani linnasi min kulli mathalin wakanaal-insanu akthara shay-in jadala,
2195,Wama manaAAa annasa anyu/minoo ith jaahumu alhuda wayastaghfiroorabbahum illa an ta/tiyahum sunnatu al-awwaleena awya/tiyahumu alAAathabu qubula,
2196,Wama nursilu almursaleena illamubashshireena wamunthireena wayujadilu allatheenakafaroo bilbatili liyudhidoo bihi alhaqqawattakhathoo ayatee wama onthiroohuzuwa,
2197,Waman athlamu mimman thukkirabi-ayati rabbihi faaAArada AAanhawanasiya ma qaddamat yadahu inna jaAAalnaAAala quloobihim akinnatan an yafqahoohu wafee athanihimwaqran wa-in tadAAuhum ila alhuda falan yahtadoo ithanabada,
2198,Warabbuka alghafooru thoo arrahmatilaw yu-akhithuhum bima kasaboo laAAajjalalahumu alAAathaba bal lahum mawAAidun lan yajidoo mindoonihi maw-ila,
2199,Watilka alqura ahlaknahum lammathalamoo wajaAAalna limahlikihim mawAAida,
2200,Wa-ith qala moosa lifatahula abrahu hatta ablugha majmaAAa albahrayniaw amdiya huquba,
2201,Falamma balagha majmaAAabaynihima nasiya hootahuma fattakhathasabeelahu fee albahri saraba,
2202,Falamma jawaza qalalifatahu atina ghadaana laqadlaqeena min safarina hatha nasaba,
2203,Qala araayta ith awaynaila assakhrati fa-innee naseetu alhootawama ansaneehu illa ashshaytanuan athkurahu wattakhatha sabeelahu fee albahriAAajaba,
2204,Qala thalika ma kunnanabghi fartadda AAala atharihimaqasasa,
2205,Fawajada AAabdan min AAibadinaataynahu rahmatan min AAindinawaAAallamnahu min ladunna AAilma,
2206,Qala lahu moosa halattabiAAuka AAala an tuAAallimani mimma AAullimtarushda,
2207,Qala innaka lan tastateeAAamaAAiya sabra,
2208,Wakayfa tasbiru AAala malam tuhit bihi khubra,
2209,Qala satajidunee in shaa Allahusabiran wala aAAsee laka amra,
2210,Qala fa-ini ittabaAAtanee falatas-alnee AAan shay-in hatta ohditha lakaminhu thikra,
2211,Fantalaqa hattaitha rakiba fee assafeenati kharaqahaqala akharaqtaha litughriqa ahlaha laqadji/ta shay-an imra,
2212,Qala alam aqul innaka lan tastateeAAamaAAiya sabra,
2213,Qala la tu-akhithneebima naseetu wala turhiqnee min amree AAusra,
2214,Fantalaqa hattaitha laqiya ghulaman faqatalahu qalaaqatalta nafsan zakiyyatan bighayri nafsin laqad ji/ta shay-annukra,
2215,Qala alam aqul laka innaka lan tastateeAAamaAAiya sabra,
2216,Qala in saaltuka AAan shay-in baAAdahafala tusahibnee qad balaghta min ladunnee AAuthra,
2217,Fantalaqa hattaitha ataya ahla qaryatin istatAAamaahlaha faabaw an yudayyifoohuma fawajadafeeha jidaran yureedu an yanqadda faaqamahuqala law shi/ta lattakhathta AAalayhi ajra,
2218,Qala hatha firaqubaynee wabaynika saonabbi-oka bita/weeli ma lam tastatiAAAAalayhi sabra,
2219,Amma assafeenatu fakanatlimasakeena yaAAmaloona fee albahri faaradtu anaAAeebaha wakana waraahum malikun ya/khuthukulla safeenatin ghasba,
2220,Waamma alghulamu fakanaabawahu mu/minayni fakhasheena an yurhiqahumatughyanan wakufra,
2221,Faaradna an yubdilahumarabbuhuma khayran minhu zakatan waaqraba ruhma,
2222,Waamma aljidaru fakanalighulamayni yateemayni fee almadeenati wakana tahtahukanzun lahuma wakana aboohuma salihanfaarada rabbuka an yablugha ashuddahumawayastakhrija kanzahuma rahmatan min rabbikawama faAAaltuhu AAan amree thalika ta/weelu malam tastiAA AAalayhi sabra,
2223,Wayas-aloonaka AAan thee alqarnayniqul saatloo AAalaykum minhu thikra,
2224,Inna makkanna lahu fee al-ardiwaataynahu min kulli shay-in sababa,
2225,FaatbaAAa sababa,
2226,Hatta itha balaghamaghriba ashshamsi wajadaha taghrubu fee AAaynin hami-atinwawajada AAindaha qawman qulna ya thaalqarnayni imma an tuAAaththiba wa-imma antattakhitha feehim husna,
2227,Qala amma man thalamafasawfa nuAAaththibuhu thumma yuraddu ila rabbihifayuAAaththibuhu AAathaban nukra,
2228,Waamma man amana waAAamila salihanfalahu jazaan alhusna wasanaqoolu lahu minamrina yusra,
2229,Thumma atbaAAa sababa,
2230,Hatta itha balagha matliAAaashshamsi wajadaha tatluAAu AAalaqawmin lam najAAal lahum min dooniha sitra,
2231,Kathalika waqad ahatnabima ladayhi khubra,
2232,Thumma atbaAAa sababa,
2233,Hatta itha balaghabayna assaddayni wajada min doonihima qawman layakadoona yafqahoona qawla,
2234,Qaloo ya tha alqarnayniinna ya/jooja wama/jooja mufsidoona fee al-ardi fahalnajAAalu laka kharjan AAala an tajAAala baynanawabaynahum sadda,
2235,Qala ma makkannee feehi rabbeekhayrun faaAAeenoonee biquwwatin ajAAal baynakum wabaynahum radma,
2236,Atoonee zubara alhadeedi hattaitha sawa bayna asadafayni qalaonfukhoo hatta itha jaAAalahu naran qalaatoonee ofrigh AAalayhi qitra,
2237,Fama istaAAoo an yathharoohuwama istataAAoo lahu naqba,
2238,Qala hatha rahmatun minrabbee fa-itha jaa waAAdu rabbee jaAAalahu dakkaawakana waAAdu rabbee haqqa,
2239,Watarakna baAAdahum yawma-ithinyamooju fee baAAdin wanufikha fee assoorifajamaAAnahum jamAAa,
2240,WaAAaradna jahannama yawma-ithinlilkafireena AAarda,
2241,Allatheena kanat aAAyunuhumfee ghita-in AAan thikree wakanoo layastateeAAoona samAAa,
2242,Afahasiba allatheena kafarooan yattakhithoo AAibadee min doonee awliyaainna aAAtadna jahannama lilkafireena nuzula,
2243,Qul hal nunabbi-okum bil-akhsareenaaAAmala,
2244,Allatheena dalla saAAyuhumfee alhayati addunya wahum yahsaboonaannahum yuhsinoona sunAAa,
2245,Ola-ika allatheena kafaroobi-ayati rabbihim waliqa-ihi fahabitataAAmaluhum fala nuqeemu lahum yawma alqiyamatiwazna,
2246,Thalika jazaohum jahannamubima kafaroo wattakhathoo ayateewarusulee huzuwa,
2247,Inna allatheena amanoowaAAamiloo assalihati kanat lahumjannatu alfirdawsi nuzula,
2248,Khalideena feeha layabghoona AAanha hiwala,
2249,Qul law kana albahru midadanlikalimati rabbee lanafida albahru qabla an tanfadakalimatu rabbee walaw ji/na bimithlihi madada,
2250,Qul innama ana basharunmithlukum yooha ilayya annama ilahukum ilahunwahidun faman kana yarjoo liqaa rabbihifalyaAAmal AAamalan salihan wala yushrikbiAAibadati rabbihi ahada,
2251,Kaf-ha-ya-AAayn-sad,
2252,Thikru rahmati rabbika AAabdahuzakariyya,
2253,Ith nada rabbahu nidaankhafiyya,
2254,Qala rabbi innee wahana alAAathmuminnee washtaAAala arra/su shayban walam akunbiduAAa-ika rabbi shaqiyya,
2255,Wa-innee khiftu almawaliya min wara-eewakanati imraatee AAaqiran fahab lee min ladunkawaliyya,
2256,Yarithunee wayarithu min ali yaAAqoobawajAAalhu rabbi radiyya,
2257,Ya zakariyya innanubashshiruka bighulamin ismuhu yahya lamnajAAal lahu min qablu samiyya,
2258,Qala rabbi anna yakoonu leeghulamun wakanati imraatee AAaqiran waqadbalaghtu mina alkibari AAitiyya,
2259,Qala kathalika qalarabbuka huwa AAalayya hayyinun waqad khalaqtuka min qablu walamtaku shay-a,
2260,Qala rabbi ijAAal lee ayatan qalaayatuka alla tukallima annasa thalathalayalin sawiyya,
2261,Fakharaja AAala qawmihi mina almihrabifaawha ilayhim an sabbihoo bukratan waAAashiyya,
2262,Ya yahya khuthialkitaba biquwwatin waataynahu alhukmasabiyya,
2263,Wahananan min ladunnawazakatan wakana taqiyya,
2264,Wabarran biwalidayhi walam yakun jabbaranAAasiyya,
2265,Wasalamun AAalayhi yawma wulidawayawma yamootu wayawma yubAAathu hayya,
2266,Wathkur fee alkitabimaryama ithi intabathat min ahliha makanansharqiyya,
2267,Fattakhathat min doonihim hijabanfaarsalna ilayha roohanafatamaththala laha basharan sawiyya,
2268,Qalat innee aAAoothu birrahmaniminka in kunta taqiyya,
2269,Qala innama ana rasoolurabbiki li-ahaba laki ghulaman zakiyya,
2270,Qalat anna yakoonu lee ghulamunwalam yamsasnee basharun walam aku baghiyya,
2271,Qala kathaliki qalarabbuki huwa AAalayya hayyinun walinajAAalahu ayatan linnasiwarahmatan minna wakana amran maqdiyya,
2272,Fahamalat-hu fantabathatbihi makanan qasiyya,
2273,Faajaaha almakhadu ilajithAAi annakhlati qalat ya laytaneemittu qabla hatha wakuntu nasyan mansiyya,
2274,Fanadaha min tahtihaalla tahzanee qad jaAAala rabbuki tahtakisariyya,
2275,Wahuzzee ilayki bijithAAi annakhlatitusaqit AAalayki rutaban janiyya,
2276,Fakulee washrabee waqarree AAaynanfa-imma tarayinna mina albashari ahadan faqooleeinnee nathartu lirrahmani sawmanfalan okallima alyawma insiyya,
2277,Faatat bihi qawmaha tahmiluhuqaloo ya maryamu laqad ji/ti shay-an fariyya,
2278,Ya okhta haroona ma kanaabooki imraa saw-in wama kanat ommuki baghiyya,
2279,Faasharat ilayhi qaloo kayfanukallimu man kana fee almahdi sabiyya,
2280,Qala innee AAabdu Allahi ataniyaalkitaba wajaAAalanee nabiyya,
2281,WajaAAalanee mubarakan aynamakuntu waawsanee bissalati wazzakatima dumtu hayya,
2282,Wabarran biwalidatee walam yajAAalneejabbaran shaqiyya,
2283,Wassalamu AAalayya yawmawulidtu wayawma amootu wayawma obAAathu hayya,
2284,Thalika AAeesa ibnu maryamaqawla alhaqqi allathee feehi yamtaroon,
2285,Ma kana lillahi anyattakhitha min waladin subhanahu itha qadaamran fa-innama yaqoolu lahu kun fayakoon,
2286,Wa-inna Allaha rabbee warabbukum faAAbudoohuhatha siratun mustaqeem,
2287,Fakhtalafa al-ahzabumin baynihim fawaylun lillatheena kafaroo min mashhadiyawmin AAatheem,
2288,AsmiAA bihim waabsir yawma ya/toonanalakini aththalimoona alyawmafee dalalin mubeen,
2289,Waanthirhum yawma alhasrati ithqudiya al-amru wahum fee ghaflatin wahum layu/minoon,
2290,Inna nahnu narithu al-ardawaman AAalayha wa-ilayna yurjaAAoon,
2291,Wathkur fee alkitabiibraheema innahu kana siddeeqan nabiyya,
2292,Ith qala li-abeehi yaabati lima taAAbudu ma la yasmaAAu wala yubsiruwala yughnee AAanka shay-a,
2293,Ya abati innee qad jaanee minaalAAilmi ma lam ya/tika fattabiAAnee ahdika siratansawiyya,
2294,Ya abati la taAAbudi ashshaytanainna ashshaytana kana lirrahmaniAAasiyya,
2295,Ya abati innee akhafu anyamassaka AAathabun mina arrahmanifatakoona lishshyatani waliyya,
2296,Qala araghibun anta AAan alihateeya ibraheemu la-in lam tantahi laarjumannaka wahjurneemaliyya,
2297,Qala salamun AAalaykasaastaghfiru laka rabbee innahu kana bee hafiyya,
2298,WaaAAtazilukum wama tadAAoona mindooni Allahi waadAAoo rabbee AAasa allaakoona biduAAa-i rabbee shaqiyya,
2299,Falamma iAAtazalahum wamayaAAbudoona min dooni Allahi wahabna lahu ishaqawayaAAqooba wakullan jaAAalna nabiyya,
2300,Wawahabna lahum min rahmatinawajaAAalna lahum lisana sidqin AAaliyya,
2301,Wathkur fee alkitabimoosa innahu kana mukhlasan wakanarasoolan nabiyya,
2302,Wanadaynahu min janibiattoori al-aymani waqarrabnahu najiyya,
2303,Wawahabna lahu min rahmatinaakhahu haroona nabiyya,
2304,Wathkur fee alkitabiismaAAeela innahu kana sadiqa alwaAAdi wakanarasoolan nabiyya,
2305,Wakana ya/muru ahlahu bissalatiwazzakati wakana AAinda rabbihi mardiyya,
2306,Wathkur fee alkitabiidreesa innahu kana siddeeqan nabiyya,
2307,WarafaAAnahu makanan AAaliyya,
2308,Ola-ika allatheena anAAama AllahuAAalayhim mina annabiyyeena min thurriyyati adamawamimman hamalna maAAa noohin wamin thurriyyatiibraheema wa-isra-eela wamimman hadayna wajtabaynaitha tutla AAalayhim ayatu arrahmanikharroo sujjadan wabukiyya,
2309,Fakhalafa min baAAdihim khalfun adaAAooassalata wattabaAAoo ashshahawatifasawfa yalqawna ghayya,
2310,Illa man taba waamanawaAAamila salihan faola-ika yadkhuloonaaljannata wala yuthlamoona shay-a,
2311,Jannati AAadnin allatee waAAada arrahmanuAAibadahu bighaybi innahu kana waAAduhuma/tiyya,
2312,La yasmaAAoona feeha laghwanilla salaman walahum rizquhum feeha bukratanwaAAashiyya,
2313,Tilka aljannatu allatee noorithu min AAibadinaman kana taqiyya,
2314,Wama natanazzalu illa bi-amrirabbika lahu ma bayna aydeena wama khalfanawama bayna thalika wama kana rabbukanasiyya,
2315,Rabbu assamawati wal-ardiwama baynahuma faAAbudhu wastabirliAAibadatihi hal taAAlamu lahu samiyya,
2316,Wayaqoolu al-insanu a-itha mamittu lasawfa okhraju hayya,
2317,Awa la yathkuru al-insanuanna khalaqnahu min qablu walam yaku shay-a,
2318,Fawarabbika lanahshurannahum washshayateenathumma lanuhdirannahum hawla jahannama jithiyya,
2319,Thumma lananziAAanna min kulli sheeAAatinayyuhum ashaddu AAala arrahmaniAAitiyya,
2320,Thumma lanahnu aAAlamu billatheenahum awla biha siliyya,
2321,Wa-in minkum illa wariduhakana AAala rabbika hatman maqdiyya,
2322,Thumma nunajjee allatheena ittaqawwanatharu aththalimeena feehajithiyya,
2323,Wa-itha tutla AAalayhim ayatunabayyinatin qala allatheena kafaroo lillatheenaamanoo ayyu alfareeqayni khayrun maqaman waahsanunadiyya,
2324,Wakam ahlakna qablahum min qarnin humahsanu athathan wari/ya,
2325,Qul man kana fee addalalatifalyamdud lahu arrahmanu maddan hattaitha raaw ma yooAAadoona imma alAAathabawa-imma assaAAata fasayaAAlamoona man huwasharrun makanan waadAAafu junda,
2326,Wayazeedu Allahu allatheenaihtadaw hudan walbaqiyatu assalihatukhayrun AAinda rabbika thawaban wakhayrun maradda,
2327,Afaraayta allathee kafara bi-ayatinawaqala laootayanna malan wawalada,
2328,AttalaAAa alghayba ami ittakhathaAAinda arrahmani AAahda,
2329,Kalla sanaktubu ma yaqooluwanamuddu lahu mina alAAathabi madda,
2330,Wanarithuhu ma yaqoolu waya/teenafarda,
2331,Wattakhathoo min dooni Allahialihatan liyakoonoo lahum AAizza,
2332,Kalla sayakfuroona biAAibadatihimwayakoonoona AAalayhim didda,
2333,Alam tara anna arsalna ashshayateenaAAala alkafireena taozzuhum azza,
2334,Fala taAAjal AAalayhim innamanaAAuddu lahum AAadda,
2335,Yawma nahshuru almuttaqeena ilaarrahmani wafda,
2336,Wanasooqu almujrimeena ila jahannamawirda,
2337,La yamlikoona ashshafaAAatailla mani ittakhatha AAinda arrahmaniAAahda,
2338,Waqaloo ittakhatha arrahmanuwalada,
2339,Laqad ji/tum shay-an idda,
2340,Takadu assamawatuyatafattarna minhu watanshaqqu al-ardu watakhirrualjibalu hadda,
2341,An daAAaw lirrahmaniwalada,
2342,Wama yanbaghee lirrahmanian yattakhitha walada,
2343,In kullu man fee assamawatiwal-ardi illa atee arrahmaniAAabda,
2344,Laqad ahsahum waAAaddahum AAadda,
2345,Wakulluhum ateehi yawma alqiyamatifarda,
2346,Inna allatheena amanoowaAAamiloo assalihati sayajAAalu lahumu arrahmanuwudda,
2347,Fa-innama yassarnahu bilisanikalitubashshira bihi almuttaqeena watunthira bihi qawmanludda,
2348,Wakam ahlakna qablahum min qarnin haltuhissu minhum min ahadin aw tasmaAAu lahum rikza,
2349,Ta-ha,
2350,Ma anzalna AAalayka alqur-analitashqa,
2351,Illa tathkiratan liman yakhsha,
2352,Tanzeelan mimman khalaqa al-arda wassamawatialAAula,
2353,Arrahmanu AAalaalAAarshi istawa,
2354,Lahu ma fee assamawatiwama fee al-ardi wama baynahuma wamatahta aththara,
2355,Wa-in tajhar bilqawli fa-innahuyaAAlamu assirra waakhfa,
2356,Allahu la ilaha illahuwa lahu al-asmao alhusna,
2357,Wahal ataka hadeethu moosa,
2358,Ith raa naran faqalali-ahlihi omkuthoo innee anastu naran laAAallee ateekumminha biqabasin aw ajidu AAala annarihuda,
2359,Falamma ataha noodiya yamoosa,
2360,Innee ana rabbuka fakhlaAAnaAAlayka innaka bilwadi almuqaddasi tuwa,
2361,Waana ikhtartuka fastamiAAlima yooha,
2362,Innanee ana Allahu lailaha illa ana faAAbudnee waaqimi assalatalithikree,
2363,Inna assaAAata atiyatunakadu okhfeeha litujza kullu nafsin bimatasAAa,
2364,Fala yasuddannaka AAanhaman la yu/minu biha wattabaAAa hawahufatarda,
2365,Wama tilka biyameenika ya moosa,
2366,Qala hiya AAasaya atawakkaoAAalayha waahushshu biha AAala ghanameewaliya feeha maaribu okhra,
2367,Qala alqiha ya moosa,
2368,Faalqaha fa-itha hiya hayyatuntasAAa,
2369,Qala khuthha walatakhaf sanuAAeeduha seerataha al-oola,
2370,Wadmum yadaka ila janahikatakhruj baydaa min ghayri soo-in ayatan okhra,
2371,Linuriyaka min ayatinaalkubra,
2372,Ithhab ila firAAawna innahu tagha,
2373,Qala rabbi ishrah lee sadree,
2374,Wayassir lee amree,
2375,Wahlul AAuqdatan min lisanee,
2376,Yafqahoo qawlee,
2377,WajAAal lee wazeeran min ahlee,
2378,Haroona akhee,
2379,Oshdud bihi azree,
2380,Waashrik-hu fee amree,
2381,Kay nusabbihaka katheera,
2382,Wanathkuraka katheera,
2383,Innaka kunta bina baseera,
2384,Qala qad ooteeta su/laka yamoosa,
2385,Walaqad mananna AAalayka marratanokhra,
2386,Ith awhayna ilaommika ma yooha,
2387,Ani iqthifeehi fee attabootifaqthifeehi fee alyammi falyulqihi alyammu bissahiliya/khuthhu AAaduwwun lee waAAaduwwun lahu waalqaytuAAalayka mahabbatan minnee walitusnaAAa AAalaAAaynee,
2388,Ith tamshee okhtuka fataqoolu haladullukum AAala man yakfuluhu farajaAAnaka ilaommika kay taqarra AAaynuha wala tahzanawaqatalta nafsan fanajjaynaka mina alghammi wafatannakafutoonan falabithta sineena fee ahli madyana thumma ji/ta AAalaqadarin ya moosa,
2389,WastanaAAtuka linafsee,
2390,Ithhab anta waakhooka bi-ayateewala taniya fee thikree,
2391,Ithhaba ila firAAawnainnahu tagha,
2392,Faqoola lahu qawlan layyinanlaAAallahu yatathakkaru aw yakhsha,
2393,Qala rabbana innananakhafu an yafruta AAalayna aw an yatgha,
2394,Qala la takhafainnanee maAAakuma asmaAAu waara,
2395,Fa/tiyahu faqoola innarasoola rabbika faarsil maAAana banee isra-eelawala tuAAaththibhum qad ji/naka bi-ayatinmin rabbika wassalamu AAala mani ittabaAAaalhuda,
2396,Inna qad oohiya ilaynaanna alAAathaba AAala man kaththaba watawalla,
2397,Qala faman rabbukuma yamoosa,
2398,Qala rabbuna allatheeaAAta kulla shay-in khalqahu thumma hada,
2399,Qala fama balualqurooni al-oola,
2400,Qala AAilmuha AAinda rabbeefee kitabin la yadillu rabbee walayansa,
2401,Allathee jaAAala lakumu al-ardamahdan wasalaka lakum feeha subulan waanzala mina assama-imaan faakhrajna bihi azwajan min nabatinshatta,
2402,Kuloo warAAaw anAAamakum innafee thalika laayatin li-olee annuha,
2403,Minha khalaqnakum wafeehanuAAeedukum waminha nukhrijukum taratan okhra,
2404,Walaqad araynahu ayatinakullaha fakaththaba waaba,
2405,Qala aji/tana litukhrijanamin ardina bisihrika ya moosa,
2406,Falana/tiyannaka bisihrin mithlihi fajAAalbaynana wabaynaka mawAAidan la nukhlifuhu nahnuwala anta makanan suwa,
2407,Qala mawAAidukum yawmu azzeenatiwaan yuhshara annasu duha,
2408,Fatawalla firAAawnu fajamaAAa kaydahuthumma ata,
2409,Qala lahum moosa waylakum lataftaroo AAala Allahi kathiban fayushitakumbiAAathabin waqad khaba mani iftara,
2410,FatanazaAAoo amrahum baynahumwaasarroo annajwa,
2411,Qaloo in hathani lasahiraniyureedani an yukhrijakum min ardikum bisihrihimawayathhaba bitareeqatikumu almuthla,
2412,FaajmiAAoo kaydakum thumma i/too saffanwaqad aflaha alyawma mani istaAAla,
2413,Qaloo ya moosa immaan tulqiya wa-imma an nakoona awwala man alqa,
2414,Qala bal alqoo fa-itha hibaluhumwaAAisiyyuhum yukhayyalu ilayhi min sihrihim annahatasAAa,
2415,Faawjasa fee nafsihi kheefatan moosa,
2416,Qulna la takhaf innaka antaal-aAAla,
2417,Waalqi ma fee yameenika talqaf masanaAAoo innama sanaAAoo kaydu sahirinwala yuflihu assahiru haythuata,
2418,Faolqiya assaharatu sujjadanqaloo amanna birabbi haroona wamoosa,
2419,Qala amantum lahu qabla an athanalakum innahu lakabeerukumu allathee AAallamakumu assihrafalaoqattiAAanna aydiyakum waarjulakum min khilafinwalaosallibannakum fee juthooAAi annakhliwalataAAlamunna ayyuna ashaddu AAathaban waabqa,
2420,Qaloo lan nu/thiraka AAala majaana mina albayyinati wallatheefatarana faqdi ma anta qadininnama taqdee hathihi alhayataaddunya,
2421,Inna amanna birabbinaliyaghfira lana khatayana wamaakrahtana AAalayhi mina assihri wallahukhayrun waabqa,
2422,Innahu man ya/ti rabbahu mujriman fa-innalahu jahannama la yamootu feeha wala yahya,
2423,Waman ya/tihi mu/minan qad AAamila assalihatifaola-ika lahumu addarajatu alAAula,
2424,Jannatu AAadnin tajree min tahtihaal-anharu khalideena feeha wathalikajazao man tazakka,
2425,Walaqad awhayna ilamoosa an asri biAAibadee fadriblahum tareeqan fee albahri yabasan la takhafudarakan wala takhsha,
2426,FaatbaAAahum firAAawnu bijunoodihifaghashiyahum mina alyammi ma ghashiyahum,
2427,Waadalla firAAawnu qawmahu wamahada,
2428,Ya banee isra-eela qad anjaynakummin AAaduwwikum wawaAAadnakum janiba attoorial-aymana wanazzalna AAalaykumu almanna wassalwa,
2429,Kuloo min tayyibati marazaqnakum wala tatghaw feehi fayahillaAAalaykum ghadabee waman yahlil AAalayhi ghadabeefaqad hawa,
2430,Wa-innee laghaffarun liman tabawaamana waAAamila salihan thumma ihtada,
2431,Wama aAAjalaka AAan qawmika yamoosa,
2432,Qala hum ola-i AAalaatharee waAAajiltu ilayka rabbi litarda,
2433,Qala fa-inna qad fatannaqawmaka min baAAdika waadallahumu assamiriy,
2434,FarajaAAa moosa ila qawmihighadbana asifan qala ya qawmi alamyaAAidkum rabbukum waAAdan hasanan afatalaAAalaykumu alAAahdu am aradtum an yahilla AAalaykum ghadabunmin rabbikum faakhlaftum mawAAidee,
2435,Qaloo ma akhlafnamawAAidaka bimalkina walakinna hummilnaawzaran min zeenati alqawmi faqathafnahafakathalika alqa assamiriy,
2436,Faakhraja lahum AAijlan jasadan lahu khuwarunfaqaloo hatha ilahukum wa-ilahu moosafanasiy,
2437,Afala yarawna alla yarjiAAuilayhim qawlan wala yamliku lahum darran walanafAAa,
2438,Walaqad qala lahum haroonu minqablu ya qawmi innama futintum bihi wa-innarabbakumu arrahmanu fattabiAAooneewaateeAAoo amree,
2439,Qaloo lan nabraha AAalayhi AAakifeenahatta yarjiAAa ilayna moosa,
2440,Qala ya haroonu mamanaAAaka ith raaytahum dalloo,
2441,Alla tattabiAAani afaAAasaytaamree,
2442,Qala yabnaomma la ta/khuthbilihyatee wala bira/see innee khasheetu an taqoolafarraqta bayna banee isra-eela walam tarqub qawlee,
2443,Qala fama khatbuka yasamiriy,
2444,Qala basurtu bima lamyabsuroo bihi faqabadtu qabdatan min athariarrasooli fanabathtuha wakathalikasawwalat lee nafsee,
2445,Qala fathhab fa-innalaka fee alhayati an taqoola la misasawa-inna laka mawAAidan lan tukhlafahu wanthurila ilahika allathee thaltaAAalayhi AAakifan lanuharriqannahu thummalanansifannahu fee alyammi nasfa,
2446,Innama ilahukumu Allahuallathee la ilaha illa huwa wasiAAakulla shay-in AAilma,
2447,Kathalika naqussu AAalayka minanba-i ma qad sabaqa waqad ataynakamin ladunna thikra,
2448,Man aAArada AAanhu fa-innahu yahmiluyawma alqiyamati wizra,
2449,Khalideena feehi wasaa lahumyawma alqiyamati himla,
2450,Yawma yunfakhu fee assooriwanahshuru almujrimeena yawma-ithin zurqa,
2451,Yatakhafatoona baynahum in labithtumilla AAashra,
2452,Nahnu aAAlamu bima yaqooloonaith yaqoolu amthaluhum tareeqatan in labithtum illayawma,
2453,Wayas-aloonaka AAani aljibali faqulyansifuha rabbee nasfa,
2454,Fayatharuha qaAAan safsafa,
2455,La tara feeha AAiwajanwala amta,
2456,Yawma-ithin yattabiAAoona addaAAiyala AAiwaja lahu wakhashaAAati al-aswatu lirrahmanifala tasmaAAu illa hamsa,
2457,Yawma-ithin la tanfaAAu ashshafaAAatuilla man athina lahu arrahmanuwaradiya lahu qawla,
2458,YaAAlamu ma bayna aydeehim wamakhalfahum wala yuheetoona bihi AAilma,
2459,WaAAanati alwujoohu lilhayyialqayyoomi waqad khaba man hamala thulma,
2460,Waman yaAAmal mina assalihatiwahuwa mu/minun fala yakhafu thulmanwala hadma,
2461,Wakathalika anzalnahu qur-ananAAarabiyyan wasarrafna feehi mina alwaAAeedilaAAallahum yattaqoona aw yuhdithu lahum thikra,
2462,FataAAala Allahualmaliku alhaqqu wala taAAjal bilqur-animin qabli an yuqda ilayka wahyuhu waqul rabbizidnee AAilma,
2463,Walaqad AAahidna ila adamamin qablu fanasiya walam najid lahu AAazma,
2464,Wa-ith qulna lilmala-ikatiosjudoo li-adama fasajadoo illa ibleesa aba,
2465,Faqulna ya adamu innahatha AAaduwwun laka walizawjika falayukhrijannakuma mina aljannati fatashqa,
2466,Inna laka alla tajooAAa feehawala taAAra,
2467,Waannaka la tathmaofeeha wala tadha,
2468,Fawaswasa ilayhi ashshaytanuqala ya adamu hal adulluka AAalashajarati alkhuldi wamulkin la yabla,
2469,Faakala minha fabadat lahumasaw-atuhuma watafiqa yakhsifaniAAalayhima min waraqi aljannati waAAasa adamurabbahu faghawa,
2470,Thumma ijtabahu rabbuhu fatabaAAalayhi wahada,
2471,Qala ihbita minhajameeAAan baAAdukum libaAAdin AAaduwwun fa-immaya/tiyannakum minnee hudan famani ittabaAAa hudaya falayadillu wala yashqa,
2472,Waman aAArada AAan thikreefa-inna lahu maAAeeshatan danka wanahshuruhuyawma alqiyamati aAAma,
2473,Qala rabbi lima hashartaneeaAAma waqad kuntu baseera,
2474,Qala kathalika atatka ayatunafanaseetaha wakathalika alyawma tunsa,
2475,Wakathalika najzee man asrafa walamyu/min bi-ayati rabbihi walaAAathabu al-akhiratiashaddu waabqa,
2476,Afalam yahdi lahum kam ahlaknaqablahum mina alqurooni yamshoona fee masakinihim inna feethalika laayatin li-olee annuha,
2477,Walawla kalimatun sabaqat minrabbika lakana lizaman waajalun musamma,
2478,Fasbir AAala mayaqooloona wasabbih bihamdi rabbika qabla tulooAAiashshamsi waqabla ghuroobiha wamin ana-iallayli fasabbih waatrafa annaharilaAAallaka tarda,
2479,Wala tamuddanna AAaynayka ilama mattaAAna bihi azwajan minhum zahrata alhayatiaddunya linaftinahum feehi warizqu rabbika khayrunwaabqa,
2480,Wa/mur ahlaka bissalatiwastabir AAalayha la nas-alukarizqan nahnu narzuquka walAAaqibatu littaqwa,
2481,Waqaloo lawla ya/teenabi-ayatin min rabbihi awa lam ta/tihim bayyinatu mafee assuhufi al-oola,
2482,Walaw anna ahlaknahum biAAathabinmin qablihi laqaloo rabbana lawla arsaltailayna rasoolan fanattabiAAa ayatika minqabli an nathilla wanakhza,
2483,Qul kullun mutarabbisun fatarabbasoofasataAAlamoona man as-habu assiratiassawiyyi wamani ihtada,
2484,Iqtaraba linnasi hisabuhumwahum fee ghaflatin muAAridoon,
2485,Ma ya/teehim min thikrin minrabbihim muhdathin illa istamaAAoohu wahumyalAAaboon,
2486,Lahiyatan quloobuhum waasarroo annajwaallatheena thalamoo hal hatha illabasharun mithlukum afata/toona assihra waantum tubsiroon,
2487,Qala rabbee yaAAlamu alqawla fee assama-iwal-ardi wahuwa assameeAAu alAAaleem,
2488,Bal qaloo adghathu ahlaminbali iftarahu bal huwa shaAAirun falya/tinabi-ayatin kama orsila al-awwaloon,
2489,Ma amanat qablahum min qaryatinahlaknaha afahum yu/minoon,
2490,Wama arsalna qablaka illarijalan noohee ilayhim fas-aloo ahla aththikriin kuntum la taAAlamoon,
2491,Wama jaAAalnahum jasadan laya/kuloona attaAAama wama kanookhalideen,
2492,Thumma sadaqnahumu alwaAAdafaanjaynahum waman nashao waahlaknaalmusrifeen,
2493,Laqad anzalna ilaykum kitabanfeehi thikrukum afala taAAqiloon,
2494,Wakam qasamna min qaryatin kanatthalimatan waansha/na baAAdahaqawman akhareen,
2495,Falamma ahassoo ba/sanaitha hum minha yarkudoon,
2496,La tarkudoo warjiAAooila ma otriftum feehi wamasakinikumlaAAallakum tus-aloon,
2497,Qaloo ya waylana innakunna thalimeen,
2498,Fama zalat tilka daAAwahumhatta jaAAalnahum haseedan khamideen,
2499,Wama khalaqna assamaawal-arda wama baynahuma laAAibeen,
2500,Law aradna an nattakhithalahwan lattakhathnahu min ladunna inkunna faAAileen,
2501,Bal naqthifu bilhaqqiAAala albatili fayadmaghuhu fa-itha huwa zahiqunwalakumu alwaylu mimma tasifoon,
2502,Walahu man fee assamawatiwal-ardi waman AAindahu la yastakbiroonaAAan AAibadatihi wala yastahsiroon,
