id,text,foot_notes
3783,Wadaraba lana mathalanwanasiya khalqahu qala man yuhyee alAAithamawahiya rameem,
3784,Qul yuhyeeha allatheeanshaaha awwala marratin wahuwa bikulli khalqin AAaleem,
3785,Allathee jaAAala lakum mina ashshajarial-akhdari naran fa-itha antum minhutooqidoon,
3786,Awa laysa allathee khalaqa assamawatiwal-arda biqadirin AAala an yakhluqamithlahum bala wahuwa alkhallaqu alAAaleem,
3787,Innama amruhu itha aradashay-an an yaqoola lahu kun fayakoon,
3788,Fasubhana allathee biyadihimalakootu kulli shay-in wa-ilayhi turjaAAoon,
3789,Wassaffati saffa,
3790,Fazzajirati zajra,
3791,Fattaliyati thikra,
3792,Inna ilahakum lawahid,
3793,Rabbu assamawati wal-ardiwama baynahuma warabbu almashariq,
3794,Inna zayyanna assamaaaddunya bizeenatin alkawakib,
3795,Wahifthan min kulli shaytaninmarid,
3796,La yassammaAAoona ila almala-ial-aAAla wayuqthafoona min kulli janib,
3797,Duhooran walahum AAathabun wasib,
3798,Illa man khatifa alkhatfatafaatbaAAahu shihabun thaqib,
3799,Fastaftihim ahum ashaddu khalqan amman khalaqna inna khalaqnahum min teeninlazib,
3800,Bal AAajibta wayaskharoon,
3801,Wa-itha thukkiroo la yathkuroon,
3802,Wa-itha raaw ayatanyastaskhiroon,
3803,Waqaloo in hatha illasihrun mubeen,
3804,A-itha mitna wakunnaturaban waAAithaman a-innalamabAAoothoon,
3805,Awa abaona al-awwaloon,
3806,Qul naAAam waantum dakhiroon,
3807,Fa-innama hiya zajratun wahidatunfa-itha hum yanthuroon,
3808,Waqaloo ya waylana hathayawmu addeen,
3809,Hatha yawmu alfasli allatheekuntum bihi tukaththiboon,
3810,Ohshuroo allatheena thalamoowaazwajahum wama kanoo yaAAbudoon,
3811,Min dooni Allahi fahdoohum ilasirati aljaheem,
3812,Waqifoohum innahum masooloon,
3813,Ma lakum la tanasaroon,
3814,Bal humu alyawma mustaslimoon,
3815,Waaqbala baAAduhum AAala baAAdinyatasaaloon,
3816,Qaloo innakum kuntum ta/toonanaAAani alyameen,
3817,Qaloo bal lam takoonoo mu/mineen,
3818,Wama kana lanaAAalaykum min sultanin bal kuntum qawman tagheen,
3819,Fahaqqa AAalayna qawlu rabbinainna latha-iqoon,
3820,Faaghwaynakum inna kunnaghaween,
3821,Fa-innahum yawma-ithin fee alAAathabimushtarikoon,
3822,Inna kathalika nafAAalu bilmujrimeen,
3823,Innahum kanoo itha qeela lahumla ilaha illa Allahu yastakbiroon,
3824,Wayaqooloona a-inna latarikoo alihatinalishaAAirin majnoon,
3825,Bal jaa bilhaqqi wasaddaqaalmursaleen,
3826,Innakum latha-iqoo alAAathabial-aleem,
3827,Wama tujzawna illa makuntum taAAmaloon,
3828,Illa AAibada Allahialmukhlaseen,
3829,Ola-ika lahum rizqun maAAloom,
3830,Fawakihu wahum mukramoon,
3831,Fee jannati annaAAeem,
3832,AAala sururin mutaqabileen,
3833,Yutafu AAalayhim bika/sin min maAAeen,
3834,Baydaa laththatin lishsharibeen,
3835,La feeha ghawlun walahum AAanha yunzafoon,
3836,WaAAindahum qasiratu attarfiAAeen,
3837,Kaannahunna baydun maknoon,
3838,Faaqbala baAAduhum AAala baAAdinyatasaaloon,
3839,Qala qa-ilun minhum innee kanalee qareen,
3840,Yaqoolu a-innaka lamina almusaddiqeen,
3841,A-itha mitna wakunnaturaban waAAithaman a-innalamadeenoon,
3842,Qala hal antum muttaliAAoon,
3843,FattalaAAa faraahu feesawa-i aljaheem,
3844,Qala tallahi in kidtalaturdeen,
3845,Walawla niAAmatu rabbee lakuntu minaalmuhdareen,
3846,Afama nahnu bimayyiteen,
3847,Illa mawtatana al-oolawama nahnu bimuAAaththabeen,
3848,Inna hatha lahuwa alfawzu alAAatheem,
3849,Limithli hatha falyaAAmali alAAamiloon,
3850,Athalika khayrun nuzulan am shajaratuazzaqqoom,
3851,Inna jaAAalnahafitnatan liththalimeen,
3852,Innaha shajaratun takhruju fee aslialjaheem,
3853,TalAAuha kaannahu ruoosu ashshayateen,
3854,Fa-innahum laakiloona minhafamali-oona minha albutoon,
3855,Thumma inna lahum AAalayha lashawbanmin hameem,
3856,Thumma inna marjiAAahum la-ila aljaheem,
3857,Innahum alfaw abaahum dalleen,
3858,Fahum AAala atharihimyuhraAAoon,
3859,Walaqad dalla qablahum aktharual-awwaleen,
3860,Walaqad arsalna feehim munthireen,
3861,Fanthur kayfa kanaAAaqibatu almunthareen,
3862,Illa AAibada Allahialmukhlaseen,
3863,Walaqad nadana noohunfalaniAAma almujeeboon,
3864,Wanajjaynahu waahlahu mina alkarbialAAatheem,
3865,WajaAAalna thurriyyatahu humualbaqeen,
3866,Watarakna AAalayhi fee al-akhireen,
3867,Salamun AAala noohinfee alAAalameen,
3868,Inna kathalika najzee almuhsineen,
3869,Innahu min AAibadinaalmu/mineen,
3870,Thumma aghraqna al-akhareen,
3871,Wa-inna min sheeAAatihi la-ibraheem,
3872,Ith jaa rabbahu biqalbinsaleem,
3873,Ith qala li-abeehi waqawmihi mathataAAbudoon,
3874,A-ifkan alihatan doona Allahitureedoon,
3875,Fama thannukum birabbialAAalameen,
3876,Fanathara nathratanfee annujoom,
3877,Faqala innee saqeem,
3878,Fatawallaw AAanhu mudbireen,
3879,Faragha ila alihatihimfaqala ala ta/kuloon,
3880,Ma lakum la tantiqoon,
3881,Faragha AAalayhim darban bilyameen,
3882,Faaqbaloo ilayhi yaziffoon,
3883,Qala ataAAbudoona ma tanhitoon,
3884,Wallahu khalaqakum wamataAAmaloon,
3885,Qaloo ibnoo lahu bunyananfaalqoohu fee aljaheem,
3886,Faaradoo bihi kaydan fajaAAalnahumual-asfaleen,
3887,Waqala innee thahibun ilarabbee sayahdeen,
3888,Rabbi hablee mina assaliheen,
3889,Fabashsharnahu bighulamin haleem,
3890,Falamma balagha maAAahu assaAAyaqala ya bunayya innee ara fee almanamiannee athbahuka fanthur mathatara qala ya abati ifAAal ma tu/marusatajidunee in shaa Allahu mina assabireen,
3891,Falamma aslama watallahuliljabeen,
3892,Wanadaynahu an ya ibraheem,
3893,Qad saddaqta arru/yainna kathalika najzee almuhsineen,
3894,Inna hatha lahuwa albalaoalmubeen,
3895,Wafadaynahu bithibhinAAatheem,
3896,Watarakna AAalayhi fee al-akhireen,
3897,Salamun AAala ibraheem,
3898,Kathalika najzee almuhsineen,
3899,Innahu min AAibadinaalmu/mineen,
3900,Wabashsharnahu bi-ishaqanabiyyan mina assaliheen,
3901,Wabarakna AAalayhi waAAalaishaqa wamin thurriyyatihima muhsinunwathalimun linafsihi mubeen,
3902,Walaqad mananna AAala moosawaharoon,
3903,Wanajjaynahuma waqawmahumamina alkarbi alAAatheem,
3904,Wanasarnahum fakanoohumu alghalibeen,
3905,Waataynahuma alkitabaalmustabeen,
3906,Wahadaynahuma assirataalmustaqeem,
3907,Watarakna AAalayhima fee al-akhireen,
3908,Salamun AAala moosawaharoon,
3909,Inna kathalika najzee almuhsineen,
3910,Innahuma min AAibadinaalmu/mineen,
3911,Wa-inna ilyasa lamina almursaleen,
3912,Ith qala liqawmihi alatattaqoon,
3913,AtadAAoona baAAlan watatharoona ahsanaalkhaliqeen,
3914,Allaha rabbakum warabba aba-ikumual-awwaleen,
3915,Fakaththaboohu fa-innahum lamuhdaroon,
3916,Illa AAibada Allahialmukhlaseen,
3917,Watarakna AAalayhi fee al-akhireen,
3918,Salamun AAala il yaseen,
3919,Inna kathalika najzee almuhsineen,
3920,Innahu min AAibadinaalmu/mineen,
3921,Wa-inna lootan lamina almursaleen,
3922,Ith najjaynahu waahlahuajmaAAeen,
3923,Illa AAajoozan fee alghabireen,
3924,Thumma dammarna al-akhareen,
3925,Wa-innakum latamurroona AAalayhim musbiheen,
3926,Wabillayli afala taAAqiloon,
3927,Wa-inna yoonusa lamina almursaleen,
3928,Ith abaqa ila alfulki almashhoon,
3929,Fasahama fakana mina almudhadeen,
3930,Faltaqamahu alhootu wahuwamuleem,
3931,Falawla annahu kana minaalmusabbiheen,
3932,Lalabitha fee batnihi ilayawmi yubAAathoon,
3933,Fanabathnahu bilAAara-iwahuwa saqeem,
3934,Waanbatna AAalayhi shajaratan minyaqteen,
3935,Waarsalnahu ila mi-ati alfinaw yazeedoon,
3936,Faamanoo famattaAAnahum ilaheen,
3937,Fastaftihim alirabbika albanatuwalahumu albanoon,
3938,Am khalaqna almala-ikata inathanwahum shahidoon,
3939,Ala innahum min ifkihim layaqooloon,
3940,Walada Allahu wa-innahum lakathiboon,
3941,Astafa albanati AAalaalbaneen,
3942,Ma lakum kayfa tahkumoon,
3943,Afala tathakkaroon,
3944,Am lakum sultanun mubeen,
3945,Fa/too bikitabikum in kuntum sadiqeen,
3946,WajaAAaloo baynahu wabayna aljinnatinasaban walaqad AAalimati aljinnatu innahum lamuhdaroon,
3947,Subhana Allahi AAammayasifoon,
3948,Illa AAibada Allahialmukhlaseen,
3949,Fa-innakum wama taAAbudoon,
3950,Ma antum AAalayhi bifatineen,
3951,Illa man huwa sali aljaheem,
3952,Wama minna illa lahumaqamun maAAloom,
3953,Wa-inna lanahnu assaffoon,
3954,Wa-inna lanahnu almusabbihoon,
3955,Wa-in kanoo layaqooloon,
3956,Law anna AAindana thikranmina al-awwaleen,
3957,Lakunna AAibada Allahialmukhlaseen,
3958,Fakafaroo bihi fasawfa yaAAlamoon,
3959,Walaqad sabaqat kalimatuna liAAibadinaalmursaleen,
3960,Innahum lahumu almansooroon,
3961,Wa-inna jundana lahumu alghaliboon,
3962,Fatawalla AAanhum hatta heen,
3963,Waabsirhum fasawfa yubsiroon,
3964,AfabiAAathabina yastaAAjiloon,
3965,Fa-itha nazala bisahatihimfasaa sabahu almunthareen,
3966,Watawalla AAanhum hatta heen,
3967,Waabsir fasawfa yubsiroon,
3968,Subhana rabbika rabbi alAAizzatiAAamma yasifoon,
3969,Wasalamun AAala almursaleen,
3970,Walhamdu lillahirabbi alAAalameen,
3971,Sad walqur-ani theeaththikr,
3972,Bali allatheena kafaroo fee AAizzatinwashiqaq,
3973,Kam ahlakna min qablihim min qarninfanadaw walata heena manas,
3974,WaAAajiboo an jaahum munthirunminhum waqala alkafiroona hatha sahirunkaththab,
3975,AjaAAala al-alihata ilahan wahidaninna hatha lashay-on AAujab,
3976,Wantalaqa almalao minhum aniimshoo wasbiroo AAala alihatikuminna hatha lashay-on yurad,
3977,Ma samiAAna bihatha feealmillati al-akhirati in hatha illa ikhtilaq,
3978,Aonzila AAalayhi aththikru minbaynina bal hum fee shakkin min thikree bal lammayathooqoo AAathab,
3979,Am AAindahum khaza-inu rahmatirabbika alAAazeezi alwahhab,
3980,Am lahum mulku assamawatiwal-ardi wama baynahuma falyartaqoofee al-asbab,
3981,Jundun ma hunalika mahzoomunmina al-ahzab,
3982,Kaththabat qablahum qawmu noohinwaAAadun wafirAAawnu thoo al-awtad,
3983,Wathamoodu waqawmu lootin waas-habual-aykati ola-ika al-ahzab,
3984,In kullun illa kaththaba arrusulafahaqqa AAiqab,
3985,Wama yanthuru haola-iilla sayhatan wahidatan ma lahamin fawaq,
3986,Waqaloo rabbana AAajjil lanaqittana qabla yawmi alhisab,
3987,Isbir AAala mayaqooloona wathkur AAabdana dawooda thaal-aydi innahu awwab,
3988,Inna sakhkharna aljibalamaAAahu yusabbihna bilAAashiyyi wal-ishraq,
3989,Wattayra mahshooratankullun lahu awwab,
3990,Washadadna mulkahu waataynahualhikmata wafasla alkhitab,
3991,Wahal ataka nabao alkhasmi ithtasawwaroo almihrab,
3992,Ith dakhaloo AAala dawoodafafaziAAa minhum qaloo la takhaf khasmanibagha baAAduna AAala baAAdinfahkum baynana bilhaqqi walatushtit wahdina ila sawa-iassirat,
3993,Inna hatha akhee lahu tisAAunwatisAAoona naAAjatan waliya naAAjatun wahidatun faqalaakfilneeha waAAazzanee fee alkhitab,
3994,Qala laqad thalamakabisu-ali naAAjatika ila niAAajihi wa-innakatheeran mina alkhulata-i layabghee baAAduhum AAalabaAAdin illa allatheena amanoowaAAamiloo assalihati waqaleelun mahum wathanna dawoodu annama fatannahufastaghfara rabbahu wakharra rakiAAan waanab,
3995,Faghafarna lahu thalikawa-inna lahu AAindana lazulfa wahusna maab,
3996,Ya dawoodu inna jaAAalnakakhaleefatan fee al-ardi fahkum bayna annasibilhaqqi wala tattabiAAi alhawa fayudillakaAAan sabeeli Allahi inna allatheena yadilloonaAAan sabeeli Allahi lahum AAathabun shadeedun bimanasoo yawma alhisab,
3997,Wama khalaqna assamaawal-arda wama baynahuma batilanthalika thannu allatheena kafaroofawaylun lillatheena kafaroo mina annar,
3998,Am najAAalu allatheena amanoowaAAamiloo assalihati kalmufsideenafee al-ardi am najAAalu almuttaqeena kalfujjar,
3999,Kitabun anzalnahu ilayka mubarakunliyaddabbaroo ayatihi waliyatathakkara olooal-albab,
4000,Wawahabna lidawooda sulaymananiAAma alAAabdu innahu awwab,
4001,Ith AAurida AAalayhi bilAAashiyyiassafinatu aljiyad,
4002,Faqala innee ahbabtu hubbaalkhayri AAan thikri rabbee hatta tawaratbilhijab,
4003,Ruddooha AAalayya fatafiqa mashanbissooqi wal-aAAnaq,
4004,Walaqad fatanna sulaymanawaalqayna AAala kursiyyihi jasadan thumma anab,
4005,Qala rabbi ighfir lee wahab leemulkan la yanbaghee li-ahadin min baAAdee innakaanta alwahhab,
4006,Fasakhkharna lahu arreehatajree bi-amrihi rukhaan haythu asab,
4007,Washshayateena kulla banna-inwaghawwas,
4008,Waakhareena muqarraneena fee al-asfad,
4009,Hatha AAataona famnunaw amsik bighayri hisab,
4010,Wa-inna lahu AAindana lazulfawahusna maab,
4011,Wathkur AAabdanaayyooba ith nada rabbahu annee massaniya ashshaytanubinusbin waAAathab,
4012,Orkud birijlika hathamughtasalun baridun washarab,
4013,Wawahabna lahu ahlahu wamithlahummaAAahum rahmatan minna wathikrali-olee al-albab,
4014,Wakhuth biyadika dighthan fadribbihi wala tahnath inna wajadnahu sabiranniAAma alAAabdu innahu awwab,
4015,Wathkur AAibadanaibraheema wa-ishaqa wayaAAqooba olee al-aydee wal-absar,
4016,Inna akhlasnahum bikhalisatinthikra addar,
4017,Wa-innahum AAindana lamina almustafaynaal-akhyar,
4018,Wathkur ismaAAeelawa-ilyasaAAa watha alkifli wakullun mina al-akhyar,
4019,Hatha thikrun wa-innalilmuttaqeena lahusna maab,
4020,Jannati AAadnin mufattahatanlahumu al-abwab,
4021,Muttaki-eena feeha yadAAoona feehabifakihatin katheeratin washarab,
4022,WaAAindahum qasiratu attarfiatrab,
4023,Hatha ma tooAAadoona liyawmialhisab,
4024,Inna hatha larizquna malahu min nafad,
4025,Hatha wa-inna littagheenalasharra maab,
4026,Jahannama yaslawnaha fabi/saalmihad,
4027,Hatha falyathooqoohu hameemunwaghassaq,
4028,Waakharu min shaklihi azwaj,
4029,Hatha fawjun muqtahimunmaAAakum la marhaban bihim innahum saloo annar,
4030,Qaloo bal antum la marhabanbikum antum qaddamtumoohu lana fabi/sa alqarar,
4031,Qaloo rabbana man qaddama lanahatha fazidhu AAathaban diAAfan fee annar,
4032,Waqaloo ma lana lanara rijalan kunna naAAudduhum mina al-ashrar,
4033,Attakhathnahum sikhriyyan am zaghatAAanhumu al-absar,
4034,Inna thalika lahaqqun takhasumuahli annar,
4035,Qul innama ana munthirunwama min ilahin illa Allahu alwahidualqahhar,
4036,Rabbu assamawati wal-ardiwama baynahuma alAAazeezu alghaffar,
4037,Qul huwa nabaon AAatheem,
4038,Antum AAanhu muAAridoon,
4039,Ma kana liya min AAilmin bilmala-ial-aAAla ith yakhtasimoon,
4040,In yooha ilayya illa annamaana natheerun mubeen,
4041,Ith qala rabbuka lilmala-ikatiinnee khaliqun basharan min teen,
4042,Fa-itha sawwaytuhu wanafakhtu feehimin roohee faqaAAoo lahu sajideen,
4043,Fasajada almala-ikatu kulluhumajmaAAoon,
4044,Illa ibleesa istakbara wakanamina alkafireen,
4045,Qala ya ibleesu mamanaAAaka an tasjuda lima khalaqtu biyadayya astakbarta amkunta mina alAAaleen,
4046,Qala ana khayrun minhukhalaqtanee min narin wakhalaqtahu min teen,
4047,Qala fakhruj minhafa-innaka rajeem,
4048,Wa-inna AAalayka laAAnatee ila yawmiaddeen,
4049,Qala rabbi faanthirneeila yawmi yubAAathoon,
4050,Qala fa-innaka mina almunthareen,
4051,Ila yawmi alwaqti almaAAloom,
4052,Qala fabiAAizzatika laoghwiyannahumajmaAAeen,
4053,Illa AAibadaka minhumualmukhlaseen,
4054,Qala falhaqqu walhaqqaaqool,
4055,Laamlaanna jahannama minka wamimmantabiAAaka minhum ajmaAAeen,
4056,Qul ma as-alukum AAalayhi min ajrinwama ana mina almutakallifeen,
4057,In huwa illa thikrun lilAAalameen,
4058,WalataAAlamunna nabaahu baAAda heen,
4059,Tanzeelu alkitabi mina AllahialAAazeezi alhakeem,
4060,Inna anzalna ilayka alkitababilhaqqi faAAbudi Allaha mukhlisanlahu addeen,
4061,Ala lillahi addeenualkhalisu wallatheena ittakhathoomin doonihi awliyaa ma naAAbuduhum illaliyuqarriboona ila Allahi zulfa innaAllaha yahkumu baynahum fee ma hum feehiyakhtalifoona inna Allaha la yahdee man huwa kathibunkaffar,
4062,Law arada Allahu an yattakhithawaladan lastafa mimma yakhluqu mayashao subhanahu huwa Allahu alwahidualqahhar,
4063,Khalaqa assamawati wal-ardabilhaqqi yukawwiru allayla AAala annahariwayukawwiru annahara AAala allayliwasakhkhara ashshamsa walqamara kullun yajreeli-ajalin musamman ala huwa alAAazeezu alghaffar,
4064,Khalaqakum min nafsin wahidatin thummajaAAala minha zawjaha waanzala lakum mina al-anAAamithamaniyata azwajin yakhluqukum fee butooniommahatikum khalqan min baAAdi khalqin fee thulumatinthalathin thalikumu Allahu rabbukum lahualmulku la ilaha illa huwa faanna tusrafoon,
4065,In takfuroo fa-inna Allaha ghaniyyunAAankum wala yarda liAAibadihi alkufra wa-intashkuroo yardahu lakum wala taziru waziratunwizra okhra thumma ila rabbikum marjiAAukumfayunabbi-okum bima kuntum taAAmaloona innahu AAaleemun bithatiassudoor,
4066,Wa-itha massa al-insana durrundaAAa rabbahu muneeban ilayhi thumma ithakhawwalahu niAAmatan minhu nasiya ma kana yadAAooilayhi min qablu wajaAAala lillahi andadan liyudillaAAan sabeelihi qul tamattaAA bikufrika qaleelan innaka min as-habiannar,
4067,Amman huwa qanitun anaaallayli sajidan waqa-iman yahtharu al-akhiratawayarjoo rahmata rabbihi qul hal yastawee allatheenayaAAlamoona wallatheena la yaAAlamoonainnama yatathakkaru oloo al-albab,
4068,Qul ya AAibadi allatheenaamanoo ittaqoo rabbakum lillatheena ahsanoofee hathihi addunya hasanatun waarduAllahi wasiAAatun innama yuwaffa assabiroonaajrahum bighayri hisab,
4069,Qul innee omirtu an aAAbuda Allahamukhlisan lahu addeen,
4070,Waomirtu li-an akoona awwala almuslimeen,
4071,Qul innee akhafu in AAasayturabbee AAathaba yawmin AAatheem,
4072,Quli Allaha aAAbudu mukhlisanlahu deenee,
4073,FaAAbudoo ma shi/tum mindoonihi qul inna alkhasireena allatheena khasirooanfusahum waahleehim yawma alqiyamati ala thalikahuwa alkhusranu almubeen,
4074,Lahum min fawqihim thulalunmina annari wamin tahtihim thulalunthalika yukhawwifu Allahu bihi AAibadahu yaAAibadi fattaqoon,
4075,Wallatheena ijtanaboo attaghootaan yaAAbudooha waanaboo ila Allahilahumu albushra fabashshir AAibad,
4076,Allatheena yastamiAAoona alqawlafayattabiAAoona ahsanahu ola-ika allatheenahadahumu Allahu waola-ika hum oloo al-albab,
4077,Afaman haqqa AAalayhi kalimatu alAAathabiafaanta tunqithu man fee annar,
4078,Lakini allatheena ittaqawrabbahum lahum ghurafun min fawqiha ghurafun mabniyyatuntajree min tahtiha al-anharu waAAda Allahila yukhlifu Allahu almeeAAad,
4079,Alam tara anna Allaha anzala mina assama-imaan fasalakahu yanabeeAAa fee al-ardithumma yukhriju bihi zarAAan mukhtalifan alwanuhu thummayaheeju fatarahu musfarran thumma yajAAaluhu hutamaninna fee thalika lathikra li-olee al-albab,
4080,Afaman sharaha Allahu sadrahulil-islami fahuwa AAala noorin min rabbihi fawaylunlilqasiyati quloobuhum min thikri Allahi ola-ikafee dalalin mubeen,
4081,Allahu nazzala ahsana alhadeethikitaban mutashabihan mathaniya taqshaAAirruminhu juloodu allatheena yakhshawna rabbahum thummataleenu julooduhum waquloobuhum ila thikri Allahithalika huda Allahi yahdee bihi man yashaowaman yudlili Allahu fama lahu min had,
4082,Afaman yattaqee biwajhihi soo-a alAAathabiyawma alqiyamati waqeela liththalimeenathooqoo ma kuntum taksiboon,
4083,Kaththaba allatheena minqablihim faatahumu alAAathabu min haythu layashAAuroon,
4084,Faathaqahumu Allahu alkhizyafee alhayati addunya walaAAathabual-akhirati akbaru law kanoo yaAAlamoon,
4085,Walaqad darabna linnasifee hatha alqur-ani min kulli mathalin laAAallahumyatathakkaroon,
4086,Qur-anan AAarabiyyan ghayra theeAAiwajin laAAallahum yattaqoon,
4087,Daraba Allahu mathalan rajulanfeehi shurakao mutashakisoona warajulan salamanlirajulin hal yastawiyani mathalan alhamdu lillahibal aktharuhum la yaAAlamoon,
4088,Innaka mayyitun wa-innahum mayyitoon,
4089,Thumma innakum yawma alqiyamatiAAinda rabbikum takhtasimoon,
4090,Faman athlamu mimman kathabaAAala Allahi wakaththaba bissidqiith jaahu alaysa fee jahannama mathwan lilkafireen,
4091,Wallathee jaa bissidqiwasaddaqa bihi ola-ika humu almuttaqoon,
4092,Lahum ma yashaoona AAindarabbihim thalika jazao almuhsineen,
4093,Liyukaffira Allahu AAanhum aswaa allatheeAAamiloo wayajziyahum ajrahum bi-ahsani allathee kanooyaAAmaloon,
4094,Alaysa Allahu bikafin AAabdahuwayukhawwifoonaka billatheena min doonihi waman yudliliAllahu fama lahu min had,
4095,Waman yahdi Allahu fama lahumin mudillin alaysa Allahu biAAazeezin theeintiqam,
4096,Wala-in saaltahum man khalaqa assamawatiwal-arda layaqoolunna Allahu qul afaraaytumma tadAAoona min dooni Allahi in aradaniyaAllahu bidurrin hal hunna kashifatu durrihiaw aradanee birahmatin hal hunna mumsikaturahmatihi qul hasbiya Allahu AAalayhiyatawakkalu almutawakkiloon,
4097,Qul ya qawmi iAAmaloo AAalamakanatikum innee AAamilun fasawfa taAAlamoon,
4098,Man ya/teehi AAathabun yukhzeehi wayahilluAAalayhi AAathabun muqeem,
4099,Inna anzalna AAalayka alkitabalinnasi bilhaqqi famani ihtadafalinafsihi waman dalla fa-innama yadilluAAalayha wama anta AAalayhim biwakeel,
4100,Allahu yatawaffa al-anfusa heenamawtiha wallatee lam tamut fee manamihafayumsiku allatee qada AAalayha almawta wayursilual-okhra ila ajalin musamman inna fee thalikalaayatin liqawmin yatafakkaroon,
4101,Ami ittakhathoo min dooni AllahishufaAAaa qul awa law kanoo la yamlikoonashay-an wala yaAAqiloon,
4102,Qul lillahi ashshafaAAatujameeAAan lahu mulku assamawati wal-ardithumma ilayhi turjaAAoon,
4103,Wa-itha thukira Allahuwahdahu ishmaazzat quloobu allatheena layu/minoona bil-akhirati wa-itha thukiraallatheena min doonihi itha hum yastabshiroon,
4104,Quli allahumma fatira assamawatiwal-ardi AAalima alghaybi washshahadatianta tahkumu bayna AAibadika fee ma kanoofeehi yakhtalifoon,
4105,Walaw anna lillatheena thalamooma fee al-ardi jameeAAan wamithlahu maAAahu laftadawbihi min soo-i alAAathabi yawma alqiyamati wabadalahum mina Allahi ma lam yakoonoo yahtasiboon,
4106,Wabada lahum sayyi-atu makasaboo wahaqa bihim ma kanoo bihiyastahzi-oon,
4107,Fa-itha massa al-insana durrundaAAana thumma itha khawwalnahuniAAmatan minna qala innama ooteetuhu AAalaAAilmin bal hiya fitnatun walakinna aktharahum layaAAlamoon,
4108,Qad qalaha allatheenamin qablihim fama aghna AAanhum ma kanooyaksiboon,
4109,Faasabahum sayyi-atu makasaboo wallatheena thalamoo min haola-isayuseebuhum sayyi-atu ma kasaboo wamahum bimuAAjizeen,
4110,Awa lam yaAAlamoo anna Allaha yabsutuarrizqa liman yashao wayaqdiru inna fee thalikalaayatin liqawmin yu/minoon,
4111,Qul ya AAibadiya allatheenaasrafoo AAala anfusihim la taqnatoo min rahmatiAllahi inna Allaha yaghfiru aththunoobajameeAAan innahu huwa alghafooru arraheem,
4112,Waaneeboo ila rabbikum waaslimoo lahumin qabli an ya/tiyakumu alAAathabu thumma la tunsaroon,
4113,WattabiAAoo ahsana maonzila ilaykum min rabbikum min qabli an ya/tiyakumu alAAathabubaghtatan waantum la tashAAuroon,
4114,An taqoola nafsun ya hasrataAAala ma farrattu fee janbi Allahiwa-in kuntu lamina assakhireen,
4115,Aw taqoola law anna Allaha hadaneelakuntu mina almuttaqeen,
4116,Aw taqoola heena tara alAAathabalaw anna lee karratan faakoona mina almuhsineen,
4117,Bala qad jaatka ayateefakaththabta biha wastakbarta wakunta minaalkafireen,
4118,Wayawma alqiyamati tara allatheenakathaboo AAala Allahi wujoohuhum muswaddatunalaysa fee jahannama mathwan lilmutakabbireen,
4119,Wayunajjee Allahu allatheenaittaqaw bimafazatihim la yamassuhumu assoo-owala hum yahzanoon,
4120,Allahu khaliqu kulli shay-inwahuwa AAala kulli shay-in wakeel,
4121,Lahu maqaleedu assamawatiwal-ardi wallatheena kafaroo bi-ayatiAllahi ola-ika humu alkhasiroon,
4122,Qul afaghayra Allahi ta/muroonneeaAAbudu ayyuha aljahiloon,
4123,Walaqad oohiya ilayka wa-ilaallatheena min qablika la-in ashrakta layahbatannaAAamaluka walatakoonanna mina alkhasireen,
4124,Bali Allaha faAAbud wakunmina ashshakireen,
4125,Wama qadaroo Allaha haqqaqadrihi wal-ardu jameeAAan qabdatuhu yawmaalqiyamati wassamawatu matwiyyatunbiyameenihi subhanahu wataAAala AAammayushrikoon,
4126,Wanufikha fee assoori fasaAAiqaman fee assamawati waman fee al-ardiilla man shaa Allahu thumma nufikha feehiokhra fa-itha hum qiyamun yanthuroon,
4127,Waashraqati al-ardu binoori rabbihawawudiAAa alkitabu wajee-a binnabiyyeenawashshuhada-i waqudiya baynahum bilhaqqiwahum la yuthlamoon,
4128,Wawuffiyat kullu nafsin ma AAamilatwahuwa aAAlamu bima yafAAaloon,
4129,Waseeqa allatheena kafaroo ilajahannama zumaran hatta itha jaoohafutihat abwabuha waqala lahumkhazanatuha alam ya/tikum rusulun minkum yatloonaAAalaykum ayati rabbikum wayunthiroonakumliqaa yawmikum hatha qaloo bala walakinhaqqat kalimatu alAAathabi AAala alkafireen,
4130,Qeela odkhuloo abwaba jahannama khalideenafeeha fabi/sa mathwa almutakabbireen,
4131,Waseeqa allatheena ittaqaw rabbahumila aljannati zumaran hatta itha jaoohawafutihat abwabuha waqala lahumkhazanatuha salamun AAalaykum tibtum fadkhuloohakhalideen,
4132,Waqaloo alhamdu lillahiallathee sadaqana waAAdahu waawrathanaal-arda natabawwao mina aljannati haythu nashaofaniAAma ajru alAAamileen,
4133,Watara almala-ikata haffeenamin hawli alAAarshi yusabbihoona bihamdirabbihim waqudiya baynahum bilhaqqi waqeelaalhamdu lillahi rabbi alAAalameen,
4134,Ha-meem,
4135,Tanzeelu alkitabi mina AllahialAAazeezi alAAaleem,
4136,Ghafiri aththanbi waqabiliattawbi shadeedi alAAiqabi thee attawlila ilaha illa huwa ilayhi almaseer,
4137,Ma yujadilu fee ayatiAllahi illa allatheena kafaroo falayaghrurka taqallubuhum fee albilad,
4138,Kaththabat qablahum qawmu noohinwal-ahzabu min baAAdihim wahammat kulluommatin birasoolihim liya/khuthoohu wajadaloo bilbatililiyudhidoo bihi alhaqqa faakhathtuhumfakayfa kana AAiqab,
4139,Wakathalika haqqat kalimaturabbika AAala allatheena kafaroo annahum as-habuannar,
4140,Allatheena yahmiloona alAAarshawaman hawlahu yusabbihoona bihamdi rabbihimwayu/minoona bihi wayastaghfiroona lillatheena amanoorabbana wasiAAta kulla shay-in rahmatan waAAilmanfaghfir lillatheena taboo wattabaAAoosabeelaka waqihim AAathaba aljaheem,
4141,Rabbana waadkhilhum jannatiAAadnin allatee waAAadtahum waman salaha min aba-ihimwaazwajihim wathurriyyatihim innaka antaalAAazeezu alhakeem,
4142,Waqihimu assayyi-ati wamantaqi assayyi-ati yawma-ithin faqad rahimtahuwathalika huwa alfawzu alAAatheem,
4143,Inna allatheena kafaroo yunadawnalamaqtu Allahi akbaru min maqtikum anfusakum ithtudAAawna ila al-eemani fatakfuroon,
4144,Qaloo rabbana amattanaithnatayni waahyaytana ithnatayni faAAtarafnabithunoobina fahal ila khuroojin min sabeel,
4145,Thalikum bi-annahu ithaduAAiya Allahu wahdahu kafartum wa-in yushrak bihitu/minoo falhukmu lillahi alAAaliyyialkabeer,
4146,Huwa allathee yureekum ayatihiwayunazzilu lakum mina assama-i rizqan wamayatathakkaru illa man yuneeb,
4147,FadAAoo Allaha mukhliseenalahu addeena walaw kariha alkafiroon,
4148,RafeeAAu addarajati thooalAAarshi yulqee arrooha min amrihi AAalaman yashao min AAibadihi liyunthira yawma attalaq,
4149,Yawma hum barizoona la yakhfaAAala Allahi minhum shay-on limani almulku alyawmalillahi alwahidi alqahhar,
