id,text,foot_notes
962,Walwaznu yawma-ithini alhaqqufaman thaqulat mawazeenuhu faola-ika humu almuflihoon,
963,Waman khaffat mawazeenuhu faola-ikaallatheena khasiroo anfusahum bima kanoo bi-ayatinayathlimoon,
964,Walaqad makkannakum fee al-ardiwajaAAalna lakum feeha maAAayisha qaleelan matashkuroon,
965,Walaqad khalaqnakum thumma sawwarnakumthumma qulna lilmala-ikati osjudoo li-adamafasajadoo illa ibleesa lam yakun mina assajideen,
966,Qala ma manaAAaka allatasjuda ith amartuka qala ana khayrun minhukhalaqtanee min narin wakhalaqtahu min teen,
967,Qala fahbit minhafama yakoonu laka an tatakabbara feeha fakhrujinnaka mina assaghireen,
968,Qala anthirnee ilayawmi yubAAathoon,
969,Qala innaka mina almunthareen,
970,Qala fabima aghwaytaneelaaqAAudanna lahum sirataka almustaqeem,
971,Thumma laatiyannahum min bayniaydeehim wamin khalfihim waAAan aymanihim waAAan shama-ilihimwala tajidu aktharahum shakireen,
972,Qala okhruj minha mathoomanmadhooran laman tabiAAaka minhum laamlaanna jahannamaminkum ajmaAAeen,
973,Waya adamu oskun antawazawjuka aljannata fakula min haythu shi/tumawala taqraba hathihi ashshajaratafatakoona mina aththalimeen,
974,Fawaswasa lahuma ashshaytanuliyubdiya lahuma ma wooriya AAanhuma minsaw-atihima waqala ma nahakumarabbukuma AAan hathihi ashshajarati illaan takoona malakayni aw takoona mina alkhalideen,
975,Waqasamahuma innee lakumalamina annasiheen,
976,Fadallahuma bighuroorin falammathaqa ashshajarata badat lahuma saw-atuhumawatafiqa yakhsifani AAalayhimamin waraqi aljannati wanadahuma rabbuhumaalam anhakuma AAan tilkuma ashshajaratiwaaqul lakuma inna ashshaytana lakumaAAaduwwun mubeen,
977,Qala rabbana thalamnaanfusana wa-in lam taghfir lana watarhamnalanakoonanna mina alkhasireen,
978,Qala ihbitoo baAAdukumlibaAAdin AAaduwwun walakum fee al-ardi mustaqarrunwamataAAun ila heen,
979,Qala feeha tahyawnawafeeha tamootoona waminha tukhrajoon,
980,Ya banee adama qad anzalnaAAalaykum libasan yuwaree saw-atikumwareeshan walibasu attaqwa thalikakhayrun thalika min ayati AllahilaAAallahum yaththakkaroon,
981,Ya banee adama layaftinannakumu ashshaytanu kama akhrajaabawaykum mina aljannati yanziAAu AAanhuma libasahumaliyuriyahuma saw-atihima innahu yarakumhuwa waqabeeluhu min haythu la tarawnahum innajaAAalna ashshayateena awliyaa lillatheenala yu/minoon,
982,Wa-itha faAAaloo fahishatan qaloowajadna AAalayha abaana wallahuamarana biha qul inna Allaha laya/muru bilfahsha-i ataqooloona AAalaAllahi ma la taAAlamoon,
983,Qul amara rabbee bilqistiwaaqeemoo wujoohakum AAinda kulli masjidin wadAAoohumukhliseena lahu addeena kama badaakumtaAAoodoon,
984,Fareeqan hada wafareeqan haqqaAAalayhimu addalalatu innahumu ittakhathooashshayateena awliyaa min dooni Allahiwayahsaboona annahum muhtadoon,
985,Ya banee adama khuthoozeenatakum AAinda kulli masjidin wakuloo washraboo walatusrifoo innahu la yuhibbu almusrifeen,
986,Qul man harrama zeenata Allahiallatee akhraja liAAibadihi wattayyibatimina arrizqi qul hiya lillatheena amanoofee alhayati addunya khalisatanyawma alqiyamati kathalika nufassilu al-ayatiliqawmin yaAAlamoon,
987,Qul innama harrama rabbiyaalfawahisha ma thahara minhawama batana wal-ithma walbaghyabighayri alhaqqi waan tushrikoo billahi malam yunazzil bihi sultanan waan taqooloo AAala Allahima la taAAlamoon,
988,Walikulli ommatin ajalun fa-itha jaaajaluhum la yasta/khiroona saAAatan walayastaqdimoon,
989,Ya banee adama immaya/tiyannakum rusulun minkum yaqussoona AAalaykum ayateefamani ittaqa waaslaha fala khawfunAAalayhim wala hum yahzanoon,
990,Wallatheena kaththaboobi-ayatina wastakbaroo AAanhaola-ika as-habu annari humfeeha khalidoon,
991,Faman athlamu mimmani iftaraAAala Allahi kathiban aw kaththababi-ayatihi ola-ika yanaluhum naseebuhummina alkitabi hatta itha jaat-humrusuluna yatawaffawnahum qaloo ayna makuntum tadAAoona min dooni Allahi qaloo dallooAAanna washahidoo AAala anfusihim annahum kanookafireen,
992,Qala odkhuloo fee omamin qad khalatmin qablikum mina aljinni wal-insi fee annarikullama dakhalat ommatun laAAanat okhtaha hattaitha iddarakoo feeha jameeAAan qalatokhrahum li-oolahum rabbana haola-iadalloona faatihim AAathaban diAAfanmina annari qala likullin diAAfunwalakin la taAAlamoon,
993,Waqalat oolahum li-okhrahumfama kana lakum AAalayna min fadlinfathooqoo alAAathaba bima kuntum taksiboon,
994,Inna allatheena kaththaboo bi-ayatinawastakbaroo AAanha la tufattahulahum abwabu assama-i walayadkhuloona aljannata hatta yalija aljamalu feesammi alkhiyati wakathalika najzee almujrimeen,
995,Lahum min jahannama mihadun waminfawqihim ghawashin wakathalika najzee aththalimeen,
996,Wallatheena amanoowaAAamiloo assalihati la nukallifunafsan illa wusAAaha ola-ika as-habualjannati hum feeha khalidoon,
997,WanazaAAna ma fee sudoorihimmin ghillin tajree min tahtihimu al-anharu waqalooalhamdu lillahi allathee hadanalihatha wama kunna linahtadiya lawlaan hadana Allahu laqad jaat rusulurabbina bilhaqqi wanoodoo an tilkumualjannatu oorithtumooha bima kuntum taAAmaloon,
998,Wanada as-habualjannati as-haba annari an qadwajadna ma waAAadana rabbuna haqqanfahal wajadtum ma waAAada rabbukum haqqan qaloonaAAam faaththana mu-aththinun baynahum an laAAnatuAllahi AAala aththalimeen,
999,Allatheena yasuddoona AAansabeeli Allahi wayabghoonaha AAiwajan wahum bil-akhiratikafiroon,
1000,Wabaynahuma hijabunwaAAala al-aAArafi rijalun yaAArifoonakullan biseemahum wanadaw as-habaaljannati an salamun AAalaykum lam yadkhuloohawahum yatmaAAoon,
1001,Wa-itha surifat absaruhumtilqaa as-habi annari qaloorabbana la tajAAalna maAAa alqawmi aththalimeen,
1002,Wanada as-habual-aAArafi rijalan yaAArifoonahum biseemahumqaloo ma aghna AAankum jamAAukum wamakuntum tastakbiroon,
1003,Ahaola-i allatheenaaqsamtum la yanaluhumu Allahu birahmatinodkhuloo aljannata la khawfun AAalaykum wala antumtahzanoon,
1004,Wanada as-habu anarias-haba aljannati an afeedoo AAalaynamina alma-i aw mimma razaqakumu Allahu qalooinna Allaha harramahuma AAala alkafireen,
1005,Allatheena ittakhathoodeenahum lahwan walaAAiban wagharrat-humu alhayatuaddunya falyawma nansahum kamanasoo liqaa yawmihim hatha wama kanoobi-ayatina yajhadoon,
1006,Walaqad ji/nahum bikitabin fassalnahuAAala AAilmin hudan warahmatan liqawmin yu/minoon,
1007,Hal yanthuroona illata/weelahu yawma ya/tee ta/weeluhu yaqoolu allatheenanasoohu min qablu qad jaat rusulu rabbina bilhaqqifahal lana min shufaAAaa fayashfaAAoo lanaaw nuraddu fanaAAmala ghayra allathee kunnanaAAmalu qad khasiroo anfusahum wadalla AAanhum makanoo yaftaroon,
1008,Inna rabbakumu Allahu allatheekhalaqa assamawati wal-ardafee sittati ayyamin thumma istawa AAalaalAAarshi yughshee allayla annahara yatlubuhuhatheethan washshamsa walqamara wannujoomamusakhkharatin bi-amrihi ala lahu alkhalqu wal-amrutabaraka Allahu rabbu alAAalameen,
1009,OdAAoo rabbakum tadarruAAanwakhufyatan innahu la yuhibbu almuAAtadeen,
1010,Wala tufsidoo fee al-ardibaAAda islahiha wadAAoohu khawfan watamaAAaninna rahmata Allahi qareebun mina almuhsineen,
1011,Wahuwa allathee yursilu arriyahabushran bayna yaday rahmatihi hatta ithaaqallat sahaban thiqalan suqnahu libaladinmayyitin faanzalna bihi almaa faakhrajnabihi min kulli aththamarati kathalikanukhriju almawta laAAallakum tathakkaroon,
1012,Walbaladu attayyibuyakhruju nabatuhu bi-ithni rabbihi wallatheekhabutha la yakhruju illa nakidan kathalikanusarrifu al-ayati liqawmin yashkuroon,
1013,Laqad arsalna noohan ilaqawmihi faqala ya qawmi oAAbudoo Allaha malakum min ilahin ghayruhu innee akhafu AAalaykumAAathaba yawmin AAatheem,
1014,Qala almalao min qawmihi innalanaraka fee dalalin mubeen,
1015,Qala ya qawmi laysa bee dalalatunwalakinnee rasoolun min rabbi alAAalameen,
1016,Oballighukum risalati rabbeewaansahu lakum waaAAlamu mina Allahi mala taAAlamoon,
1017,Awa AAajibtum an jaakum thikrunmin rabbikum AAala rajulin minkum liyunthirakumwalitattaqoo walaAAallakum turhamoon,
1018,Fakaththaboohu faanjaynahu wallatheenamaAAahu fee alfulki waaghraqna allatheena kaththaboobi-ayatina innahum kanoo qawmanAAameen,
1019,Wa-ila AAadin akhahumhoodan qala ya qawmi oAAbudoo Allaha malakum min ilahin ghayruhu afala tattaqoon,
1020,Qala almalao allatheenakafaroo min qawmihi inna lanaraka fee safahatinwa-inna lanathunnuka mina alkathibeen,
1021,Qala ya qawmi laysa bee safahatunwalakinnee rasoolun min rabbi alAAalameen,
1022,Oballighukum risalati rabbeewaana lakum nasihun ameen,
1023,Awa AAajibtum an jaakum thikrunmin rabbikum AAala rajulin minkum liyunthirakum wathkurooith jaAAalakum khulafaa min baAAdi qawmi noohinwazadakum fee alkhalqi bastatan fathkurooalaa Allahi laAAallakum tuflihoon,
1024,Qaloo aji/tana linaAAbuda Allahawahdahu wanathara ma kana yaAAbudu abaonafa/tina bima taAAiduna in kunta mina assadiqeen,
1025,Qala qad waqaAAa AAalaykum minrabbikum rijsun waghadabun atujadiloonanee fee asma-insammaytumooha antum waabaokum manazzala Allahu biha min sultanin fantathirooinnee maAAakum mina almuntathireen,
1026,Faanjaynahu wallatheenamaAAahu birahmatin minna waqataAAna dabiraallatheena kaththaboo bi-ayatinawama kanoo mu/mineen,
1027,Wa-ila thamooda akhahum salihanqala ya qawmi oAAbudoo Allaha malakum min ilahin ghayruhu qad jaatkum bayyinatunmin rabbikum hathihi naqatu Allahi lakum ayatanfatharooha ta/kul fee ardi Allahi walatamassooha bisoo-in faya/khuthakum AAathabunaleem,
1028,Wathkuroo ithjaAAalakum khulafaa min baAAdi AAadin wabawwaakumfee al-ardi tattakhithoona min suhooliha qusooranwatanhitoona aljibala buyootan fathkurooalaa Allahi wala taAAthaw fee al-ardimufsideen,
1029,Qala almalao allatheenaistakbaroo min qawmihi lillatheena istudAAifooliman amana minhum ataAAlamoona anna salihanmursalun min rabbihi qaloo inna bima orsilabihi mu/minoon,
1030,Qala allatheena istakbaroo innabillathee amantum bihi kafiroon,
1031,FaAAaqaroo annaqata waAAatawAAan amri rabbihim waqaloo ya salihui/tina bima taAAiduna in kunta minaalmursaleen,
1032,Faakhathat-humu arrajfatu faasbahoofee darihim jathimeen,
1033,Fatawalla AAanhum waqala yaqawmi laqad ablaghtukum risalata rabbee wanasahtulakum walakin la tuhibboona annasiheen,
1034,Walootan ith qalaliqawmihi ata/toona alfahishata ma sabaqakum bihamin ahadin mina alAAalameen,
1035,Innakum lata/toona arrijalashahwatan min dooni annisa-i bal antum qawmunmusrifoon,
1036,Wama kana jawabaqawmihi illa an qaloo akhrijoohum min qaryatikuminnahum onasun yatatahharoon,
1037,Faanjaynahu waahlahu illaimraatahu kanat mina alghabireen,
1038,Waamtarna AAalayhim mataranfanthur kayfa kana AAaqibatualmujrimeen,
1039,Wa-ila madyana akhahumshuAAayban qala ya qawmi oAAbudoo Allaha malakum min ilahin ghayruhu qad jaatkum bayyinatunmin rabbikum faawfoo alkayla walmeezana walatabkhasoo annasa ashyaahum walatufsidoo fee al-ardi baAAda islahiha thalikumkhayrun lakum in kuntum mu/mineen,
1040,Wala taqAAudoo bikulli siratintooAAidoona watasuddoona AAan sabeeli Allahi man amanabihi watabghoonaha AAiwajan wathkuroo ithkuntum qaleelan fakaththarakum wanthurookayfa kana AAaqibatu almufsideen,
1041,Wa-in kana ta-ifatun minkum amanoobillathee orsiltu bihi wata-ifatun lamyu/minoo fasbiroo hatta yahkumaAllahu baynana wahuwa khayru alhakimeen,
1042,Qala almalao allatheenaistakbaroo min qawmihi lanukhrijannaka ya shuAAaybu wallatheenaamanoo maAAaka min qaryatina aw lataAAoodunna feemillatina qala awa law kunna kariheen,
1043,Qadi iftarayna AAala Allahikathiban in AAudna fee millatikum baAAda ithnajjana Allahu minha wamayakoonu lana an naAAooda feeha illa an yashaaAllahu rabbuna wasiAAa rabbuna kulla shay-inAAilman AAala Allahi tawakkalna rabbanaiftah baynana wabayna qawmina bilhaqqiwaanta khayru alfatiheen,
1044,Waqala almalao allatheenakafaroo min qawmihi la-ini ittabaAAtum shuAAayban innakum ithanlakhasiroon,
1045,Faakhathat-humu arrajfatu faasbahoofee darihim jathimeen,
1046,Allatheena kaththabooshuAAayban kaan lam yaghnaw feeha allatheena kaththabooshuAAayban kanoo humu alkhasireen,
1047,Fatawalla AAanhum waqala yaqawmi laqad ablaghtukum risalati rabbee wanasahtulakum fakayfa asa AAala qawmin kafireen,
1048,Wama arsalna fee qaryatin minnabiyyin illa akhathna ahlaha bilba/sa-iwaddarra-i laAAallahum yaddarraAAoon,
1049,Thumma baddalna makana assayyi-atialhasanata hatta AAafaw waqaloo qadmassa abaana addarraowassarrao faakhathnahum baghtatanwahum la yashAAuroon,
1050,Walaw anna ahla alqura amanoowattaqaw lafatahna AAalayhim barakatinmina assama-i wal-ardi walakinkaththaboo faakhathnahum bima kanooyaksiboon,
1051,Afaamina ahlu alqura an ya/tiyahumba/suna bayatan wahum na-imoon,
1052,Awa amina ahlu alqura an ya/tiyahumba/suna duhan wahum yalAAaboon,
1053,Afaaminoo makra Allahi falaya/manu makra Allahi illa alqawmu alkhasiroon,
1054,Awa lam yahdi lillatheena yarithoonaal-arda min baAAdi ahliha an law nashao asabnahumbithunoobihim wanatbaAAu AAala quloobihimfahum la yasmaAAoon,
1055,Tilka alqura naqussu AAalaykamin anba-iha walaqad jaat-hum rusuluhum bilbayyinatifama kanoo liyu/minoo bima kaththaboomin qablu kathalika yatbaAAu Allahu AAalaquloobi alkafireen,
1056,Wama wajadna li-aktharihimmin AAahdin wa-in wajadna aktharahum lafasiqeen,
1057,Thumma baAAathna min baAAdihim moosabi-ayatina ila firAAawna wamala-ihifathalamoo biha fanuthurkayfa kana AAaqibatu almufsideen,
1058,Waqala moosa yafirAAawnu innee rasoolun min rabbi alAAalameen,
1059,Haqeequn AAala an laaqoola AAala Allahi illa alhaqqa qadji/tukum bibayyinatin min rabbikum faarsil maAAiya banee isra-eel,
1060,Qala in kunta ji/ta bi-ayatinfa/ti biha in kunta mina assadiqeen,
1061,Faalqa AAasahu fa-ithahiya thuAAbanun mubeen,
1062,WanazaAAa yadahu fa-itha hiya baydaolinnathireen,
1063,Qala almalao min qawmi firAAawnainna hatha lasahirun AAaleem,
1064,Yureedu an yukhrijakum min ardikumfamatha ta/muroon,
1065,Qaloo arjih waakhahu waarsilfee almada-ini hashireen,
1066,Ya/tooka bikulli sahirin AAaleem,
1067,Wajaa assaharatufirAAawna qaloo inna lana laajran in kunnanahnu alghalibeen,
1068,Qala naAAam wa-innakum laminaalmuqarrabeen,
1069,Qaloo ya moosa immaan tulqiya wa-imma an nakoona nahnu almulqeen,
1070,Qala alqoo falamma alqaw saharooaAAyuna annasi wastarhaboohum wajaoobisihrin AAatheem,
1071,Waawhayna ila moosaan alqi AAasaka fa-itha hiya talqafu maya/fikoon,
1072,FawaqaAAa alhaqqu wabatala makanoo yaAAmaloon,
1073,Faghuliboo hunalika wanqalaboosaghireen,
1074,Waolqiya assaharatu sajideen,
1075,Qaloo amanna birabbialAAalameen,
1076,Rabbi moosa waharoon,
1077,Qala firAAawnu amantum bihiqabla an athana lakum inna hatha lamakrunmakartumoohu fee almadeenati litukhrijoo minha ahlahafasawfa taAAlamoon,
1078,LaoqatiAAanna aydiyakum waarjulakummin khilafin thumma laosallibannakum ajmaAAeen,
1079,Qaloo inna ila rabbinamunqaliboon,
1080,Wama tanqimu minna illaan amanna bi-ayati rabbinalamma jaatna rabbana afrigh AAalaynasabran watawaffana muslimeen,
1081,Waqala almalao min qawmi firAAawnaatatharu moosa waqawmahu liyufsidoo fee al-ardiwayatharaka waalihataka qala sanuqattilu abnaahumwanastahyee nisaahum wa-inna fawqahum qahiroon,
1082,Qala moosa liqawmihiistaAAeenoo billahi wasbiroo innaal-arda lillahi yoorithuha man yashaomin AAibadihi walAAaqibatu lilmuttaqeen,
1083,Qaloo ootheena minqabli an ta/tiyana wamin baAAdi ma ji/tana qalaAAasa rabbukum an yuhlika AAaduwwakum wayastakhlifakum feeal-ardi fayanthura kayfa taAAmaloon,
1084,Walaqad akhathna alafirAAawna bissineena wanaqsin mina aththamaratilaAAallahum yaththakkaroon,
1085,Fa-itha jaat-humu alhasanatuqaloo lana hathihi wa-in tusibhumsayyi-atun yattayyaroo bimoosa waman maAAahu alainnama ta-iruhum AAinda Allahi walakinnaaktharahum la yaAAlamoon,
1086,Waqaloo mahma ta/tinabihi min ayatin litasharana biha famanahnu laka bimu/mineen,
1087,Faarsalna AAalayhimu attoofanawaljarada walqummala waddafadiAAawaddama ayatin mufassalatinfastakbaroo wakanoo qawman mujrimeen,
1088,Walamma waqaAAa AAalayhimu arrijzuqaloo ya moosa odAAu lana rabbaka bimaAAahida AAindaka la-in kashafta AAanna arrijzalanu/minanna laka walanursilanna maAAaka banee isra-eel,
1089,Falamma kashafna AAanhumu arrijzaila ajalin hum balighoohu itha humyankuthoon,
1090,Fantaqamna minhum faaghraqnahumfee alyammi bi-annahum kaththaboo bi-ayatinawakanoo AAanha ghafileen,
1091,Waawrathna alqawma allatheenakanoo yustadAAafoona mashariqa al-ardiwamagharibaha allatee barakna feehawatammat kalimatu rabbika alhusna AAalabanee isra-eela bima sabaroo wadammarnama kana yasnaAAu firAAawnu waqawmuhu wamakanoo yaAArishoon,
1092,Wajawazna bibanee isra-eelaalbahra faataw AAala qawmin yaAAkufoona AAalaasnamin lahum qaloo ya moosaijAAal lana ilahan kama lahum alihatunqala innakum qawmun tajhaloon,
1093,Inna haola-i mutabbarun mahum feehi wabatilun ma kanoo yaAAmaloon,
1094,Qala aghayra Allahi abgheekumilahan wahuwa faddalakum AAala alAAalameen,
1095,Wa-ith anjaynakum min alifirAAawna yasoomoonakum soo-a alAAathabi yuqattiloona abnaakumwayastahyoona nisaakum wafee thalikum balaonmin rabbikum AAatheem,
1096,WawaAAadna moosa thalatheenalaylatan waatmamnaha biAAashrin fatamma meeqaturabbihi arbaAAeena laylatan waqala moosa li-akheehiharoona okhlufnee fee qawmee waaslih walatattabiAA sabeela almufsideen,
1097,Walamma jaa moosalimeeqatina wakallamahu rabbuhu qala rabbiarinee anthur ilayka qala lan taraneewalakini onthur ila aljabali fa-iniistaqarra makanahu fasawfa taranee falammatajalla rabbuhu liljabali jaAAalahu dakkan wakharra moosasaAAiqan falamma afaqa qala subhanakatubtu ilayka waana awwalu almu/mineen,
1098,Qala ya moosa innee istafaytukaAAala annasi birisalateewabikalamee fakhuth ma ataytuka wakunmina ashshakireen,
1099,Wakatabna lahu fee al-alwahimin kulli shay-in mawAAithatan watafseelanlikulli shay-in fakhuthha biquwwatin wa/mur qawmakaya/khuthoo bi-ahsaniha saoreekum daraalfasiqeen,
1100,Saasrifu AAan ayatiyaallatheena yatakabbaroona fee al-ardi bighayri alhaqqiwa-in yaraw kulla ayatin la yu/minoo bihawa-in yaraw sabeela arrushdi la yattakhithoohusabeelan wa-in yaraw sabeela alghayyi yattakhithoohusabeelan thalika bi-annahum kaththaboo bi-ayatinawakanoo AAanha ghafileen,
1101,Wallatheena kaththaboobi-ayatina waliqa-i al-akhiratihabitat aAAmaluhum hal yujzawna illama kanoo yaAAmaloon,
1102,Wattakhatha qawmu moosamin baAAdihi min huliyyihim AAijlan jasadan lahu khuwarunalam yaraw annahu la yukallimuhum wala yahdeehimsabeelan ittakhathoohu wakanoo thalimeen,
1103,Walamma suqita fee aydeehimwaraaw annahum qad dalloo qaloo la-in lam yarhamnarabbuna wayaghfir lana lanakoonanna mina alkhasireen,
1104,Walamma rajaAAa moosa ilaqawmihi ghadbana asifan qala bi/samakhalaftumoonee min baAAdee aAAajiltum amra rabbikum waalqa al-alwahawaakhatha bira/si akheehi yajurruhu ilayhi qalaibna omma inna alqawma istadAAafoonee wakadooyaqtuloonanee fala tushmit biya al-aAAdaa walatajAAalnee maAAa alqawmi aththalimeen,
1105,Qala rabbi ighfir lee wali-akheewaadkhilna fee rahmatika waanta arhamu arrahimeen,
1106,Inna allatheena ittakhathooalAAijla sayanaluhum ghadabun min rabbihim wathillatunfee alhayati addunya wakathalikanajzee almuftareen,
1107,Wallatheena AAamiloo assayyi-atithumma taboo min baAAdiha waamanoo innarabbaka min baAAdiha laghafoorun raheem,
1108,Walamma sakata AAan moosaalghadabu akhatha al-alwaha wafee nuskhatihahudan warahmatun lillatheena hum lirabbihimyarhaboon,
1109,Wakhtara moosaqawmahu sabAAeena rajulan limeeqatina falammaakhathat-humu arrajfatu qala rabbi lawshi/ta ahlaktahum min qablu wa-iyyaya atuhlikunabima faAAala assufahao minna in hiyailla fitnatuka tudillu biha man tashaowatahdee man tashao anta waliyyuna faghfirlana warhamna waanta khayru alghafireen,
1110,Waktub lana fee hathihiaddunya hasanatan wafee al-akhiratiinna hudna ilayka qala AAathabee oseebubihi man ashao warahmatee wasiAAat kulla shay-infasaaktubuha lillatheena yattaqoona wayu/toona azzakatawallatheena hum bi-ayatinayu/minoon,
1111,Allatheena yattabiAAoona arrasoolaannabiyya al-ommiyya allathee yajidoonahumaktooban AAindahum fee attawrati wal-injeeliya/muruhum bilmaAAroofi wayanhahum AAani almunkariwayuhillu lahumu attayyibati wayuharrimuAAalayhimu alkhaba-itha wayadaAAu AAanhum israhumwal-aghlala allatee kanat AAalayhim fallatheenaamanoo bihi waAAazzaroohu wanasaroohu wattabaAAooannoora allathee onzila maAAahu ola-ikahumu almuflihoon,
1112,Qul ya ayyuha annasuinnee rasoolu Allahi ilaykum jameeAAan allatheelahu mulku assamawati wal-ardila ilaha illa huwa yuhyee wayumeetufaaminoo billahi warasoolihi annabiyyial-ommiyyi allathee yu/minu billahi wakalimatihiwattabiAAoohu laAAallakum tahtadoon,
1113,Wamin qawmi moosa ommatun yahdoonabilhaqqi wabihi yaAAdiloon,
1114,WaqattaAAnahumu ithnatayAAashrata asbatan omaman waawhayna ilamoosa ithi istasqahu qawmuhu ani idribbiAAasaka alhajara fanbajasat minhu ithnataAAashrata AAaynan qad AAalima kullu onasin mashrabahum wathallalnaAAalayhimu alghamama waanzalna AAalayhimu almannawassalwa kuloo min tayyibati marazaqnakum wama thalamoona walakinkanoo anfusahum yathlimoon,
1115,Wa-ith qeela lahumu oskunoo hathihialqaryata wakuloo minha haythu shi/tum waqooloo hittatunwadkhuloo albaba sujjadan naghfir lakum khatee-atikumsanazeedu almuhsineen,
1116,Fabaddala allatheena thalamoominhum qawlan ghayra allathee qeela lahum faarsalnaAAalayhim rijzan mina assama-i bima kanooyathlimoon,
1117,Was-alhum AAani alqaryati allatee kanathadirata albahri ith yaAAdoona fee assabtiith ta/teehim heetanuhum yawma sabtihimshurraAAan wayawma la yasbitoona la ta/teehim kathalikanabloohum bima kanoo yafsuqoon,
1118,Wa-ith qalat ommatun minhumlima taAAithoona qawman Allahu muhlikuhum awmuAAaththibuhum AAathaban shadeedan qaloomaAAthiratan ila rabbikum walaAAallahum yattaqoon,
1119,Falamma nasoo ma thukkiroobihi anjayna allatheena yanhawna AAani assoo-iwaakhathna allatheena thalamoobiAAathabin ba-eesin bima kanoo yafsuqoon,
1120,Falamma AAataw AAan ma nuhooAAanhu qulna lahum koonoo qiradatan khasi-een,
1121,Wa-ith taaththana rabbukalayabAAathanna AAalayhim ila yawmi alqiyamati manyasoomuhum soo-a alAAathabi inna rabbaka lasareeAAu alAAiqabiwa-innahu laghafoorun raheem,
1122,WaqattaAAnahum fee al-ardiomaman minhumu assalihoona waminhum doona thalikawabalawnahum bilhasanati wassayyi-atilaAAallahum yarjiAAoon,
1123,Fakhalafa min baAAdihim khalfun warithooalkitaba ya/khuthoona AAarada hathaal-adna wayaqooloona sayughfaru lana wa-in ya/tihimAAaradun mithluhu ya/khuthoohu alam yu/khathAAalayhim meethaqu alkitabi an la yaqoolooAAala Allahi illa alhaqqa wadarasoo mafeehi waddaru al-akhiratu khayrun lillatheenayattaqoona afala taAAqiloon,
1124,Wallatheena yumassikoona bilkitabiwaaqamoo assalata inna lanudeeAAu ajra almusliheen,
1125,Wa-ith nataqna aljabalafawqahum kaannahu thullatun wathannooannahu waqiAAun bihim khuthoo ma ataynakumbiquwwatin wathkuroo ma feehi laAAallakumtattaqoon,
1126,Wa-ith akhatha rabbuka minbanee adama min thuhoorihim thurriyyatahumwaashhadahum AAala anfusihim alastu birabbikum qaloobala shahidna an taqooloo yawma alqiyamatiinna kunna AAan hatha ghafileen,
1127,Aw taqooloo innama ashraka abaonamin qablu wakunna thurriyyatan min baAAdihimafatuhlikuna bima faAAala almubtiloon,
1128,Wakathalika nufassilu al-ayatiwalaAAallahum yarjiAAoon,
1129,Watlu AAalayhim nabaa allatheeataynahu ayatina fansalakhaminha faatbaAAahu ashshaytanu fakanamina alghaween,
1130,Walaw shi/na larafaAAnahu bihawalakinnahu akhlada ila al-ardi wattabaAAahawahu famathaluhu kamathali alkalbi in tahmilAAalayhi yalhath aw tatruk-hu yalhath thalika mathalualqawmi allatheena kaththaboo bi-ayatinafaqsusi alqasasa laAAallahumyatafakkaroon,
1131,Saa mathalan alqawmu allatheenakaththaboo bi-ayatina waanfusahum kanooyathlimoon,
1132,Man yahdi Allahu fahuwa almuhtadeewaman yudlil faola-ika humu alkhasiroon,
1133,Walaqad thara/na lijahannamakatheeran mina aljinni wal-insi lahum quloobun layafqahoona biha walahum aAAyunun la yubsiroonabiha walahum athanun la yasmaAAoona bihaola-ika kal-anAAami bal hum adalluola-ika humu alghafiloon,
1134,Walillahi al-asmao alhusnafadAAoohu biha watharoo allatheenayulhidoona fee asma-ihi sayujzawna ma kanooyaAAmaloon,
1135,Wamimman khalaqna ommatun yahdoonabilhaqqi wabihi yaAAdiloon,
1136,Wallatheena kaththaboobi-ayatina sanastadrijuhum min haythula yaAAlamoon,
1137,Waomlee lahum inna kaydee mateen,
1138,Awa lam yatafakkaroo ma bisahibihimmin jinnatin in huwa illa natheerun mubeen,
1139,Awalam yanthuroo feemalakooti assamawati wal-ardiwama khalaqa Allahu min shay-in waan AAasaan yakoona qadi iqtaraba ajaluhum fabi-ayyi hadeethinbaAAdahu yu/minoon,
1140,Man yudlili Allahu falahadiya lahu wayatharuhum fee tughyanihimyaAAmahoon,
1141,Yas-aloonaka AAani assaAAatiayyana mursaha qul innama AAilmuhaAAinda rabbee la yujalleeha liwaqtiha illahuwa thaqulat fee assamawati wal-ardila ta/teekum illa baghtatan yas-aloonaka kaannaka hafiyyunAAanha qul innama AAilmuha AAinda Allahiwalakinna akthara annasi layaAAlamoon,
1142,Qul la amliku linafsee nafAAan waladarran illa ma shaa Allahuwalaw kuntu aAAlamu alghayba lastakthartu mina alkhayriwama massaniya assoo-o in ana illanatheerun wabasheerun liqawmin yu/minoon,
1143,Huwa allathee khalaqakum min nafsinwahidatin wajaAAala minha zawjaha liyaskunailayha falamma taghashshaha hamalathamlan khafeefan famarrat bihi falamma athqalatdaAAawa Allaha rabbahuma la-in ataytanasalihan lanakoonanna mina ashshakireen,
1144,Falamma atahumasalihan jaAAala lahu shurakaa feemaatahuma fataAAala AllahuAAamma yushrikoon,
1145,Ayushrikoona ma la yakhluqushay-an wahum yukhlaqoon,
1146,Wala yastateeAAoona lahum nasranwala anfusahum yansuroon,
1147,Wa-in tadAAoohum ila alhuda layattabiAAookum sawaon AAalaykum adaAAawtumoohum am antum samitoon,
1148,Inna allatheena tadAAoona min dooniAllahi AAibadun amthalukum fadAAoohumfalyastajeeboo lakum in kuntum sadiqeen,
1149,Alahum arjulun yamshoona biha amlahum aydin yabtishoona biha am lahum aAAyunun yubsiroonabiha am lahum athanun yasmaAAoona biha quliodAAoo shurakaakum thumma keedooni fala tunthiroon,
1150,Inna waliyyiya Allahu allatheenazzala alkitaba wahuwa yatawalla assaliheen,
1151,Wallatheena tadAAoona mindoonihi la yastateeAAoona nasrakum walaanfusahum yansuroon,
1152,Wa-in tadAAoohum ila alhuda layasmaAAoo watarahum yanthuroona ilayka wahumla yubsiroon,
1153,Khuthi alAAafwa wa/mur bilAAurfiwaaAArid AAani aljahileen,
